Title,Year,Rated,Genre(s),Plot
Birdman or (The Unexpected Virtue of Ignorance),2014,R,"Comedy, Drama","Actor Riggan Thomson is most famous for his movie role from over twenty years ago of the comic book superhero Birdman in the blockbuster movie of the same name and its two equally popular sequels. His association with the role took over his life, where Birdman is more renowned than ""Riggan Thomson"" the actor. Now past middle age, Riggan is trying to establish himself as a true artist by writing, directing, starring in and co-producing with his best friend Jake what is his Broadway debut, an adaptation of Raymond Carver's story, What We Talk About When We Talk About Love. He is staking his name, what little artistic reputation that comes with that name and his life savings on the project, and as such will do anything needed to make the play a success. As he and Jake go through the process of the previews toward opening night, Riggan runs into several issues: needing to find a replacement for the integral supporting male role the night before the first preview; hiring the talented Broadway name, Mike Shiner, for that role, Mike who ends up being difficult to work with and who may end up overshadowing Riggan in the play; having to deal potentially with a lawsuit based on one of his actions to ensure success; needing to be there for his daughter, Sam, who he has hired to be his production assistant and who has just come out of drug rehab; and pleasing the New York Times critic, Tabitha Dickinson, who wants to use any excuse to give the play a scathing review which in turn would close the show after the opening night performance. But Riggan's biggest problem may be his own insecurities, which are manifested by him constantly hearing what he believes to be the truth from the voice of his Birdman character, who he often battles both internally and externally."
Get Hard,2015,R,"Comedy, Crime","Kevin Hart plays the role of Darnell--a family man desperate to get enough money to buy a house in a better area to benefit his family's well-being. He is hired by James (Will Ferrell), a wimpy stock trader who is about to go to prison for 10 years, to prepare him for life behind bars. The catch is that James thinks Darnell is an ex-con--not because Darnell told him that, but because James just assumed."
A Million Ways to Die in the West,2014,R,"Comedy, Romance, Western","Set in 1882 in the American west, Albert is a lowly farmer with a nice girlfriend. But when she leaves him for the more successful and handsome owner of a moustachery store, Albert returns to his lonely daily life of trying to avoid death. Then the mysterious Anna rides into town and captures Albert's interest and heart, but with her deadly husband in town, Albert is going to have to become the western gun-slinging hero he never was. It won't be easy because there are a million ways to die in the west."
Plastic,2014,R,"Action, Comedy, Crime",Plastic is based on a true story where a gang of friends managed to infiltrate one of the biggest credit card companies in the World and pull off one of the biggest and most audacious Diamond Heists ever committed in British History. Plastic is Catch Me If You Can meets The Italian Job.
The Second Best Exotic Marigold Hotel,2015,PG,"Comedy, Drama","The Second Best Exotic Marigold Hotel is the expansionist dream of Sonny (Dev Patel), and it's making more claims on his time than he has available, considering his imminent marriage to the love of his life, Sunaina (Tina Desai). Sonny has his eye on a promising property now that his first venture, The Best Exotic Marigold Hotel for the Elderly and Beautiful, has only a single remaining vacancy - posing a rooming predicament for fresh arrivals Guy (Richard Gere) and Lavinia (Tamsin Greig). Evelyn and Douglas (Judi Dench and Bill Nighy) have now joined the Jaipur workforce, and are wondering where their regular dates for Chilla pancakes will lead, while Norman and Carol (Ronald Pickup and Diana Hardcastle) are negotiating the tricky waters of an exclusive relationship, as Madge (Celia Imrie) juggles two eligible and very wealthy suitors. Perhaps the only one who may know the answers is newly installed co-manager of the hotel, Muriel (Maggie Smith), the keeper of everyone's secrets. As the demands of a traditional Indian wedding threaten to engulf them all, an unexpected way forward presents itself."
Blackfish,2013,PG-13,"Documentary, Drama","Notorious killer whale Tilikum is responsible for the deaths of three individuals, including a top killer whale trainer. Blackfish shows the sometimes devastating consequences of keeping such intelligent and sentient creatures in captivity."
By the Gun,2014,R,"Crime, Drama, Thriller","Nick Tortano is a smooth-talking, ambitious criminal from the streets of Boston. After years spent working for and idolizing the Italian gangsters he finally proves himself to the boss and becomes a made man. However, once inside, Nick conflicts with a moneymaker for the Mafia and begins to drive a wedge between him and Boss."
A Girl Like Her,2015,PG-13,Drama,"16 year old Jessica Burns has a secret that she's afraid to share with anyone - except her best friend, Brian Slater. For the past year she's been victimized by another girl - her former friend, Avery Keller, one of South Brookdale High School's most popular and beautiful students. What can you do when the world sees the image of a person but not the reality? With Brian's help and a hidden digital camera, the evidence of Avery's relentless harassment is captured and finally exposed-bringing both girls and their families face to face with the truth."
Cold Comes the Night,2013,R,"Crime, Drama, Thriller",A struggling motel owner and her daughter are taken hostage by a nearly blind career criminal to be his eyes as he attempts to retrieve his cash package from a crooked cop.
Louis C.K. Oh My God,2013,TV-MA,"Documentary, Comedy","In February, 2013, Louis brings his impish nihilism to Phoenix, Arizona. He talks about an old lady and her pet, living in Manhattan, experiencing his body's aging (he's 45), men's fascination with women's breasts, the beauty of living outside the food chain, his quickness to anger while driving, and murder. It's theater in the round, so he's in constant motion, a grin nearly always on his face."
The Amazing Spider-Man 2,2014,PG-13,"Action, Adventure, Sci-Fi","We've always known that Spider-Man's most important conflict has been within himself: the struggle between the ordinary obligations of Peter Parker and the extraordinary responsibilities of Spider-Man. But in The Amazing Spider-Man 2, Peter Parker finds that his greatest battle is about to begin. It's great to be Spider-Man. For Peter Parker, there's no feeling quite like swinging between skyscrapers, embracing being the hero, and spending time with Gwen. But being Spider-Man comes at a price: only Spider-Man can protect his fellow New Yorkers from the formidable villains that threaten the city. With the emergence of Electro, Peter must confront a foe far more powerful than he. And as his old friend, Harry Osborn, returns, Peter comes to realize that all of his enemies have one thing in common: Oscorp."
The Sessions,2012,R,"Biography, Comedy, Drama","At the age of 38, Mark O'Brien, a man who uses an iron lung, decides he no longer wishes to be a virgin. With the help of his therapist and his priest, he contacts Cheryl Cohen-Greene, a professional sex surrogate and a typical soccer mom with a house, a mortgage and a husband. Inspired by a true story, The Sessions, follows the fascinating relationship which evolves between Cheryl and Mark as she takes him on his journey to manhood."
Song of the Sea,2014,PG,"Animation, Adventure, Drama","Saoirse is a child who is the last of the selkies, women in Irish and Scottish legends who transform from seals into people. She escapes from her grandmother's home to journey to the sea and free fairy creatures trapped in the modern world."
Safety Not Guaranteed,2012,R,"Comedy, Drama, Romance","Darius is a young intern at a Seattle-based magazine and jumps at the chance to investigate the author of a classified ad seeking someone to travel back in time with. Along with Jeff, the staff writer, and Arnau, a fellow intern, the three go on a road trip to a coastal town. While Jeff just wants to chase after his high school crush and Arnau wants some kind of life experience, Darius spends her time with Kenneth, a man who believes that he has built a time machine. The closer they become and the more they understand about each other, the less clear it becomes if Kenneth is just crazy or if he actually is going to successfully travel back in time."
Undefeated,2011,PG-13,"Documentary, Sport","A documentary that follows the Manassas Tigers football team, a severely underfunded and underprivileged football team -- who were even hired out as a practice team for more successful schools -- as they reverse their fortunes, thanks to coach Bill Courtney."
Turbo,2013,PG,"Animation, Adventure, Comedy","After a freak accident infuses him with the power of super-speed, Turbo kicks into overdrive and embarks on an extraordinary journey to achieve the seemingly impossible: competing in the world's fastest race, the Indianapolis 500. With the help of his tricked-out streetwise snail crew, this ultimate underdog puts his heart and shell on the line to prove that no dream is too big, and no dreamer too small."
To Rome with Love,2012,R,"Comedy, Romance","In Rome, the America tourist Hayley meets the local lawyer Michelangelo on the street and soon they fall in love with each other. Hayley's parents, the psychiatrist Phyllis and the retired music producer Jerry, travel to Rome to meet Michelangelo and his parents. When Jerry listens to Michelangelo's father Giancarlo singing opera in the shower, he is convinced that he is a talented opera singer. But there is a problem: Giancarlo can only sing in the shower. The couple Antonio and Milly travel to Rome to meet Antonio's relatives that belong to the high society. Milly goes to the hairdresser while Antonio waits for her in the room. Milly gets lost in Rome and the prostitute Anna mistakenly goes to Antonio's room. Out of the blue, his relatives arrive in the room and they believe Anna is Antonio's wife. Meanwhile the shy Milly meets her favorite actor Luca Salta (Antonio Albanese) and goes to his hotel room ""to discuss about movies"". One day, the middle-class clerk Leopoldo becomes a celebrity and is hunted by the paparazzo. A couple of days later, he is forgotten by the media. The American architect John travels to Rome with his wife and feels nostalgic since he lived in the city thirty years ago when he was a student. He meets the student of architecture Jack, who lives on the same street that John had lived, and he invited to drink a coffee at his house. Jack lives with his girlfriend Sally (Greta Gerwig) that invites her best friend Monica to stay with them in their house. But soon Jack has a crush on Monica."
Resident Evil: Retribution,2012,R,"Action, Horror, Sci-Fi","Alice awakes at home with her daughter Becky and her husband. But soon she realizes that she is actually in an Umbrella Corporation's underground facility. Out of the blue, the computer security system shuts-down and Alice flees to the central control room of the facility. She meets Ada Wong, who works with Albert Wesker, and she learns that a five-man team has been sent by Wesker to rescue them. However, the Red Queen sends Jill Valentine and Rain to hunt them down."
End of Watch,2012,R,"Action, Crime, Drama","In South Central Los Angeles, street cops Brian and Mike are partners - balls-out cowboys patrolling the streets as Latino gangs are in a power struggle with Blacks. Brian and Mike get lucky a couple of times, making big drug and human-trafficking busts, so a Mexican cartel orders their deaths. We meet Mike's pregnant wife (whom he married out of high school) and watch Brian's search for a soul mate. There are internal squabbles within the ranks of the LAPD and lots of squad-car conversation. Can the lads escape the cartel's murderous reach?"
Percy Jackson: Sea of Monsters,2013,PG,"Adventure, Family, Fantasy","In this retelling of Rick Riordans book, ""The Sea of Monsters"", Percy Jackson, accompanied by his friends Annabeth Chase, Clarisse La Rue and Tyson, his half brother, goes on a journey to the Sea of Monsters to retrieve the Golden Fleece and save Camp Half-Blood."
Snow White,2012,PG-13,"Drama, Fantasy","A band of bullfighting dwarfs save the life of a young woman with amnesia. They end up taking her under their wing when they find out that she has seemingly natural skills as a bullfighter, upon which they can capitalize not only for their act but for her own personal gain. As she does not know her name or background, the dwarfs coin her Blancanieves, after the famed fairy tale. What they are all unaware of is that she is really Carmen, the daughter of the once great matador, Antonio Villalta. On the day Carmen was born, her father suffered a career ending accident, and her mother died in childbirth. Her father quickly remarried his nurse, the evil Encarna. Although raised by her grandmother during her early years, Carmen, following the death of her grandmother, went to live with Encarna while an adolescent, Encarna who treated her as a slave. Carmen eventually found her disabled father, who was hidden away and treated poorly by Encarna. In the meantime, Encarna was cavorting with the household chauffeur while living off her husband's riches. Antonio did pass along to Carmen the art of bullfighting. As Blancanieves teeters on the brink of fame as a matador, her life may be placed in jeopardy if Encarna learns who she is, as Encarna believed Carmen was dead since she was the one who ordered her murder at the hands of the chauffeur."
You're Next,2011,R,"Horror, Thriller","When a gang of masked, ax-wielding murderers descend upon the Davison family reunion, the hapless victims seem trapped... until an unlikely guest of the family proves to be the most talented killer of all."
Django Unchained,2012,R,"Drama, Western","A German dentist buys the freedom of a slave and trains him with the intent to make him his deputy bounty hunter. Instead, he is led to the site of the slave's wife who belongs to a ruthless plantation owner."
Why Stop Now?,2012,R,"Comedy, Drama","The story of Eli Smith (Jesse Eisenberg), a piano prodigy, dealing with his troubled mother, Penny (Melissa Leo), and enlisting help from a hapless drug dealer, Sprinkles (Tracy Morgan), on the day he has an audition for a prestigious music program. Events spiral comically out of control as this gang of misfits faces the mistakes of the past, the challenges of the future, and the possibilities of love."
The Loft,2014,R,"Mystery, Romance, Thriller","The architect Vincent Stevens; the psychiatrist Chris Vanowen; the real estate agents Luke Seacord and Marty Landry; and Chris' half-brother Philip Trauner are married and best friends. Vincent has designed a brand new building and proposes that he and his friends share one of the wonderful penthouse lofts. This would allow them to hook up with other women without worrying about hotel charges showing up on their credit cards. When they discover the body of a beautiful woman cuffed on the bed in the loft, they argue over whom is responsible and secrets are disclosed affecting their friendship."
Game Change,2012,TV-MA,"Biography, Drama, History","Summer, 2008: John McCain secures the nomination, but polls behind Barack Obama. Strategist Steve Schmidt suggests a game changer: picking a conservative female with media savvy, unknown Alaska governor Sarah Palin, as vice president. She's an immediate hit and a quick study - the gap closes. Then, Tina Fey's impersonation, a raft of criticism, and missing her family send Palin into a near-catatonic state: she doesn't prepare for her Katie Couric interview and bombs. Schmidt searches for an answer: don't expect her to learn the issues, but give her a script. Palin does well in the debate with Biden; she finds her voice, goes off script, and goes rogue. A mistake?"
Bad Karma,2012,R,Thriller,Reformed criminal gets blackmailed into doing one last job when former partner crawls out of the woodwork.
Ai Weiwei: Never Sorry,2012,R,Documentary,"AI WEIWEI: NEVER SORRY is the first feature-length film about the internationally renowned Chinese artist and activist, Ai Weiwei. In recent years, Ai has garnered international attention as much for his ambitious artwork as his political provocations. AI WEIWEI: NEVER SORRY examines this complex intersection of artistic practice and social activism as seen through the life and art of China's preeminent contemporary artist. From 2008 to 2010, Beijing-based journalist and filmmaker Alison Klayman gained unprecedented access to Ai Weiwei. Klayman documented Ai's artistic process in preparation for major museum exhibitions, his intimate exchanges with family members and his increasingly public clashes with the Chinese government. Klayman's detailed portrait of the artist provides a nuanced exploration of contemporary China and one of its most compelling public figures."
Inescapable,2012,R,"Action, Drama, Mystery","One afternoon, on a typical day at work, Adib is confronted with devastating news: His eldest daughter, Muna, has gone missing in Damascus. Now Adib, who has not been back in over 20 years, must return to Syria and deal with his secret past in order to find her. Inescapable is a thriller about a father's desperate search for his daughter and the chaos of the Middle East he left behind."
Captain America: The Winter Soldier,2014,PG-13,"Action, Adventure, Sci-Fi","For Steve Rogers, awakening after decades of suspended animation involves more than catching up on pop culture; it also means that this old school idealist must face a world of subtler threats and difficult moral complexities. That becomes clear when Director Nick Fury is killed by the mysterious assassin, the Winter Soldier, but not before warning Rogers that SHIELD has been subverted by its enemies. When Rogers acts on Fury's warning to trust no one there, he is branded as a traitor by the organization. Now a fugitive, Captain America must get to the bottom of this deadly mystery with the help of the Black Widow and his new friend, The Falcon. However, the battle will be costly for the Sentinel of Liberty, with Rogers finding enemies where he least expects them while learning that the Winter Soldier looks disturbingly familiar."
Divergent,2014,PG-13,"Adventure, Mystery, Sci-Fi","Set in a futuristic dystopia where society is divided into five factions that each represent a different virtue, teenagers have to decide if they want to stay in their faction or switch to another - for the rest of their lives. Tris Prior makes a choice that surprises everyone. Then Tris and her fellow faction-members have to live through a highly competitive initiation process to live out the choice they have made. They must undergo extreme physical and intense psychological tests, that transform them all. But Tris has a secret that she is Divergent, which means she doesn't fit into any one group. If anyone knew, it would mean a certain death. As she discovers a growing conflict that threatens to unravel her seemingly peaceful society, this secret might help her save the people she loves... or it might destroy her."
Ruby Sparks,2012,R,"Comedy, Drama, Fantasy","Calvin is a genius novelist who begins to type a new novel on his manual typewriter about Ruby, his dream girl. He can't believe his eyes, because the next day, Ruby becomes a real person, and they begin to have a beautiful relationship together. If the relationship isn't perfect, all Calvin has to do is simply type the words on the page and Ruby's actions change to what he needs."
Gone,2012,PG-13,"Drama, Mystery, Thriller","When her sister disappears, Jill is convinced the serial killer who kidnapped her two years ago has returned, and she sets out to once again face her abductor."
Winter's Tale,2014,PG-13,"Drama, Fantasy, Mystery","New York City is subsumed in arctic winds, dark nights, and white lights, its life unfolds, for it is an extraordinary hive of the imagination, the greatest house ever built, and nothing exists that can check its vitality. One night in winter, Peter Lake (Colin Farrell), orphan and master-mechanic, attempts to rob a fortress-like mansion on the Upper West Side. Though he thinks the house is empty, the daughter of the house is home. Thus begins the love between Peter, an Irish burglar in his early 20's, and Beverly Penn (Jessica Brown Findlay), a young girl, who is dying."
Passion,2012,R,"Drama, Horror, Mystery",The rivalry between the manipulative boss of an advertising agency and her talented protégée escalates from stealing credit to public humiliation to murder.
Évocateur: The Morton Downey Jr. Movie,2012,R,Documentary,"Long before O'Reilly and Beck, Morton Downey, Jr., was tearing up the talk-show format with his divisive populism. Between the fistfights, rabid audience, and Mort's cigarette smoke always ""in your face,"" The Morton Downey Jr. Show was billed as ""3-D television,"" ""rock and roll without the music."" Évocateur meditates on the hysteria that ended the '80s and ultimately its most notorious agitator."
RED 2,2013,PG-13,"Action, Comedy, Crime","Retired CIA agent Frank Moses is in love with Sarah Ross and enjoying their normal life. Out of the blue, Marvin Boggs meets Frank in the supermarket and tells that Wikileaks has released the information that they had participated and know the whereabouts of the Nightshade, a portable nuclear weapon that was smuggled in pieces and hidden in Russia. Now the top agents in the world are under contract to seek them out to discover where Nightshade is. The trio travels to Paris and teams-up with the Russian Katja to track down the former Russian Agent 'The Frog' to get more information about the operation. They learn that the brilliant inventor Dr. Edward Bailey might know where the weapon is. They discover that Bailey has been interned in an asylum in London by the MI-6 for thirty-two years and the British Victoria joins the team. They rescue Bailey and find that the nuclear device is hidden in the Kremlin. Soon the dangerous South Korean Han joins the group expecting to retrieve the weapon. But dangerous killer Jack Horton is hunting Frank down and will not stop until he recovers the nuclear bomb."
Nebraska,2013,R,"Adventure, Comedy, Drama","""NEBRASKA"" is a father and son road trip, from Billings, Montana to Lincoln, Nebraska that gets waylaid at a small town in central Nebraska, where the father grew up and has scores to settle. Told with deadpan humor and a unique visual style, it's ultimately the story of a son trying to get through to a father he doesn't understand."
The Place Beyond the Pines,2012,R,"Crime, Drama, Thriller","A mysterious and mythical motorcycle racer, Luke, (Ryan Gosling) drives out of a traveling carnival globe of death and whizzes through the backstreets of Schenectady, New York, desperately trying to connect with a former lover, Romina, (Eva Mendes) who recently and secretly gave birth to the stunt rider's son. In an attempt to provide for his new family, Luke quits the carnival life and commits a series of bank robberies aided by his superior riding ability. The stakes rise as Luke is put on a collision course with an ambitious police officer, Avery Cross, (Bradley Cooper) looking to quickly move up the ranks in a police department riddled with corruption. The sweeping drama unfolds over fifteen years as the sins of the past haunt the present days lives of two high school boys wrestling with the legacy they've inherited. The only refuge is found in the place beyond the pines."
After Earth,2013,PG-13,"Action, Adventure, Sci-Fi","One thousand years after cataclysmic events forced humanity's escape from Earth, Nova Prime has become mankind's new home. Legendary General Cypher Raige returns from an extended tour of duty to his estranged family, ready to be a father to his 13-year-old son, Kitai. When an asteroid storm damages Cypher and Kitai's craft, they crash-land on a now unfamiliar and dangerous Earth. As his father lies dying in the cockpit, Kitai must trek across the hostile terrain to recover their rescue beacon. His whole life, Kitai has wanted nothing more than to be a soldier like his father. Today, he gets his chance."
Admission,2013,PG-13,"Comedy, Drama, Romance","Straitlaced Princeton University admissions officer Portia Nathan (Tina Fey) is caught off-guard when she makes a recruiting visit to an alternative high school overseen by her former college classmate, the freewheeling John Pressman (Paul Rudd). Pressman has surmised that Jeremiah (Nat Wolff), his gifted yet very unconventional student, might well be the son that Portia secretly gave up for adoption many years ago. Soon, Portia finds herself bending the rules for Jeremiah, putting at risk the life she thought she always wanted -- but in the process finding her way to a surprising and exhilarating life and romance she never dreamed of having."
Unbroken,2014,PG-13,"Biography, Drama, Sport","The life of Louis Zamperini, an Olympic athlete who joined the armed forces during the second world war. Only to be captured by the Japanese navy after a plane crash in the Pacific. During his capture, Louie must continue his fight by surviving through the war."
