Title,Year,Rated,Genre(s),Plot
Toy Story,1995,G,"Animation, Adventure, Comedy","A little boy named Andy loves to be in his room, playing with his toys, especially his doll named ""Woody"". But, what do the toys do when Andy is not with them, they come to life. Woody believes that he has life (as a toy) good. However, he must worry about Andy's family moving, and what Woody does not know is about Andy's birthday party. Woody does not realize that Andy's mother gave him an action figure known as Buzz Lightyear, who does not believe that he is a toy, and quickly becomes Andy's new favorite toy. Woody, who is now consumed with jealousy, tries to get rid of Buzz. Then, both Woody and Buzz are now lost. They must find a way to get back to Andy before he moves without them, but they will have to pass through a ruthless toy killer, Sid Phillips."
Jumanji,1995,PG,"Adventure, Family, Fantasy","After being trapped in a jungle board game for 26 years, a Man-Child wins his release from the game. But, no sooner has he arrived that he is forced to play again, and this time sets the creatures of the jungle loose on the city. Now it is up to him to stop them."
Grumpier Old Men,1995,PG-13,"Comedy, Romance","Things don't seem to change much in Wabasha County: Max and John are still fighting after 35 years, Grandpa still drinks, smokes, and chases women , and nobody's been able to catch the fabled ""Catfish Hunter"", a gigantic catfish that actually smiles at fishermen who try to snare it. Six months ago John married the new girl in town (Ariel), and people begin to suspect that Max might be missing something similar in his life. The only joy Max claims is left in his life is fishing, but that might change with the new owner of the bait shop."
Waiting to Exhale,1995,R,"Comedy, Drama, Romance","This story based on the best selling novel by Terry McMillan follows the lives of four African-American women as they try to deal with their very lives. Friendship becomes the strongest bond between these women as men, careers, and families take them in different directions. Often light-hearted this movie speaks about some of the problems and struggles the modern women face in today's world."
Father of the Bride Part II,1995,PG,"Comedy, Family, Romance","In this sequel to ""Father of the Bride"", George Banks must accept the reality of what his daughter's ascension from daughter to wife, and now, to mother means when placed into perspective against his own stage of life. As the comfortable family unit starts to unravel in his mind, a rapid progression into mid-life crisis is in his future. His journey to regain his youth acts as a catalyst for a kind of ""rebirth"" of his attitude on life when he and his wife, Nina, find how their lives are about to change as well."
Tom and Huck,1995,PG,"Adventure, Comedy, Drama","A mischievous young boy, Tom Sawyer (Jonathan Taylor Thomas, witnesses a murder by the deadly Injun Joe. Tom becomes friends with Huckleberry Finn (Brad Renfro, a boy with no future and no family. Tom has to choose between honoring a friendship or honoring an oath because the town alcoholic is accused of the murder. Tom and Huck go through several adventures trying to retrieve evidence."
Sudden Death,1995,R,"Action, Crime, Thriller",Some terrorists kidnap the Vice President of the United States and threaten to blow up the entire stadium during the final game of the NHL Stanley Cup. There is only one way and one man to stop them...
GoldenEye,1995,PG-13,"Action, Adventure, Thriller","When a deadly satellite weapon system falls into the wrong hands, only Agent 007 can save the world from certain disaster. Armed with his license to kill, Bond races to Russia in search of the stolen access codes for ""Goldeneye,"" an awesome space weapon that can fire a devastating electromagnetic pulse toward Earth. But 007 is up against an enemy who anticipates his every move: a mastermind motivated by years of simmering hatred. Bond also squares off against Xenia Onatopp, an assassin who uses pleasure as her ultimate weapon."
Balto,1995,G,"Animation, Adventure, Drama","A half-wolf, half-husky named Balto gets a chance to become a hero when an outbreak of diphtheria threatens the children of Nome, Alaska in the winter of 1925. He leads a dog team on a 600-mile trip across the Alaskan wilderness to get medical supplies. The film is based on a true story which inspired the Iditarod dog sled race."
Nixon,1995,R,"Biography, Drama, History","Director Oliver Stone's exploration of former president Richard Nixon's strict Quaker upbringing, his nascent political strivings in law school, and his strangely self-effacing courtship of his wife, Pat. The contradictions in his character are revealed early, in the vicious campaign against Helen Gahagan Douglas and the oddly masochistic Checkers speech. His defeat at the hands of the hated and envied John F. Kennedy in the 1960 presidential election, followed by the loss of the 1962 California gubernatorial race, seem to signal the end of his career. Yet, although wholly lacking in charisma, Nixon remains a brilliant political operator, seizing the opportunity provided by the backlash against the antiwar movement to take the presidency in 1968. It is only when safely in office, running far ahead in the polls for the 1972 presidential election, that his growing paranoia comes to full flower, triggering the Watergate scandal."
Cutthroat Island,1995,PG-13,"Action, Adventure, Comedy","Morgan Adams and her slave, William Shaw, are on a quest to recover the three portions of a treasure map. Unfortunately, the final portion is held by her murderous uncle, Dawg. Her crew is skeptical of her leadership abilities, so she must complete her quest before they mutiny against her. This is made yet more difficult by the efforts of the British crown to end her piratical raids."
Casino,1995,R,"Crime, Drama","This Martin Scorsese film depicts the Janus-like quality of Las Vegas--it has a glittering, glamorous face, as well as a brutal, cruel one. Ace Rothstein and Nicky Santoro, mobsters who move to Las Vegas to make their mark, live and work in this paradoxical world. Seen through their eyes, each as a foil to the other, the details of mob involvement in the casinos of the 1970's and '80's are revealed. Ace is the smooth operator of the Tangiers casino, while Nicky is his boyhood friend and tough strongman, robbing and shaking down the locals. However, they each have a tragic flaw--Ace falls in love with a hustler, Ginger, and Nicky falls into an ever-deepening spiral of drugs and violence."
Sense and Sensibility,1995,PG,"Drama, Romance","When Mr. Dashwood dies, he must leave the bulk of his estate to the son by his first marriage, which leaves his second wife and their three daughters (Elinor, Marianne, and Margaret) in straitened circumstances. They are taken in by a kindly cousin, but their lack of fortune affects the marriageability of both practical Elinor and romantic Marianne. When Elinor forms an attachment for the wealthy Edward Ferrars, his family disapproves and separates them. And though Mrs. Jennings tries to match the worthy (and rich) Colonel Brandon to her, Marianne finds the dashing and fiery John Willoughby more to her taste. Both relationships are sorely tried."
Four Rooms,1995,R,Comedy,"This movie features the collaborative directorial efforts of four new filmmakers, each of whom directs a segment of this comedy. It's New Year's Eve at the Mon Signor Hotel, a former grand old Hollywood hotel, now fallen upon hard times. Often using physical comedy and sight gags, this movie chronicles the slapstick misadventures of Ted, the Bellhop. He's on his first night on the job, when he's asked to help out a coven of witches in the Honeymoon Suite. Things only get worse when he delivers ice to the wrong room and ends up in a domestic argument at a really bad time. Next, he foolishly agrees to watch a gangster's kids for him while he's away. Finally, he finishes off the night refereeing a ghastly wager."
Ace Ventura: When Nature Calls,1995,PG-13,"Adventure, Comedy, Crime","Ace Ventura, emerging from self-imposed exile in a remote Himalayan hideaway, travels to Africa with explorer Fulton Greenwall to find a sacred bat which is told will avert a war between with Wachootoo and Wachati tribes. Of course, when Ace gets involved, all hell breaks loose..."
Money Train,1995,R,"Action, Comedy, Crime","Two foster brothers work as transit cops. While one's life is as good as it gets, the other's is a pit. After losing his job, getting dumped by his brother, and getting the crap kicked out of him by a loan shark for the umpteenth time, He implements his plan to steal the ""money train,"" a train carrying the New York Subway's weekly revenue. But when things go awry, will his brother be able to save him in time?"
Get Shorty,1995,R,"Comedy, Crime, Thriller","Some guys get all the luck, whether they like it or not. Chili Palmer happens to be in Hollywood collecting a gambling debt when he's struck by lightning (not literally). Called a natural for the movie business, he's snagged up by a producer. The rest is history."
Copycat,1995,R,"Drama, Mystery, Thriller","In San Francisco, the criminal psychologist Helen Hudson is specialized in serial-killers. During a trial, the accused Daryll Lee Cullum kills a police officer and tries to kill her and she becomes agoraphobic. Now Helen lives a reclusive life with her gay friend Andy that helps her. Sometime later, there is a wave of crimes and Detectives M.J. Monahan and Reuben Goetz are investigating the murder cases. Helen identifies that the murderer is copycatting notorious serial-killers and she anonymously contacts the Police Department. After fourteen phone calls, she is identified by the police. Detectives M.J. and Reuben visit her and Helen teams up with them and prepares the profile of the killer that wants to be famous. But soon the copycat killer Peter Foley contacts and stalks Helen and M.J. and Reuben give protection to her. Will they be capable to stop Foley before the next murder?"
Assassins,1995,R,"Action, Crime, Thriller","Robert Rath is a seasoned hitman who just wants out of the business with no back talk. But, as things go, it ain't so easy. A younger, peppier assassin named Bain is having a field day trying to kill said older assassin. Rath teams up with a computer hacker named Electra to defeat the obsessed Bain."
Powder,1995,PG-13,"Drama, Fantasy, Mystery","When sheriff Barnum investigates the death of an elderly rural resident, he discovers a teenage grandson living in the basement. Raised by his grandparents, he has experienced the world only through books, never leaving the family farm. He is sent to a state home for boys where he has trouble fitting in socially. His odd appearance and unusual abilities cause the small town residents to fear and ridicule him. However, not all are afraid. Some begin to view his potential and gifts with wonderment."
Leaving Las Vegas,1995,R,"Drama, Romance","Because his wife left him and took his son with her, screenwriter Ben Sanderson has started drinking, a lot. He's getting more and more isolated and he troubles women in bars because he wants to have sex with them. When he gets fired, he decides to leave everything behind and move to Las Vegas and drink himself to death. In Las Vegas he meets Sera, a prostitute with some problems as well who he moves in with."
Othello,1995,R,"Drama, Romance","Iago convinces Othello, The Moor of Venice that his wife, Desdemona has been unfaithful. Iago is an evil, manipulative character with his own agenda. A plot of jealousy and rage transpires in this classic Shakespearean tale."
Now and Then,1995,PG-13,"Comedy, Drama, Romance","Roberta, Teeny, Samantha and Chrissy have been busy growing up, but they always remembered the promise they made to be there for each other. Now they're together again to relive the greatest summer of their lives."
Persuasion,1995,PG,"Drama, Romance","Eight years earlier, Anne Elliot, the daughter of a financially troubled aristocratic family, was persuaded to break off her engagement to Frederick Wentworth, a young seaman, who, though ..."
The City of Lost Children,1995,R,"Fantasy, Sci-Fi","Set in a dystopian society, someone is kidnapping the children. Krank and his band of clones are using the children to harvest their dreams. Then they kidnap Denree, the brother of One, a fairground strongman. One sets out to find his brother."
Shanghai Triad,1995,R,"Crime, Drama, Romance","Uncle Liu brings his cousin to Shanghai to work for 'Boss,' the leader of a powerful drug empire in the 1930's. Shuisheng, a simple country boy is awed and overwhelmed by the opulence and immense wealth he is suddenly surrounded by. He is to be the attendant of Xiao Jingbao, the new mistress of 'Boss.' While he fumbles with the demands of his new role, much intrigue is going on around him, well beyond his bewildered perception. Xiao Jingbao is having a tumultuous affair, Fat Yu is starting a gang war, and 'Boss' is beginning to suspect that one of his trusted men is not loyal."
Dangerous Minds,1995,R,"Biography, Drama","Louanne Johnson is an ex-marine, hired as a teacher in a high-school in a poor area of the city. She has recently separated from her husband. Her friend, also teacher in the school, got the temporary job for her. After a terrible reception from the students, she tries unconventional methods of teaching (using karate, Bob Dylan lyrics etc) to gain the trust of the students."
Twelve Monkeys,1995,R,"Mystery, Sci-Fi, Thriller","An unknown and lethal virus has wiped out five billion people in 1996. Only 1% of the population has survived by the year 2035, and is forced to live underground. A convict (James Cole) reluctantly volunteers to be sent back in time to 1996 to gather information about the origin of the epidemic (who he's told was spread by a mysterious ""Army of the Twelve Monkeys"") and locate the virus before it mutates so that scientists can study it. Unfortunately Cole is mistakenly sent to 1990, six years earlier than expected, and is arrested and locked up in a mental institution, where he meets Dr. Kathryn Railly, a psychiatrist, and Jeffrey Goines, the insane son of a famous scientist and virus expert."
Babe,1995,G,"Comedy, Drama, Family","Gentle farmer Arthur Hoggett wins a piglet named Babe at a county fair. Narrowly escaping his fate as Christmas dinner when Farmer Hoggett decides to show him at the next fair, Babe bonds with motherly border collie Fly and discovers that he too can herd sheep. But will the other farm animals, including Fly's jealous husband Rex, accept a pig who doesn't conform to the farm's social hierarchy?"
Carrington,1995,R,"Biography, Drama, Romance","The story of the relationship between painter Dora Carrington and author Lytton Strachey in a World War One England of cottages and countryside. Although platonic due to Strachey's homosexuality, the relationship was nevertheless a deep and complicated one. When Carrington did develop a more physical relationship with soldier Ralph Partridge, Strachey was able to welcome him as a friend, although Partridge remained somewhat uneasy, not so much with Strachey's sexual orientation as with the fact that he was a conscientious objector."
Dead Man Walking,1995,R,"Crime, Drama","A convicted murderer on Death Row and the nun who befriends him. Through the portrayal of finely drawn characters and their interactions as the days, hours, and minutes tick down to the condemned man's execution, powerful emotions are unleashed. While Matthew Poncelet and Sister Prejean desperately try to gain a stay of execution from the governor or the courts, scenes are intercut from the brutal crime, gradually revealing the truth about the events that transpired. In addition to her temporal help, the nun also tries to reach out spiritually and assist as a guide to salvation."
Across the Sea of Time,1995,G,"Adventure, Drama, Family","A young Russian boy, Thomas Minton, travels to New York as a passenger on a Russian freighter. Close to Ellis Island he gets off and thus starts his journey to America the same way as all immigrants in former times. Thomas is searching for the family of one of his ancestors, who had emigrated decades ago, but once sent a letter home together with a sample of his new profession: 3D-Photography. The boy follows his relative's traces by counter-checking the old 3D-Photographs of New York (using an antique viewer) with the same places and how they look today. This way, the audience gets to see the Big Apple in former times as well as today."
It Takes Two,1995,PG,"Comedy, Family, Romance","Alyssa (a rich girl) and Amanda (an orphan) are two little girls who are identical, but complete strangers, that accidentally meet one day. In an attempt to stop Alyssa's father from getting married to Clarice, a conceited know-it-all, the girls get him to meet Amanda's case worker and switch lives to stop the wedding once and for all. Though things don't go exactly as planned when Alyssa gets adopted and Clarice moves up the wedding..."
Clueless,1995,PG-13,"Comedy, Romance","Cher, a high school student in Beverly Hills, must survive the ups and downs of adolescent life. Her external demeanor at first seems superficial, but rather it hides her wit, charm, and intelligence which help her to deal with relationships, friends, family, school, and the all-important teenage social life."
"Cry, the Beloved Country",1995,PG-13,"Drama, Thriller","South African church minister Steven Kumalo is summoned from his village to Johannesburg. There he finds that his son Absolom has been jailed in connection with a robbery in which a white man was killed. The father of the white man, James Jarvis, is a supporter of apartheid, the separation of the races which is the law of South Africa. When they encounter each other, both Kumalo and Jarvis come to unexpected realizations not only about their sons, but about the nature of their own humanity."
Richard III,1995,R,"Drama, Sci-Fi, War","William Shakespeare's classic play is brought into the present with the setting as Great Britian in the 1930s. Civil war has erupted with the House of Lancaster on one side, claiming the right to the British throne and hoping to bring freedom to the country. Opposing is the House of York, commanded by the infamous Richard who rules over a fascist government and hopes to install himself as a dictator monarch."
Dead Presidents,1995,R,"Action, Crime, Drama","This action film, directed by the Hughes brothers, depicts a heist of old bills, retired from circulation and destined by the government to be ""money to burn."" However, more broadly, it addresses the issues of Black Americans' involvement in the Vietnam War and their subsequent disillusionment with progress in social issues and civil rights back home in the United States, during the 1960's."
Restoration,1995,R,"Biography, Drama, History","An aspiring young physician, Robert Merivel found himself in the service of King Charles II and saves the life of a spaniel dear to the King. Merivel joins the King's court and lives the high life provided to someone of his position. Merivel is ordered to marry one of the King's mistresses in order to divert the suspicions of another one of his mistresses. He is given one order by the king and that is not to fall in love. The situation worsens when Merivel finds himself in love with his new wife. Eventually, the King finds out and relieves Merivel of his position and wealth. His fall from grace leaves Merivel where he first started. And through his travels and reunions with an old friend, he rediscovers his love for true medicine and what it really means to be a physician."
Mortal Kombat,1995,PG-13,"Action, Adventure, Fantasy","Based on the popular video game of the same name ""Mortal Kombat"" tells the story of an ancient tournament where the best of the best of different Realms fight each other. The goal - ten wins to be able to legally invade the losing Realm. Outworld has so far collected nine wins against Earthrealm, so it's up to Lord Rayden and his fighters to stop Outworld from reaching the final victory..."
To Die For,1995,R,"Comedy, Crime, Drama","Suzanne Stone (Maretto) knows exactly what she wants. She wants to be a television newscaster and she is willing to do anything to get what she wants. What she lacks in intelligence, she makes up for in cold determination and diabolical wiles. As she pursues her goal with relentless focus, she is forced to destroy anything and anyone that may stand in her way, regardless of the ultimate cost or means necessary."
How to Make an American Quilt,1995,PG-13,"Comedy, Drama, Romance","Finn is a young graduate student, finishing a master's thesis, and preparing for marriage to her fiance Sam. But thoughts of the end of the free life, and a potential summer fling, intrude. She goes home to her grandmother, where, over the making of her wedding gift by a group of quilting-bee friends, laughter, bickering, love, and advice lead her toward a more open-eyed examination of her course."
Se7en,1995,R,"Crime, Drama, Mystery","A film about two homicide detectives' (Morgan Freeman and (Brad Pitt desperate hunt for a serial killer who justifies his crimes as absolution for the world's ignorance of the Seven Deadly Sins. The movie takes us from the tortured remains of one victim to the next as the sociopathic ""John Doe"" (Kevin Spacey) sermonizes to Detectives Somerset and Mills -- one sin at a time. The sin of Gluttony comes first and the murderer's terrible capacity is graphically demonstrated in the dark and subdued tones characteristic of film noir. The seasoned and cultured but jaded Somerset researches the Seven Deadly Sins in an effort to understand the killer's modus operandi while the bright but green and impulsive Detective Mills (Pitt) scoffs at his efforts to get inside the mind of a killer..."
Pocahontas,1995,G,"Animation, Adventure, Drama","This is the Disney animated tale of the romance between a young American Indian woman named Pocahontas and Capt. John Smith, who journeyed to the New World with other settlers to begin fresh lives. Her powerful father, Chief Powhatan, disapproves of their relationship and wants her to marry a native warrior. Meanwhile, Smith's fellow Englishmen hope to rob the Native Americans of their gold. Can Pocahontas' love for Smith save the day?"
When Night Is Falling,1995,R,"Drama, Romance","Camille and Martin are in love and teachers at a christian college; they get the opportunity to get a better job, but they would have to marry for that. But when Camille's dog dies, she recognizes that her love for Martin is not even as big as the love for her dog. After that, Camille gets to know Petra, and Petra falls in love with Camille. They meet again, but Camille is very unsure about her feelings. When Martin is away for a weekend, Camille and Petra meet in the Circus where Petra is working as an acrobat. They spend the night together, but Martin finds out about it and is shocked. He has an argument with Camille, and she goes burying her dog in the snow, and falls asleep..."
The Usual Suspects,1995,R,"Crime, Mystery, Thriller","Following a truck hijack in New York, five conmen are arrested and brought together for questioning. As none of them are guilty, they plan a revenge operation against the police. The operation goes well, but then the influence of a legendary mastermind criminal called Keyser Söze is felt. It becomes clear that each one of them has wronged Söze at some point and must pay back now. The payback job leaves 27 men dead in a boat explosion, but the real question arises now: Who actually is Keyser Söze?"
Mighty Aphrodite,1995,R,"Comedy, Fantasy, Romance","Lenny and Amanda have an adopted son Max who turns out to be brilliant. Lenny becomes obsessed with finding Max's real parents because he believes that they too must be brilliant. When he finds that Linda Ash is Max' real mother, Lenny is disappointed. Linda is a prostitute and porn star. On top of that, she is quite possibly the dumbest person Lenny has ever met. Interwoven is a Greek chorus linking the story with the story of Oedipus."
The Big Green,1995,PG,"Comedy, Family, Sport","Another Disney underdog sports team of misfit kids (soccer this time) learns to play a new sport and become champions, while building self-esteem, making friends and solving a variety of dramatic family crises, through the able assistance of a foreign exchange teacher and a former local sports hero as coaches."
Georgia,1995,R,"Drama, Music","Sadie is desperately looking up to her older sister Georgia who is a famous C&W artist. Sadie wants to be a famous artist like her sister, but is always doing everything wrong. Her desperate need to be accepted by her sister is constantly complicated by her drug and alcohol problems. Georgia lives a very ordered life with husband, house and children, and Sadie does everything to get her attention."
Home for the Holidays,1995,PG-13,"Comedy, Drama, Romance","After losing her job, making out with her soon to be ex-boss, and finding out that her daughter plans to spend Thanksgiving with her boyfriend, Claudia Larson has to face spending the holiday with her family. She wonders if she can survive their crazy antics."
Il Postino,1994,PG,"Biography, Comedy, Drama","Pablo Neruda, the famous Chilean poet, is exiled to a small island for political reasons. On the island, the unemployed son of a poor fisherman is hired as an extra postman due to the huge increase in mail that this causes. Il Postino is to hand-deliver the celebrity's mail to him. Though poorly educated, the postman learns to love poetry and eventually befriends Neruda. Struggling to grow and express himself more fully, he suddenly falls in love and needs Neruda's help and guidance more than ever."
