Title,Year,Rated,Genre(s),Plot
That Awkward Moment,2014,R,"Comedy, Romance","Jason has just been dumped, but he didn't even realize they were going out. Meanwhile, Mikey's wife has just asked him for a divorce, and perpetually single Daniel is still single. The three best friends are determined to stay single together and just have fun. But then Jason meets Ellie who just might be perfect for him, Daniel starts to realize that his gal pal Chelsea might be perfect for him, and Mikey has always thought that his wife was perfect for him. The boys are going to have to juggle their single life with their romantic entanglements and it's going to get awkward."
American Hustle,2013,R,"Crime, Drama","A fictional film set in the alluring world of one of the most stunning scandals to rock our nation, American Hustle tells the story of brilliant con man Irving Rosenfeld (Christian Bale), who along with his equally cunning and seductive British partner Sydney Prosser (Amy Adams) is forced to work for a wild FBI agent Richie DiMaso (Bradley Cooper). DiMaso pushes them into a world of Jersey powerbrokers and mafia that's as dangerous as it is enchanting. Jeremy Renner is Carmine Polito, the passionate, volatile, New Jersey political operator caught between the con-artists and Feds. Irving's unpredictable wife Rosalyn (Jennifer Lawrence) could be the one to pull the thread that brings the entire world crashing down."
From Up on Poppy Hill,2011,PG,"Animation, Drama, Family",A group of Yokohama teens look to save their school's clubhouse from the wrecking ball in preparations for the 1964 Tokyo Olympics.
While We're Young,2014,R,"Comedy, Drama, Mystery","Josh Srebnick is 44. He is married to Cornelia, 43, the daughter of Leslie Breitbart, a respected documentary filmmaker. The couple lives comfortably in New York Village and gives the image of happiness. But things are not so rosy as they look: on a personal level, their relationships have been cooling down while they suffer from not having children. On a professional plane, things have deteriorated as well. Josh, who is also a documentary filmmaker like his father-in-law, has lost inspiration: he has been grappling with his last movie for eight years now without being able to complete it. To be true, Josh goes nowhere and his marriage is on the rocks. Things start changing when Josh and Cornelia meet another married pair: Jamie and Darby, a generation younger, express their admiration for Josh (Jamie wishing to become a documentary filmmaker himself). Plus, they are much cooler, smarter and more uninhibited than the two forty-odds. Could they help Josh and Cornelia to revive their couple? Could they give Josh an extra boost of energy to make a fresh start in his art?"
Inherent Vice,2014,R,"Comedy, Crime, Drama","During the psychedelic 60s and 70s Larry ""Doc"" Sportello is surprised by his former girlfriend and her plot for her billionaire boyfriend, his wife, and her boyfriend. A plan for kidnapping gets shaken up by the oddball characters entangled in this groovy kidnapping romp based upon the novel by Thomas Pynchon."
The Maze Runner,2014,PG-13,"Action, Mystery, Sci-Fi","Awakening in an elevator, remembering nothing of his past, Thomas emerges into a world of about thirty teenage boys, all without past memories, who have learned to survive under their own set of rules in a completely enclosed environment, subsisting on their own agriculture and supplies. With a new boy arriving every thirty days, the group has been in ""The Glade"" for three years, trying to find a way to escape through the Maze that surrounds their living space (patrolled by cyborg monsters named 'Grievers'). They have begun to give up hope when a comatose girl arrives with a strange note, and their world begins to change with the boys dividing into two factions: those willing to risk their lives to escape and those wanting to hang onto what they've got and survive."
John Dies at the End,2012,R,"Comedy, Horror, Sci-Fi","It's a drug that promises an out-of-body experience with each hit. On the street they call it Soy Sauce, and users drift across time and dimensions. But some who come back are no longer human. Suddenly a silent otherworldly invasion is underway, and mankind needs a hero. What it gets instead is John and David, a pair of college dropouts who can barely hold down jobs. Can these two stop the oncoming horror in time to save humanity? No. No, they can't."
Anna Karenina,2012,R,"Drama, Romance","In 1874, in the Imperial Russia, the aristocratic Anna Karenina travels from Saint Petersburg to Moscow to save the marriage of her brother Prince Oblonsky, who had had a love affair with his housemaid. Anna Karenina has a cold marriage with her husband, Count Alexei Karenin, and they have a son. Anna meets the cavalry officer Count Vronsky at the train station and they feel attracted by each other. Soon she learns that Vronsky will propose to Kitty, who is the younger sister of her sister-in-law Dolly. Anna satisfactorily resolves the infidelity case of her brother and Kitty invites her to stay for the ball. However, Anna Karenina and Vronsky dance in the ball, calling the attention of the conservative society. Soon they have a love affair that will lead Anna Karenina to a tragic fate."
Jiro Dreams of Sushi,2011,PG,Documentary,"In the basement of a Tokyo office building, 85 year old sushi master Jiro Ono works tirelessly in his world renowned restaurant, Sukiyabashi Jiro. As his son Yoshikazu faces the pressures of stepping into his father's shoes and taking over the legendary restaurant, Jiro relentlessly pursues his lifelong quest to create the perfect piece of sushi."
Wreck-It Ralph,2012,PG,"Animation, Adventure, Comedy","Wreck-It Ralph longs to be as beloved as his game's perfect Good Guy, Fix-It Felix. Problem is, nobody loves a Bad Guy. But they do love heroes... so when a modern, first-person shooter game arrives featuring tough-as-nails Sergeant Calhoun, Ralph sees it as his ticket to heroism and happiness. He sneaks into the game with a simple plan -- win a medal -- but soon wrecks everything, and accidentally unleashes a deadly enemy that threatens every game in the arcade. Ralph's only hope? Vanellope von Schweetz, a young troublemaking ""glitch"" from a candy-coated cart racing game who might just be the one to teach Ralph what it means to be a Good Guy. But will he realize he is good enough to become a hero before it's ""Game Over"" for the entire arcade?"
Danny Collins,2015,R,"Biography, Comedy, Drama","Inspired by a true story, Al Pacino stars as aging 1970s rocker Danny Collins, who can't give up his hard-living ways. But when his manager (Christopher Plummer) uncovers a 40 year-old undelivered letter written to him by John Lennon, he decides to change course and embarks on a heartfelt journey to rediscover his family, find true love and begin a second act."
Stonehearst Asylum,2014,PG-13,"Drama, Horror, Mystery","A couple of days before 1899 Christmas, the Oxford new graduate Dr. Edward Newgate arrives at the Stonehearst Asylum to complete training for his specialty of asylum medicine. He is met by armed men who take him to Dr. Silas Lamb, who welcomes his help and takes him under his wing. Edward is shocked to see the methods that Dr Lamb uses to run this asylum. He becomes infatuated with Eliza Graves, one of the patients who is a lady of status and does not seem to belong. One night, Edward overhears a knocking from the bowels of the facility and is shocked to find that everything is not as it seems in this place and that his uneasy feelings may be justified. What will Edward Choose?"
Shadow Dancer,2012,R,"Drama, Thriller","In 1993, the IRA member Collette is arrested in the London tube after leaving a bomb in the facility. MI-5 Agent Mac offers a deal to Collette to become an informer. She accepts the agreement to protect her son and in return Mac offers a new identity to her after a period working for the MI-5. Soon Mac learns that his superior Kate Fletcher is using Collette to protect her mole inside the Irish organization. Mac tries to find the identity of the informer and protect Collette."
The Giant Mechanical Man,2012,PG-13,"Comedy, Drama, Romance",An offbeat romantic comedy about a silver-painted street performer and the soft spoken zoo worker who falls for him.
She's Funny That Way,2014,R,Comedy,"On the set of a playwright's new project, a love triangle forms between his wife, her ex-lover, and the call girl-turned-actress cast in the production."
Killing Them Softly,2012,R,"Crime, Thriller","Three amateurs stickup a Mob protected card game, causing the local criminal economy to collapse. Brad Pitt plays the hitman hired to track them down and restore order."
The First Time,2012,PG-13,"Comedy, Drama, Romance","One night at a friend's house party, a somewhat confident Dave meets a cool and artistic girl named Aubrey. She helps him with his romantic feelings for Jane. They talk about Dave's feelings, and he believes he should tell Jane how he feels. They soon get interrupted by the cops showing up, but decide to walk home together. As the weekend begins, the new friends start to hang out, as well as discuss their relationship... And their virginity. Dave becomes more and more interested in Aubrey, and she reciprocates. Even though she is involved with Roni (her soon to be ex), she has trouble denying her true feelings for Dave. There is one problem, however, Dave is going off to college in another city. Aubrey still has one year left of high school. Will they be able to handle a long distance relationship? Is their love strong enough? Or will Dave chose Jane, the girl of his dreams instead."
No One Lives,2012,R,"Horror, Thriller",A gang of ruthless highway killers kidnap a wealthy couple traveling cross country only to shockingly discover that things are not what they seem.
This Is 40,2012,R,"Comedy, Romance","Pete (Paul Rudd) and Debbie (Leslie Mann) are turning 40. But instead of celebrating, they're mired in a mid-life crisis with unruly kids, debt and unhappiness mounding. Pete's record label is failing and Debbie is unable to come to terms with her aging body. As Pete's 40th birthday party arrives, Pete and Debbie are going to have to rely on family, friends, employees, fitness trainers, aging rockers and ultimately each other to come to terms with life at age 40."
The To Do List,2013,R,"Comedy, Romance","Brandy Klark (Aubrey Plaza) has just graduated from high school where she excelled in every subject, except real-life sexual education. When her older sister tells her how important it is to be experienced, Brandy writes out a sex to do list for herself for the summer. Her friend Cameron might be the perfect guinea pig while she sets her sights on the popular and sexy Rusty Waters as the ultimate end goal. But once feelings get in the way, it becomes much harder for Brandy to check off the remaining items on her sex to do list."
Apartment 143,2011,R,"Horror, Thriller","A parapsychologist team are asked to investigate Apartment 143. The White family, who have lost their wife/mother in a car crash, have been experiencing strange things since they moved in to the apartment. But, they were also experiencing things at their old place. After the team set up their equipment, they get some compelling evidence on camera."
Starbuck,2011,R,"Comedy, Drama, Romance","At 42, David lives the life of an irresponsible adolescent. He coasts through life with minimal effort and maintains a complicated relationship with Valerie, a young policewoman. Just as she tells him she's pregnant, David's past resurfaces. Twenty years earlier, he began providing sperm to a fertility clinic in exchange for money. He discovers he's the father of 533 children, 142 of whom have filed a class action lawsuit to determine the identity of their biological father, known only by the pseudonym Starbuck."
The Collection,2012,R,"Horror, Thriller","Arkin escapes with his life from the vicious grips of ""The Collector"" during an entrapment party where he adds beautiful Elena to his ""Collection."" Instead of recovering from the trauma, Arkin is suddenly abducted from the hospital by mercenaries hired by Elena's wealthy father. Arkin is blackmailed to team up with the mercenaries and track down The Collector's booby trapped warehouse and save Elena."
Sound of My Voice,2011,R,"Drama, Mystery, Sci-Fi","Two documentary filmmakers are determined to expose the truth about Maggie, the mysterious leader of a secretive cult who claims to belong to the year 2054. Although they believe that everything is nothing more than a fraud, the filmmakers end up driven by her charisma."
Moonrise Kingdom,2012,PG-13,"Adventure, Comedy, Drama","Set on an island off the coast of New England in the 1960s, as a young boy and girl fall in love they are moved to run away together. Various factions of the town mobilize to search for them and the town is turned upside down - which might not be such a bad thing."
Phil Spector,2013,TV-MA,"Biography, Drama, Music","Record producer Phil Spector hires Bruce Cutler to defend him when he's accused of murder. Cutler persuades Linda Kenney Baden to advise him. While the prosecution's story is contradicted by facts in the case, there is convincing circumstantial evidence against Spector, not the least of which is his appearance. As Baden gradually takes over the defense, even as she is ill with pneumonia, she must find a way to introduce ballistic evidence in a dramatic enough fashion to plant doubt in the jury's mind. Calling Specter to testify may be the only way to stage the evidence. She coaches him and rehearses him: can he (and she) pull it off?"
Your Sister's Sister,2011,R,"Comedy, Drama","Mourning the death of his brother, Jack's friend Iris invites him to her father's cottage for some alone time to recuperate. Unbeknownst to either of them, Iris's sister Hannah is also staying at their father's cottage recovering from her recent break-up. One entire bottle of tequila later, Jack and Hannah wake up to find Iris at the door. They each have secrets that they're tying to keep and they each have feelings that they're trying to sort out."
Snow White and the Huntsman,2012,PG-13,"Action, Adventure, Drama","Snow White, imprisoned daughter of the late king, escapes just as the Magic Mirror declares her the source of the Evil Queen's immortality. The Queen sends her men, led by a local huntsman, to bring her back. But upon her capture, the huntsman finds he's being played and turns against the Queen's men, saving Snow White in the process. Meanwhile, Snow's childhood friend, William, learns that she is alive and sets off to save her."
The Way Way Back,2013,PG-13,"Comedy, Drama","Duncan (Liam James) is not a popular kid and it doesn't look like the summer is going to offer anything better for him. His mother's boyfriend has invited them to his beach house where Duncan is expected to improve his personality and physical appearance, and meet girls. But his would-be step-sister doesn't want anything to do with him and his shy demeanor makes it difficult for him to meet anybody new. When Duncan wanders into the Water Wizz, the local water park, he meets adult employees who are just having fun. Owen (Sam Rockwell) lets Duncan work with him and their new-found bond will help each other mature and find their place in life. Which for Duncan means standing up to his would-be step-father, having a conversation with the girl next door and being more comfortable with who he is."
We're the Millers,2013,R,"Comedy, Crime","After being robbed of a week's take, small-time pot dealer David is forced by his boss to go to Mexico to pick up a load of marijuana. In order to improve his odds of making it past the border, David asks the broke stripper Rose and two local teenagers to join him and pretend they're on a family holiday."
October Baby,2011,PG-13,Drama,"As the curtain rises, Hannah hesitantly steps onto the stage for her theatrical debut in college. Yet before she can utter her first lines, Hannah-unscripted-collapses in front of the stunned audience. After countless medical tests, all signs point to one underlying factor: Hannah's difficult birth. This revelation is nothing compared to what she then learns from her parents: she was actually adopted ... after a failed abortion attempt. Bewildered, angered, and confused, Hannah turns for support to Jason, her long-time friend. Encouraged by his adventurous spirit, Hannah joins his group of friends on a Spring Break road trip, embarking on a journey to discover her hidden past ... and find hope for her unknown future. In the midst of her incredible journey, Hannah learns that every life is beautiful."
People Like Us,2012,PG-13,"Comedy, Drama","Workaholic and sleazy businessman Sam is extremely reluctant to leave New York and go to his father's funeral. When he finally arrives, it becomes apparent that his mother and girlfriend are disappointed in him for ""running away"" whenever times get too emotional. Soon afterwards, he discovers that his father was sleeping around with another woman, and that Sam actually has a half-sister whom he never knew existed. His father has willed her $150,000 and has left Sam with the task of getting it to her. Frankie is a bartender also wrapped up in work just like her half-brother, and she has had a bad past and has now been left with the job of being a single parent to her troublemaker son, Josh. Josh is eleven years old but curses like a sailor and constantly makes fart jokes and sex jokes, making him popular with the bad kid crowd at school, although behind the act, Josh is depressed and lonely. Now Sam has to find a way to fix the past and reunite his mom, nephew and half-sister together at last, but it won't be easy."
10 Years,2011,PG-13,"Comedy, Drama, Romance","The night before their high school reunion, a group of friends realize they still haven't quite grown up in some ways."
Only Lovers Left Alive,2013,R,"Comedy, Drama, Fantasy","Adam (Tom Hiddleston), an underground musician, reunites with his lover for centuries (Tilda Swinton) after he becomes depressed and tired with the direction human society has taken. Their love is interrupted and tested by his wild and uncontrollable little sister (Mia Wasikowska)."
Drift,2013,R,"Drama, Sport","In the 70s two brothers battle killer waves, conservative society and ruthless bikers to kick-start the modern surf industry."
The Spectacular Now,2013,R,"Comedy, Drama, Romance","Sutter Keely lives in the now. It's a good place for him. A high school senior, charming and self-possessed, he's the life of the party, loves his job at a men's clothing store, and has no plans for the future. A budding alcoholic, he's never far from his supersized, whiskey-fortified thirst-master cup. But after being dumped by his girlfriend, Sutter gets drunk and wakes up on a lawn with Aimee Finecky hovering over him. She's different: the ""nice girl"" who reads science fiction and doesn't have a boyfriend. While Aimee has dreams of a future, Sutter lives in the impressive delusion of a spectacular now, yet somehow, they're drawn together."
Piranha 3DD,2012,R,"Comedy, Horror","Having awoken from their spring break extravaganza at Lake Victoria, the swarm heads upstream where they look to make a meal out of Big Wet, a local water park where when it comes to fun, nobody does it wetter! Though they came to get wet, get loaded and get some, the staff and patrons get more than they bargained for when they must face the fiercest, most bloodthirsty piranhas yet. Lead by the strong-willed, studious Maddy and her friends, Barry and Kyle, the trio must dive in and take on these man-eating creatures using every ounce of their being but can they be stopped?"
Alex Cross,2012,PG-13,"Action, Crime, Mystery","Dr. Alex Cross is on his last police duty to track down an assassin called Picasso, who's been torturing and killing rich businessmen in Detroit. Soon when the mission gets personal, Cross is pushed to the edge of his moral and psychological limits to end this once and for all."
Lola Versus,2012,R,Comedy,"Dumped by her boyfriend just three weeks before their wedding, Lola enlists her close friends for a series of adventures she hopes will help her come to terms with approaching 30 as a single woman."
Les Misérables,2012,PG-13,"Drama, History, Musical","Jean Valjean, known as Prisoner 24601, is released from prison and breaks parole to create a new life for himself while evading the grip of the persistent Inspector Javert. Set in post-revolutionary France, the story reaches resolution against the background of the June Rebellion."
Snowpiercer,2013,R,"Action, Adventure, Sci-Fi","Set in 2031, the entire world is frozen except for those aboard the Snowpiercer. For 17 years, the world's survivors are on a train hurtling around the globe creating their own economy and class system. Led by Curtis, a group of lower-class citizens living in squalor at the back of the train are determined to get to the front of the train and spread the wealth around. Each section of the train holds new surprises for the group who have to battle their way through. A revolution is underway."
Bernie,2011,PG-13,"Biography, Comedy, Crime","We meet Bernie Tiede (1958- ), a chubby undertaker, who takes pride in his work. He's a Gospel-singing tenor. In a series of interviews with townspeople, mixed with flashbacks, we follow Bernie: he arrives in Carthage, Texas (pop. 7,000), where old ladies adore him; he befriends a wealthy, mean-spirited widow named Marjorie Nugent; they become companions in both daily routines and expensive vacations. Among those interviewed, only her stockbroker and Danny Buck, the local district attorney, are unsympathetic toward the sunny, sometimes saccharine Bernie. Marjorie changes from sour and alone to happy with Bernie; then she gets possessive. What will sweet Bernie do?"
Trigun: Badlands Rumble,2010,TV-14,"Animation, Action, Sci-Fi","20 years after meddling into the bank heist of a notorious robber named Gasback, Vash the Stampede is heading towards Macca City. Rumors say that the legendary thief might appear there causing an enormous influx of bounty hunters in the area who want to collect the $300,000,000 prize for his head."
Safe Haven,2013,PG-13,"Drama, Romance, Thriller","When a mysterious young woman named Katie appears in the small North Carolina town of Southport, her sudden arrival raises questions about her past. Beautiful yet self-effacing, Katie seems determined to avoid forming personal ties until a series of events draws her into two reluctant relationships: one with Alex, a widowed store owner with a kind heart and two young children; and another with her plainspoken single neighbor, Jo. Despite her reservations, Katie slowly begins to let down her guard, putting down roots in the close-knit community and becoming increasingly attached to Alex and his family. But even as Katie begins to fall in love, she struggles with the dark secret that still haunts and terrifies her . . . a past that set her on a fearful, shattering journey across the country, to the sheltered oasis of Southport. With Jo's empathic and stubborn support, Katie eventually realizes that she must choose between a life of transient safety and one of riskier rewards . . . and that in the darkest hour, love is the only true safe haven."
The Five-Year Engagement,2012,R,"Comedy, Romance","In San Francisco, after a year's relationship, Tom proposes to Violet; she accepts. She's an experimental psychologist, hoping for a post-doc at Cal. He's a sous chef who runs the kitchen when the chef is away. When Cal falls through and she gets an offer in Ann Arbor, Tom agrees to support the move, turning down a job as chef at a new restaurant. The move requires postponing the wedding. At Michigan, Violet is in her element, but Tom is underemployed and frustrated; he's Stoic for a while, but when two years in Michigan become four, Tom's frustrations boil over, and on the eve of yet another wedding date, they must make a choice. Is there any other alternative?"
Wonder Woman,2009,PG-13,"Animation, Action, Adventure","In antiquity, the Amazons defeat the war god, Ares, and Zeus charges them to hold him prisoner as eternally young warriors on the hidden island of Themyscira. Centuries later, US Air Force pilot Steve Trevor is lured to crash land on the island and the distraction of that trespass allows Ares to escape. In response, Princess Diana wins the responsibility to both take Trevor home and recapture the fugitive god. Steve Trevor offers to help and together this disparate pair must not only overcome Ares' efforts to achieve a bloody revenge, but also reconcile their own conflicting world views in an adventure that would be the first for the greatest of the female superheroes."
The Wrecking Crew!,2008,PG,"Documentary, Music","A celebration of the musical work of a group of session musicians known as ""The Wrecking Crew"", a band that provided back-up instrumentals to such legendary recording artists as Frank Sinatra, The Beach Boys and Bing Crosby."
Corman's World: Exploits of a Hollywood Rebel,2011,R,Documentary,A documentary on DIY producer/director Roger Corman and his alternative approach to making movies in Hollywood.
Marley,2012,PG-13,"Documentary, Biography, Music","Bob Marley's universal appeal, impact on music history and role as a social and political prophet is both unique and unparalleled. The definitive life story of the musician, revolutionary, and legend, from his early days to his rise to international super-stardom. Made with the support of the Marley family, there is rare footage, incredible performances and revelatory interviews with the people that knew him best."
