Plot,Title,Year
"Recently ordained a priest, 24-year-old Father Amaro is sent to a small parish church in Los Reyes, Mexico to assist the aging Father Benito in his daily work. Benito--for years a fixture in the church as well as the community--welcomes Father Amaro into a new life of unseen challenges. Upon arriving in Los Reyes, the ambitious Father Amaro meets Amelia, a beautiful 16-year-old girl whose religious devotion soon becomes helplessly entangles in a growing attraction to the new priest. Amelia is quickly following into the footsteps of her mother, Sanjuanera, who has been engaged in a long-time affair with Father Benito. Amaro soon discovers that corruption and the Church are old acquaintances in Los Reyes. Father Benito has been receiving financial help from the region's drug lord for the construction of a new health clinic. As well, another priest in the diocese, Father Natalio, is suspected of assisting guerilla troops in the highlands. Maenwhile, Amelia and Father Amaro have fallen in love and have begun a passionate sexual relationship. As things become increasingly more complicated in the small community, the walls around Father Amaro begin to crumble. Torn between the divine and the carnal, the righteous and the unjust, Father Amaro must summon his strength to choose which life he will lead.",El crimen del padre Amaro,2002
"Based on a true story, this is about the Irish journalist Veronica Guerin (Cate Blanchett), a reporter for The Sunday Independent, who exposed some of Dublin's most powerful crime barons and drug lords in 1996. But later that year she was gunned down by assasins hired by the same criminal drug lords she exposed.",Veronica Guerin,2003
"Conrad and Sally Walden (Spencer Breslin and Dakota Fanning) are home alone with their pet fish. It is raining outside, and there is nothing to do. Until The Cat in the Hat ('Mike Myers') walks in the front door. He introduces them to their imagination, and at first it's all fun and games, until things get out of hand, and The Cat must go, go, go, before their parents get back.",The Cat in the Hat,2003
"In a very poor zone of New York, April Burns and her boyfriend, the Afro-American Bobby, are preparing to receive April's family for thanksgiving dinner. While Bobby tries to borrow a suit for himself, April realizes that her stove is broken. She tries desperately to find a neighbor that can let her cook the turkey, since she does not want to fail (again) with her family. Meanwhile, in a suburb of Pennsylvania, her dysfunctional family is preparing to travel to New York. While driving, the relationship between the Burns and their black-sheep April is disclosed through the conversations between her father Jim, her resented mother Joy, her brother, her sister and her grandmother.",Pieces of April,2003
"The second part of Aki Kaurismäki's ""Finland"" trilogy, the film follows a man who arrives in Helsinki and gets beaten up so severely he develops amnesia. Unable to remember his name or anything from his past life, he cannot get a job or an apartment, so he starts living on the outskirts of the city and slowly starts putting his life back on track.",The Man Without a Past,2002
"Renowned adventurer Allan Quatermain leads a team of extraordinary figures with legendary powers to battle the technological terror of a madman known as ""The Fantom."" This ""League"" comprises seafarer/inventor Captain Nemo, vampiress Mina Harker, an invisible man named Rodney Skinner, American secret service agent Tom Sawyer, the ageless and invincible Dorian Gray, and the dangerous split personality of Dr. Jekyll/Mr. Hyde.",The League of Extraordinary Gentlemen,2003
"Traudl Junge was Adolf Hitler's private secretary, from Autumn 1942 until the collapse of the Nazi regime. She worked for him at the Wolfsschanze in Obersalzberg, on his private train and, finally, in his bunker in the besieged capital. It was Traudl Junge to whom Hitler dictated his final testament. In her first ever on-camera interview, 81-year-old Junge talks about her unique life. In the spring of 2001, Andre Heller succeeded in convincing Traudl Junge how valuable it is to record her unique memories. Fifty-six years after the end of the Second World War, an important eyewitness reveals her experiences to us. What she saw and heard turned her into an furious opponent of National Socialism; an opponent, moreover, who is still painfully aware and seems incapable of forgiving the young girl she once was--for her naivete, ignorance, and her liking for Hitler.",Blind Spot. Hitler's Secretary,2002
"""But if you forget to come back for Madame Zeroni, you and your family will be cursed for always and eternity."" Those were the exact words spoken to young Elya Yelnats the day he forgot to repay Madame Zeroni. From then on his family was cursed with bad luck. One hundred years later Stanley Yelnats IV is accused of stealing a pair of cleats from a major league baseball player and sent to Camp Green Lake (a dry lake bed in the middle of the desert). It never rains at Camp Green Lake, it hasn't for one hundred years. The secretive and mysterious Warden has each inmate spend every day digging one hole to ""build character."" But when an artifact from the famous ""Kissin' Kate"" Barlow is found in a hole, the Warden forces the boys to work double time leading Stanley to deduce they're digging because the Warden is looking for something. But what? And how is the mystery of Camp Green Lake connected to Stanley's family curse?",Holes,2003
"In April 1805 during the Napoleonic Wars, H.M.S. Surprise, a British frigate, is under the command of Captain Jack Aubrey. Aubrey and the Surprise's current orders are to track and capture or destroy a French privateer named Acheron. The Acheron is currently in the Atlantic off South America headed toward the Pacific in order to extend Napoleon's reach of the wars. This task will be a difficult one as Aubrey quickly learns in an initial battle with the Acheron that it is a bigger and faster ship than the Surprise, which puts the Surprise at a disadvantage. Aubrey's single-mindedness in this seemingly impossible pursuit puts him at odds with the Surprise's doctor and naturalist, Stephen Maturin, who is also Aubrey's most trusted advisor on board and closest friend. Facing other internal obstacles which have resulted in what they consider a string of bad luck, Aubrey ultimately uses Maturin's scientific exploits to figure out a way to achieve his and the ship's seemingly impossible goal.",Master and Commander: The Far Side of the World,2003
