Title,Year,Genre,Rated,Plot
Two Weeks Notice,2002,"Comedy, Romance",PG-13,"Harvard educated lawyer Lucy Kelson, following in the footsteps of her lawyer parents, uses her career for social activism. She hides any sense of femininity behind her work. George Wade is the suave public face of the Manhattan-based Wade Corporation, a development firm that Lucy routinely opposes and whose true head is George's profit-oriented brother, Howard Wade. George, who has a reputation as a lady's man, has had as his legal counsel a series of beautiful female lawyers with questionable credentials, they who have more primarily acted as his casual sex partners. Needing a real lawyer, he offers Lucy the job of his legal counsel on a chance meeting. Despite warnings from her parents in working for the ""enemy"", Lucy, who has no intention of being the latest in his bed partners, accepts the job as she feels she can do more good from the inside, and as George, as part of the job offer, promises not to demolish a community center in a heritage building as part of a development project near her childhood Coney Island home where her parents still live. Although Lucy is able to effect the type of change she wanted from this position, she finds she cannot deal with George's expectations of her, namely being his primary confidante and advisor at all hours of the day and night, mostly about issues she considers frivolous. As such, she gives him two weeks notice, although she promises to help George find her replacement. As Lucy begins to review resumes, George himself unilaterally decides to hire June Carver, a fellow Harvardite, but who seems to have her sights set on George as both a boss and personal partner. As June begins to replace Lucy in seemingly all aspects of George's life, Lucy begins to realize that she herself has fallen for George. However, Lucy's feelings for George and her attempts to re-ingratiate herself into George's life are placed into jeopardy when she learns of a Wade Corporation decision against her basic sensibilities."
Sweet Sixteen,2002,"Crime, Drama",R,"Liam is a young, restless teen struggling to realize his dream in the gritty and dismal streets of Greenock, where unemployment is rampant and little hope is available to the city's youth. He is waiting for the release of his mother, Jean, from prison where she is completing a prison term for a crime that her boyfriend actually committed. Her boyfriend, Stan, is a crude and obnoxious drug pusher is partnered by Liam's equally rough and foul-mouthed, mean-spirited grandfather. Liam is determined to rescue his mother from both of them, which means creating a safe haven beyond their reach. But first he's got to raise the cash--no small feat for a young man. It's not long before Liam and his pals' crazy schemes lead them into all sorts of trouble. Finding himself dangerously out of his depth, Liam knows he should walk away. Only this time, he just can't let go."
Runaway Jury,2003,"Crime, Drama, Thriller",PG-13,"Wendell Rohr is a torts lawyer taking on the gun lobby. Rankin Fitch is the jury consultant for the Defendants and between them the battle is for the hearts and minds of the jury. But there is someone on the inside. Nicholas Easter is a juror with a girlfriend, Marlee, on the outside. they have a past ..... and their own agenda."
Out of Time,2003,"Crime, Drama, Mystery",PG-13,"Matt Whitlock, the police chief of the small town of Banyan Key, Florida, is separated from his wife, Alex, a police homicide detective in MIami. Matt's been having an affair with Ann Merai Harrison, a woman who's separated from her abusive husband, Chris, and who says that she has cancer. When her doctor tells her of a new expensive treatment, Matt decides to give her the nearly half a million dollars in an evidence lock up that he seized from a local drug bust. When Ann and her husband turn up dead only days after naming Chief Whitlock as beneficiary on a million dollar Life insurance policy, things start heating up for Whitlock as the evidence his wife Alex is gathering stacks up against him. And as if things couldn't get worse, the D.E.A. now want the drug money a.s.a.p. Anxiety runs high for Whitlock as he scrambles to figure out who has set him up and also recover half a million dollars all while trying not to break a sweat or draw any suspicions. He's a man who is way out of his depth, nearly out of luck, and desperately close to being out of time."
El crimen del padre Amaro,2002,"Drama, Romance",R,"Recently ordained a priest, 24-year-old Father Amaro is sent to a small parish church in Los Reyes, Mexico to assist the aging Father Benito in his daily work. Benito--for years a fixture in the church as well as the community--welcomes Father Amaro into a new life of unseen challenges. Upon arriving in Los Reyes, the ambitious Father Amaro meets Amelia, a beautiful 16-year-old girl whose religious devotion soon becomes helplessly entangles in a growing attraction to the new priest. Amelia is quickly following into the footsteps of her mother, Sanjuanera, who has been engaged in a long-time affair with Father Benito. Amaro soon discovers that corruption and the Church are old acquaintances in Los Reyes. Father Benito has been receiving financial help from the region's drug lord for the construction of a new health clinic. As well, another priest in the diocese, Father Natalio, is suspected of assisting guerilla troops in the highlands. Maenwhile, Amelia and Father Amaro have fallen in love and have begun a passionate sexual relationship. As things become increasingly more complicated in the small community, the walls around Father Amaro begin to crumble. Torn between the divine and the carnal, the righteous and the unjust, Father Amaro must summon his strength to choose which life he will lead."
Veronica Guerin,2003,"Biography, Crime, Drama",R,"Based on a true story, this is about the Irish journalist Veronica Guerin (Cate Blanchett), a reporter for The Sunday Independent, who exposed some of Dublin's most powerful crime barons and drug lords in 1996. But later that year she was gunned down by assasins hired by the same criminal drug lords she exposed."
The Cat in the Hat,2003,"Adventure, Comedy, Family",PG,"Conrad and Sally Walden (Spencer Breslin and Dakota Fanning) are home alone with their pet fish. It is raining outside, and there is nothing to do. Until The Cat in the Hat ('Mike Myers') walks in the front door. He introduces them to their imagination, and at first it's all fun and games, until things get out of hand, and The Cat must go, go, go, before their parents get back."
Pieces of April,2003,"Comedy, Drama",PG-13,"In a very poor zone of New York, April Burns and her boyfriend, the Afro-American Bobby, are preparing to receive April's family for thanksgiving dinner. While Bobby tries to borrow a suit for himself, April realizes that her stove is broken. She tries desperately to find a neighbor that can let her cook the turkey, since she does not want to fail (again) with her family. Meanwhile, in a suburb of Pennsylvania, her dysfunctional family is preparing to travel to New York. While driving, the relationship between the Burns and their black-sheep April is disclosed through the conversations between her father Jim, her resented mother Joy, her brother, her sister and her grandmother."
The Man Without a Past,2002,"Comedy, Drama, Romance",PG-13,"The second part of Aki Kaurismäki's ""Finland"" trilogy, the film follows a man who arrives in Helsinki and gets beaten up so severely he develops amnesia. Unable to remember his name or anything from his past life, he cannot get a job or an apartment, so he starts living on the outskirts of the city and slowly starts putting his life back on track."
The League of Extraordinary Gentlemen,2003,"Action, Adventure, Fantasy",PG-13,"Renowned adventurer Allan Quatermain leads a team of extraordinary figures with legendary powers to battle the technological terror of a madman known as ""The Fantom."" This ""League"" comprises seafarer/inventor Captain Nemo, vampiress Mina Harker, an invisible man named Rodney Skinner, American secret service agent Tom Sawyer, the ageless and invincible Dorian Gray, and the dangerous split personality of Dr. Jekyll/Mr. Hyde."
Blind Spot. Hitler's Secretary,2002,"Documentary, Biography, War",PG,"Traudl Junge was Adolf Hitler's private secretary, from Autumn 1942 until the collapse of the Nazi regime. She worked for him at the Wolfsschanze in Obersalzberg, on his private train and, finally, in his bunker in the besieged capital. It was Traudl Junge to whom Hitler dictated his final testament. In her first ever on-camera interview, 81-year-old Junge talks about her unique life. In the spring of 2001, Andre Heller succeeded in convincing Traudl Junge how valuable it is to record her unique memories. Fifty-six years after the end of the Second World War, an important eyewitness reveals her experiences to us. What she saw and heard turned her into an furious opponent of National Socialism; an opponent, moreover, who is still painfully aware and seems incapable of forgiving the young girl she once was--for her naivete, ignorance, and her liking for Hitler."
Holes,2003,"Adventure, Comedy, Drama",PG,"""But if you forget to come back for Madame Zeroni, you and your family will be cursed for always and eternity."" Those were the exact words spoken to young Elya Yelnats the day he forgot to repay Madame Zeroni. From then on his family was cursed with bad luck. One hundred years later Stanley Yelnats IV is accused of stealing a pair of cleats from a major league baseball player and sent to Camp Green Lake (a dry lake bed in the middle of the desert). It never rains at Camp Green Lake, it hasn't for one hundred years. The secretive and mysterious Warden has each inmate spend every day digging one hole to ""build character."" But when an artifact from the famous ""Kissin' Kate"" Barlow is found in a hole, the Warden forces the boys to work double time leading Stanley to deduce they're digging because the Warden is looking for something. But what? And how is the mystery of Camp Green Lake connected to Stanley's family curse?"
Master and Commander: The Far Side of the World,2003,"Action, Adventure, Drama",PG-13,"In April 1805 during the Napoleonic Wars, H.M.S. Surprise, a British frigate, is under the command of Captain Jack Aubrey. Aubrey and the Surprise's current orders are to track and capture or destroy a French privateer named Acheron. The Acheron is currently in the Atlantic off South America headed toward the Pacific in order to extend Napoleon's reach of the wars. This task will be a difficult one as Aubrey quickly learns in an initial battle with the Acheron that it is a bigger and faster ship than the Surprise, which puts the Surprise at a disadvantage. Aubrey's single-mindedness in this seemingly impossible pursuit puts him at odds with the Surprise's doctor and naturalist, Stephen Maturin, who is also Aubrey's most trusted advisor on board and closest friend. Facing other internal obstacles which have resulted in what they consider a string of bad luck, Aubrey ultimately uses Maturin's scientific exploits to figure out a way to achieve his and the ship's seemingly impossible goal."
Confidence,2003,"Crime, Thriller",R,"Jake Vig leads a small Los Angeles based team of grifters, each member who has his specific role in each con: Jake is the main man, Miles the adversary, Big Al the scared innocent bystander, and Gordo the dead shooting victim. He also has in his pockets crooked LAPD detectives Lloyd Whitworth and Omar Manzano who basically play themselves as needed. Beyond getting the money, the basic goal of each con is to ensure the mark is so scared by what has happened - usually being an accomplice in a ""murder"" - that he won't come back looking for the money. Jake learns the hard way that their latest mark, Louis Dolby, who they fleeced for $150,000, was carrying money for a criminal named King, who takes a no prisoners approach in getting even, he who knows who stole his money. Instead of returning the $150,000 to King, money which he no longer has anyway, Jake convinces King to parlay that money and a bit more into a bigger con against a mark of King's choice, that person being banker Morgan Price, a second generation mobster. The total take for this con is to be $5 million. Beyond co-opting a couple of inside people for this con, King wants one of his own men inserted - Lupus - and Jake also enlists the work of a female pickpocket he recently ran across named Lily, to who he is attracted. During the process, a small wrinkle occurs when they learn that Special Agent Gunther Butan with the US Customs Agency, an old adversary of Jake's, is currently after him, which means they either have to call off the international mission or watch more carefully their movements, with Jake not to be the one to carry any money across the border. But with a group of con artists working for the first time with new players, a question becomes are there any inside cons at play, especially in this case where Jake has more of a personal stake than usual."
Bowling for Columbine,2002,"Documentary, Crime, Drama",R,"The United States of America is notorious for its astronomical number of people killed by firearms for a developed nation without a civil war. With his signature sense of angry humor, activist filmmaker Michael Moore sets out to explore the roots of this bloodshed. In doing so, he learns that the conventional answers of easy availability of guns, violent national history, violent entertainment and even poverty are inadequate to explain this violence when other cultures share those same factors without the equivalent carnage. In order to arrive at a possible explanation, Michael Moore takes on a deeper examination of America's culture of fear, bigotry and violence in a nation with widespread gun ownership. Furthermore, he seeks to investigate and confront the powerful elite political and corporate interests fanning this culture for their own unscrupulous gain."
A Mighty Wind,2003,"Comedy, Music",PG-13,"When folk icon Irving Steinbloom passed away, he left behind a legacy of music and a family of performers he has shepherded to folk stardom. To celebrate a life spent submerged in folk, Irving's loving son Jonathan has decided to put together a memorial concert featuring some of Steinbloom's best-loved musicians. There's Mitch and Mickey, who were the epitome of young love until their partnership was torn apart by heartbreak; classic troubadours The Folksmen, whose records were endlessly entertaining for anyone able to punch a hole in the center to play them; and The New Main Street Singers, the most meticulously color-coordinated neuftet ever to hit an amusement park. Now for one night only in New York City's Town Hall, these three groups will reunite and gather together to celebrate the music that almost made them famous."
In This World,2002,Drama,R,"In February 2002 in the Shamshatoo Refugee Camp in the North West Frontier Province in Pakistan, there are 53,000 refugees living in sub-human conditions since 1979 with the Soviet Union invasion and 2001 with the USA bombing and invasion of Afghanistan. The family of the Afghan Enayat and his cousin Jamal decides to send them illegally to London to have a better life. They hire coyotes to smuggle the cousins through Iran and Turkey to Italy and finally London hidden inside trucks and containers. However, the long journey locked in a container with other families poses a terrible challenge to the boys."
Nicholas Nickleby,2002,"Adventure, Drama, Romance",PG,"Young Nicholas and his family enjoy a comfortable life, until Nicholas' father dies and the family is left penniless. Nicholas, his sister and mother venture to London to seek help from their Uncle Ralph, but Ralph's only intentions are to separate the family and exploit them. Nicholas is sent to a school run by the cruel, abusive and horridly entertaining Wackford Squeers. Eventually, Nicholas runs away with schoolmate Smike, and the two set off to reunite the Nickleby family."
Luther,2003,"Biography, Drama, History",PG-13,"Biography of Martin Luther, the 16th-century priest who led the Christian Reformation and opened up new possibilities in exploration of faith. The film begins with his vow to become a monk, and continues through his struggles to reconcile his desire for sanctification with his increasing abhorrence of the corruption and hypocrisy pervading the Church's hierarchy. He is ultimately charged with heresy and must confront the ruling cardinals and princes, urging them to make the Scriptures available to the common believer and lead the Church toward faith through justice and righteousness."
Identity,2003,"Mystery, Thriller",R,"Malcolm Rivers has been convicted as the perpetrator of several murders and is sentenced to death. An eleventh hour defense by his lawyers and psychiatrist that Malcolm is insane based on new evidence has resulted in them meeting with the prosecutors and the judge to discuss if the verdict should be overturned. Meanwhile, on a dark night during a torrential rainstorm in the Nevada desert, a series of chain reaction events results in several people needing to stay at an out of the way motel managed by Larry. They are: ex-cop now limo driver Ed, and his client Caroline, a diva of a once famous actress; quiet adolescent Timmy, his stepfather George, and his mother Alice, who was seriously injured when Ed accidentally ran over her as she watched George change their flat tire; prostitute Paris, who was the unwitting cause of George's flat tire; newlyweds Lou and Ginny, whose marriage is based on a lie; and Police Officer Rhodes, who was en route escorting prisoner Robert to his new institution. They all can't leave the area because of washed out roads, all the other businesses around the motel are closed because of the storm, and all communication in and out is not functioning also because of the storm. One by one, they are murdered, the murderer leaving a calling card of a motel room key, starting with the room 10 key and working his way presumably to the room 1 key when the last person will be dead. Those still alive band somewhat together under Officer Rhodes and Ed's direction to find out which of the eleven is the murderer, and if, based on one of their theories, that they were brought to the motel by some force by the murderer as his intended targets. Whether those still alive can discover who the murderer is, discover why he has chosen to kill them, and be able to subdue him may well determine Malcolm's fate."
Final Destination 2,2003,"Fantasy, Horror, Mystery",R,"Clear Rivers has been living life in a mental hospital after the bizarre events that lead to the deaths of her friends. One day, she is approached by a girl named Kimberly who believes she had a premonition similar to her friend Alex who died. Clear has to either risk her life helping others, or stay inside the hospital the rest of her life waiting for her death to come. What will she do?"
Down with Love,2003,"Comedy, Romance",PG-13,An homage to the early 1960s sex comedies that starred Rock Hudson and Doris Day. The story follows a best-selling female advice author who has all the answers until a sly journalist playboy starts asking the questions.
Blood Work,2002,"Action, Crime, Drama",R,"Retired FBI profiler Terry McCaleb (Eastwood), who has recently had a heart transplant, is hired by Graciela Rivers (De Jesus), to investigate the death of her sister, Gloria, who happens to have given McCaleb his heart. On the case, he soon deduces that the killer, who staged the murder to look like a random robbery, may actually be a serial killer Terry was trailing for years in the FBI. Can the elderly and feeble McCaleb, who had intended to spend his retirement living on his boat in the Los Angeles harbor, and who can't drive, and has to nap regularly, muster up the endurance to find the killer?"
The Shape of Things,2003,"Comedy, Drama, Romance",R,"While visiting an art museum, a nerdy college student named Adam meets an iconoclastic artist named Evelyn and is instantly smitten. As their relationship develops, she gradually encourages Adam to change in various ways that surprise his older friends, Jenny and Philip. However, as events progress, Evelyn's antics become darker and darker as her influence begins to twist Adam and his friends in hurtful ways."
Lost in La Mancha,2002,Documentary,R,"Director Terry Gilliam is the latest filmmaker to try and bring Miguel de Cervantes y Saavedra's ""Don Quixote de la Mancha"" to the big screen, the movie to be called The Man Who Killed Don Quixote. Before filming even begins, Gilliam, who has moved from Hollywood studio to European financing, will have to scale back his vision as his budget has been slashed from $40 million to $32 million, still astronomical by European standards. But Gilliam is a dreamer, much like his title character, and his vision for the movie is uncompromising, meaning with the reduced budget that there is no margin for error and that some of his department heads may have to achieve miracles with their allotted moneys. During pre-production and actual filming, what Gilliam does not foresee is contractual and health issues with his actors, and the effects of Mother Nature. The question is does Gilliam have a Plan B if/when things go wrong."
Step Into Liquid,2003,"Documentary, Sport",PG,Surfers and secret spots from around the world are profiled in this documentary.
Like Mike,2002,"Comedy, Family, Fantasy",PG,"Calvin and his friends, who all live an in orphanage, find old shoes with the faded letters MJ connected to a powerline. One stormy night, they go to get the shoes when Calvin and the shoes are struck by lightning. Calvin now has unbelievable basketball powers and has the chance to play for the NBA."
Interview with the Assassin,2002,Drama,R,"Out of work TV cameraman Ron Kobelski is approached by his formerly reclusive neighbor Walter Ohlinger. Ohlinger claims that he was the mysterious ""second gunman"" that shot and killed President Kennedy. Ohlinger has kept quiet all these years, but has decided to tell his story now that he has been diagnosed with terminal cancer. Kobelski is skeptical of his neighbor's story, after his investigations provide ambiguous answers. His attitude changes, however, after he receives threatening messages on his answering machine, and spots shadowy figures in his backyard. Is Ohlinger telling the truth? Or is there a bigger conspiracy at work?"
The Human Stain,2003,"Drama, Romance, Thriller",R,"The Human Stain is the story of Coleman Silk (Hopkins), a classics professor with a terrible secret that is about to shatter his life in a small New England town. When his affair with a young troubled janitor (Kidman) is uncovered, the secret Silk had harbored for over fifty years from his wife, his children and colleague, writer Nathan Zuckerman, fast explodes in a conflagration of devastating consequences. It is Zuckerman who stumbles upon Silk's secret and sets out to reconstruct the unknown biography of this eminent, upright man, esteemed as an educator for nearly all his life, and to understand how this ingeniously contrived life came unraveled."
Ballistic: Ecks vs. Sever,2002,"Action, Crime, Sci-Fi",R,"Jonathan Ecks, an FBI agent, realizes that he must join with his lifelong enemy, Agent Sever, a rogue DIA agent with whom he is in mortal combat, in order to defeat a common enemy. That enemy has developed a ""micro-device"" that can be injected into victims in order to kill them at will."
Bad Santa,2003,"Comedy, Crime, Drama",R,"Willie T. Stokes is a convicted con man who's led a miserable life. He drinks heavily and constantly embarrasses himself publicly. He only works once a year dressed as Santa. But then come Christmas Eve, he and his pint-sized helper dwarf Marcus stage elaborate robberies and take their department stores for everything they got. This year, they hit a mall in suburban Phoenix, Arizona. This time around, Willie gets distracted by having sex with large women, a bartender who is attracted to Santas, and a kid who's convinced he's the real deal. However, this time around Marcus must once again put up with Willie's heavy drinking and a series of incidents that constantly shoot themselves in the foot. Not to mention a nosy department store security guard who's onto them and wants his cut of the loot. Will Willie and Marcus make it to next Christmas? Or will this be the year the dynamic duo finally face justice?"
25th Hour,2002,Drama,R,"The 25th Hour depicts the last day of freedom for a young man before he begins serving a seven-year jail term for drug dealing. Prowling through the city until dawn with his two close male friends and his girlfriend, he is forced to re-examine his life and how he got himself into his predicament, which leads to a shocking, disturbing finale."
