Plot,Title,Year
"George Harrison's friends, family, and bandmates unite for a tribute concert on the one-year anniversary of his death.",Concert for George,2003
"World-famous architect Louis Kahn (Exeter Library, Salk Institute, Bangladeshi Capitol Building) had two illegitimate children with two different women outside of his marriage. Son Nathaniel always hoped that someday his father would come and live with him and his mother, but Kahn never left his wife. Instead, Kahn was found dead in a men's room in Penn Station when Nathaniel was only 11. Nathaniel travels the world visitng his father's buildings and haunts in this film, meeting his father's contemporaries, colleagues, students, wives, and children.",My Architect,2003
Documentary chronicling America's justice system. Follows two female inmates - victims of horrific violence and tragedy - who are serving time in a Maryland juvenile detention center.,Girlhood,2003
A day in the lives of a group of average teenage high school students. The film follows every character and shows their daily routines. However two of the students plan to do something that the student body won't forget.,Elephant,2003
"In April 2002, an Irish film crew is making a documentary about Venezuelan President Hugo Chavez, when a coup from the opposition is made.",The Revolution Will Not Be Televised,2003
"Dorm Daze unfolds during a crazy afternoon at a university co-ed dormitory in the days before Christmas break when one of the students, Styles McFee, hires a prostitute named Dominique for his unwitting brother, Booker, to lose his virginity. But Booker prefers to lose his virginity to his long-term sweetheart Rachel just down the hall. Meanwhile, another student, named Wang, awaits the arrival of a French foreign exchange student, who speaks little English, also named Dominique. Farcical wackiness ensues as a series of mistaken identities and mishaps escalate into monumental proportions starting when Wang leaves for work, Dominique the Student arrives and is mistaken for the prostitute by Styles, while Dominique the Hooker is mistaken for the student by others including the two dorm gossip queens Lynne and Marla. Other characters involve Adrienne, who is targeted by the dorm geek, Newmar, with whom they had a drunken fling the night before. Adrienne tries to find a missing handbag belonging to her friend, Claire, who is having boyfriend troubles with Tony. Adrienne's roommate, Gerri, inadvertently gets her hands on another handbag similar looking to Claire's which is filled with $30,000 in cash. Gerri is soon mistaken for a shadowy hit woman, named Britany the Snake, by a local gangster named Lorenzo. Elsewhere, Pete's punk friend Cliff enters the dorm when Pete has to go to work. Cliff soon teams up with Dominique the Hooker to find the missing handbag with the cash while the token gay student Foosball works his way through all the plots of this collegiate comedy of Shakespearean proportions.",Dorm Daze,2003
"Dr. Miranda Grey is a psychiatrist who works in a penitentiary, in the mental institution sector. She is married with Dr. Douglas Grey, the chief of department where Dr. Pete Graham also works. Chloe Sava, a patient of Dr. Miranda formerly abused by her stepfather, claims that she is frequently raped by the devil in her cell. After leaving the asylum in a stormy night, Dr. Miranda has a car accident, and when she wakes up, she is an inmate of the institution, being accused of an horrible crime and having no memory of the incident.",Gothika,2003
"Rand, Winston, and Johnson have a small tech startup company in the Bay Area that's developing a artificially-lived computer character, Koy Koy the bird, who can hear and see and interact with the user. Koy Koy gets placed in a kids schoolroom for testing, and Rand develops a relationship with one of the teachers, Sarah. Rand learns that his scientific understanding of human mating isn't necessarily a roadmap for the real thing.",Dopamine,2003
"The 1970s was an extraordinary time of rebellion, of questioning every accepted idea: political activism, hedonism, protests, the sexual revolution, the women's movement, the civil rights movement, the music revolution, rage and liberation. Every standard by which we set our social and cultural clocks was either turned inside out or thrown away completely and reinvented. For American cinema, the 1970s was an era during which a new generation of filmmakers created work for a new kind of audience--moviegoers who were hungry for stories that reflected their own experiences and who were turning their backs on aged old studio formulas. As a result, emerging filmmakers influenced by foreign directors such as Godard, Kurosawa and Fellini coupled with the social climate and a struggling studio system, converged to create a new kind of moviemaking. Through their choice of material, filmmakers such as Francis Ford Coppola, Martin Scorsese, Robert Altman, Peter Bogdanovich, William Friedkin, Roger Corman and Paul Schrader revolutionized mainstream movies and for the first time personal visions were coming out of the studio system.",A Decade Under the Influence,2003
"In the late 1980's, the Friedmans - father and respected computer and music teacher Arnold Friedman, mother and housewife Elaine Friedman, and their three grown sons, David Friedman, Seth Friedman and Jesse Friedman - of Great Neck, Long Island, are seemingly your typical middle class American family. They all admit that the marriage was by no means close to being harmonious - Arnold and Elaine eventually got divorced - but the sons talk of their father, while also not being always there for them, as being a good man. This façade of respectability masks the fact that Arnold was buying and distributing child pornography. Following a sting operation to confirm this fact, the authorities began to investigate Arnold for sexual abuse of the minor-aged male students of his computer classes, which he held in the basement of the family home. Based on interviews with the students, not only was Arnold charged with and ultimately convicted of multiple counts of sodomy and sexual abuse of these boys but so was eighteen year old Jesse, who was mentioned by many as the aggressor of the two in the acts. Arnold admitted that he is a pedophile, but that he did not abuse the boys in his class as charged and convicted. The trial process brought out the dysfunction that previously existed within the family. But the issue of Arnold and Jesse's guilt of these acts is hotly debated among the family, among the authorities, among the media and among the students of the computer classes.",Capturing the Friedmans,2003
"Misfits in their lives back home, a group of young people live it up at musical-theater camp. While the sports counselor is completely ignored, the kids' spend all their time in rehearsal for a grueling schedule that involves a new show every two weeks. Several personal stories come to the fore. Is talented golden-boy Vlad honest in his feelings about Ellen? Can cross-dressing Michael have a relationship with his parents? Will one-hit-wonder musical playwrite and now camp counselor Bert Hanley remain mired in drink and cynicism? Fireworks are in store when Fritzi, who slavishly serves glamour girl Jill, is finally told to get a life, and the parents of Jenna, whose jaw has been wired shut in a compromise to avoid being sent to ""fat camp"", learn a valuable lesson at the summer's big end-of-season benefit.",Camp,2003
"Documentary depicts what happened in Rio de Janeiro on June 12th 2000, when bus 174 was taken by an armed young man, threatening to shoot all the passengers. Transmitted live on all Brazilian TV networks, this shocking and tragic-ending event became one of violence's most shocking portraits, and one of the scariest examples of police incompetence and abuse in recent years.",Bus 174,2002
"When his only friend and co-worker dies, a young man born with dwarfism moves to an abandoned train depot in rural New Jersey. Though he tried to maintain a life of solitude, he is soon entangled with an artist who is struggling with a personal tragedy and an overly friendly Cuban hot-dog vendor.",The Station Agent,2003
"Three actresses at various places on the Hollywood food chain navigate the minefield of love, aging, and ambition. Oh, and they're all played by men!",Girls Will Be Girls,2003
"Under-age agents Juni and Carmen Cortez set out on their newest most mind-blowing mission yet: journeying inside the virtual reality world of a 3-D video game designed to outsmart them, as the awe-inspiring graphics and creatures of gaming come to real life. Relying on humor, gadgetry, bravery, family bonds and lightning-quick reflexes, the Spy Kids must battle through tougher and tougher levels of the game, facing challenges that include racing against road warriors and surfing on boiling lava, in order to save the world from a power hungry villain.",Spy Kids 3: Game Over,2003
"In 19th-century New Mexico, a father (Tommy Lee Jones) comes back home, hoping to reconcile with his adult daughter Maggie (Cate Blanchett). Maggie's daughter is kidnapped, forcing father and estranged daughter to work together to get her back.",The Missing,2003
"In this belated sequel to 'The Decline of the American Empire', 50-something Montreal college professor, Remy, learns that he is dying of liver cancer. He decides to make amends meet to his friends and family before he dies. He first tries to made peace with his ex-wife Louise, who asks their estranged son Sebastian, a successful businessman living in London, to come home. Sebastian makes the impossible happen, using his contacts and disrupting the entire Canadian system in every way possible to help his father fight his terminal illness to the bitter end, while he also tries to reunite his former friends, Pierre, Alain, Dominique, Diane, and Claude to see their old friend before he passes on.",The Barbarian Invasions,2003
"Married realtors Jim and Sara with their children go to Gracey Manor and Mr. Gracey is enamored with Sara and they discover that Sara looks like Mr. Gracey's old girlfriend, Elizabeth, who died young and they think it was a suicide but discover something more sinister.",The Haunted Mansion,2003
"Concert performance of Eddie Griffin that includes behind-the-scenes documentary footage detailing the stand-up comedian's personal life and family as he travels to a family reunion to reunite with the cast of characters who are the root of his comedy: his mother, an uncle who was an ex-pimp, and his Uncle Curtis, who pontificates on his career as a porno director.",DysFunktional Family,2003
"Middle-aged American movie star Bob Harris is in Tokyo to film a personal endorsement Suntory whiskey ad solely for the Japanese market. He is past his movie star prime, but his name and image still have enough cachet for him to have gotten this lucrative $2 million job. He has an unsatisfying home life where his wife Lydia follows him wherever he goes - in the form of messages and faxes - for him to deal with the minutiae of their everyday lives, while she stays at home to look after their kids. Staying at the same upscale hotel is fellow American, twenty-something recent Yale Philosophy graduate Charlotte, her husband John, an entertainment still photographer, who is on assignment in Japan. As such, she is largely left to her own devices in the city, especially when his job takes him out of Tokyo. Both Bob and Charlotte are feeling lost by their current situations, which are not helped by the cultural barriers they feel in Tokyo, those cultural barriers extending far beyond just not knowing the language. After a few chance encounters in the hotel, they end up spending much of their time hanging out together, each helping the other deal with their feelings of loss in their current lives. The friendship that develops between the two, which is not always a bumpy-free one, may be just for this specific place and time, but it may also have long lasting implications.",Lost in Translation,2003
"Yossi is a Commander at an Israeli outpost near Lebanon. He is however involved in a secret, passionate love affair with his second in command (nicknamed Jagger). The two will often sneak off from the outpost to spend time together. A failed ambush during a full moon leaves Jagger mortally wounded and forces Yossi to finally express his love.",Yossi & Jagger,2002
"He began a film, a search, to discover not only what had happened to Stevie over the past ten years but to understand the forces that had shaped his entire life. Part way through the filming, Stevie is arrested and charged with a serious crime that tears his family apart. What was to be a modest profile turns into a intimate four and half year chronicle of Stevie, his broken family, the criminal justice system and the filmmaker himself, as they all struggle with what Stevie has done and who he has become.",Stevie,2002
"This documentary follows 8 teens and pre-teens as they work their way toward the finals of the Scripps Howard national spelling bee championship in Washington D.C. All work quite hard and practice daily, first having to win their regional championship before they can move on. Interviews include the parents and teachers who are working with them. The competitors not only work hard to get to the finals but face tremendous pressure as the original group of over 250 competitors is whittled down and the words they must spell get ever more difficult.",Spellbound,2002
"Wanting to escape city life for the countryside, New Yorkers Cooper Tilson (Quaid), his wife Leah (Stone) and their two children move into a dilapidated old mansion still filled with the possessions of the previous family. Turning it into their dream house soon becomes a living nightmare when the previous owner (Dorff) shows up, and a series of terrifying incidents lead them on a spine-tingling search for clues to the estate's dark and lurid past...",Cold Creek Manor,2003
"Angelo Barberini is the oddball son of Italian immigrants Gino and Maria, who inadvertently ended up in Canada rather than the States. Angelo shocks his parents by moving out on his own without getting married, and shocks them further still when he reveals that he's gay. But his boyfriend, policeman Nino Paventi isn't as ready to come out of the closet -- especially not to his busybody mother, Lina.",Mambo Italiano,2003
"Sam Roberts thinks he has all the answers: the purpose of life, the meaning of love, the plan for a perfect future. Until Charly walks into his life. As different as Salt Lake City and New York City, Sam and Charly are thrown together by circumstance and repelled by differences. He's scheduled and idealistic. She's spontaneous and cynical. He's guarded and practical. She's open and mischevious. He's a Mormon. She isn't. Differences spark interest, though, as Charly finds depth in Sam's idealism and Sam seeks the vibrance of Charly's joie de vivre. But all is not smooth in the Rockies, as their relationship accelerates - cultural differences, family issues, former loves and life-altering challenges threaten to shake things up.",Charly,2002
The comedic stylings of four sort-of famous funnymen are brought to the big screen courtesy of this 2002 documentary.,Blue Collar Comedy Tour: The Movie,2003
"When not solving murders in Tinseltown, Detective Joe Gavilan and his rookie partner Kasey Calden both moonlight in other fields: Gavilan sells real estate (poorly), and Calden aspires to become an actor (Brando, namely). Assigned to the vicious in-club slaying of a promising young rap act, the two detective delve into the recording industry where they hope to find answers - ideally ones that also come with property buyers or auditions.",Hollywood Homicide,2003
"It's the Depression, and everyone needs to hold onto a dream to get them through the bad times. Car maker Charles Howard is no different, he who is trying to rebuild his life after the tragic death of his only child and the resulting end of his first marriage. With second wife Marcela at his side, Charles wants to get into horse racing and ends up with a team of underdogs who are also chasing their own dream. The first is trainer Tom Smith, who has a natural instinct to spot the capabilities of horses. The second is the horse Tom chooses for Charles, Seabiscuit, an unconventional choice as despite his pedigreed lineage, Seabiscuit is small at fifteen and a half hands tall with a slight limp. But Tom can see something in Seabiscuit's nature to make him a winner, if only Seabiscuit can be retrained from his inbred losing ways. And third is the jockey they decide to hire, Johnny ""Red"" Pollard, so nicknamed because of his hair color. Like Tom, Red has always shown a natural way with horses, but a difficult upbringing due solely to the Depression has made Red an angry young man, which has gotten him into trouble both on and off the track. And he is large for a jockey, and thus he always feels the need to battle the weight issue. Another common trait between Tom, Seabiscuit and Red is that they have been called crazy by those in traditional horse racing circles. Against the odds, Seabiscuit, with his human team behind him, does show his winning abilities and captures the imagination of all those others wanting to believe in a dream. But Seabiscuit's victories are at smaller races. As such, Charles aims high and wants Seabiscuit to race Triple Crown winner War Admiral, who by all accounts is a winner and should be a winner. If given the chance to race against War Admiral (whose owner doesn't want to race as he feels he has nothing to prove), will Seabiscuit and his team continue to keep the dreams of the common Americans alive? Through the good and the bad, especially as Red and Seabiscuit face mirroring problems, they all have to decide what is in their collective best interest.",Seabiscuit,2003
"Fresh from the success of his sitcom, comedian Jerry Seinfeld decided to do the unimaginable: he completely retired his stand-up act, electing to start over again by developing entirely new material. ""Comedian"" follows Seinfeld through this process, as he rehearses in front of small comedy club audiences, meets with fellow comics and finally appears before a national audience.",Comedian,2002
"Kenai, a man who resents bears after a fight with one kills his older brother, is turned into a bear so he can see life from a different perspective. He is visited by the spirit of his older brother, and is told that, if he wishes to be changed back into a human, he must travel to the place where the lights touch the Earth, in other words, the Northern Lights. Fueled by hope, Kenai sets off on his long journey, and, along the way, encounters a younger bear, Koda, who is a chatterbox and a fun-loving spirit; Koda is trying to find his way back to his home, the Salmon Run, which, coincidentally, is right next to where the lights touch the Earth. Koda and Kenai team up, but are hunted by Kenai's other brother, Denahi, who fears that the bear has killed Kenai as well. Along the way, the two bears meet other friends, including two moose, some rams, and some mammoths, with whom they hitch a ride. However, Kenai discovers that he likes being a bear, and realizes that humans aren't only afraid of bears; through Koda's eyes, the humans are the monsters, with their long spears. With a whole new view on life, Kenai makes a decision that will change his world forever.",Brother Bear,2003
"Brad Gluckman (Kennedy) is a wannabe rap star from Malibu who acts and talks like he's from the ""'hood."" Concerned that his son is going to embarrass him during his campaign to become the governor of California, Brad's wealthy father and his campaign manager (Underwood), hire two trained actors (Diggs and Anderson) to disguise themselves as ""real life gangstaz"", and kidnap his son, dropping him off in the ""real hood"" in Compton, in an effort to scare the ghettofied attitude and behavior out of him.",Malibu's Most Wanted,2003
"First time director Sam Jones documents the making of Wilco's fourth studio Album, Yankee Hotel Foxtrot. Named after the Wilco song that is featured on Yankee Hotel Foxtrot, an album that strays from the Alt-country that made them famous. Jones' desire was to document the creative work of YHF's production, he seems to have found a bit more, including band members departing and a conflict with Reprise record company. This is a true documentry of art versus money-driven media conglomerates.",I Am Trying to Break Your Heart,2002
"The Rock as a bounty hunter who attempts to square a debt by heading to the Amazon jungle to capture someone. The bounty hunter discovers that his quarry isn't the bad guy he'd been warned about, and the two team up in pursuit of riches stored in a mine in the Amazon.",The Rundown,2003
"A boy named Walter is dropped by his mother Mae at his great-uncles' house. Later,Walter will find out his great-uncles' big secret. And rumors say that Hub & Garth, Walter's great uncles, have stolen much gold & money. (some say they stole it from Al Capone) Did they really steal that money or not?",Secondhand Lions,2003
"In the summer of 1975 in a neighborhood in Boston, 3 kids, Dave Boyle and two of his friends, Jimmy and Sean, are playing on the sidewalk when Dave gets abducted by two men and endures several days of sexual abuse. Eventually, Dave escapes traumatized throughout adulthood. Jimmy is an ex-con and a father of three, whose daughter Katie, is found dead and Dave becomes the number one suspect. Sean is a homicide detective, investigating Katie's murder, ends up finding himself faced with past and present demons as more is uncovered about Katie's murder. Learning Katie had a boyfriend, ballistics later turn up a gun belonging to the father, which then puts her boyfriend as the suspect. Will Sean find out who killed Katie? Will Jimmy make it through the investigation? And will Dave ever find out what really happened when he was abducted?",Mystic River,2003
"A mythic motorcycle tale of father and son"", this is the story of Manuel Galloway, also known as ""the King of Cali"", the president of a motorcycle club whose members are all African-American men, mostly white-collar workers who exchange their suits and ties at night and on weekends for leather outfits and motorcycle helmets. The focus of this story takes place at an annual drag-racing event in Fresno, as Manuel tries to retain his championship title.",Biker Boyz,2003
"Part contemporary investigation and part historical inquiry, documentary follows the quest of one journalist in search of justice. The film focuses on Christopher Hitchens' charges against Henry Kissinger as a war criminal - allegations documented in Hitchens' book of the same title - based on his role in countries such as Cambodia, Chile, and Indonesia. Kissinger's story raises profound questions about American foreign policy and highlights a new era of human rights. Increasing evidence about one man's role in a long history of human rights abuses leads to a critical examination of American diplomacy through the lens of international standards of justice.",The Trials of Henry Kissinger,2002
"This swash-buckling tale follows the quest of Captain Jack Sparrow, a savvy pirate, and Will Turner, a resourceful blacksmith, as they search for Elizabeth Swann. Elizabeth, the daughter of the governor and the love of Will's life, has been kidnapped by the feared Captain Barbossa. Little do they know, but the fierce and clever Barbossa has been cursed. He, along with his large crew, are under an ancient curse, doomed for eternity to neither live, nor die. That is, unless a blood sacrifice is made.",Pirates of the Caribbean: The Curse of the Black Pearl,2003
"Meet Roy and Frank, a couple of professional small-time con artists. What Roy, a veteran of the grift, and Frank, his ambitious protégé, are swindling these days are ""water filtration systems,"" bargain-basement water filters bought by unsuspecting people who pay ten times their value in order to win bogus prizes like cars, jewelry and overseas vacations--which they never collect. These scams net the flim-flam men a few hundred here, another thousand there, which eventually adds up to a lucrative partnership. Roy's private life, however, is not so successful. An obsessive-compulsive agoraphobe with no personal relationships to call his own, Roy is barely hanging on to his wits, and when his idiosyncrasies begin to threaten his criminal productivity he's forced to seek the help of a psychoanalyst just to keep him in working order. While Roy is looking for a quick fix, his therapy begets more than he bargained for: the revelation that he has a teenage daughter--a child whose existence he suspected but never dared confirm. What's more troubling, 14-year-old Angela wants to meet the father she never knew. At first, Angela's appearance disrupts her neurotic father's carefully ordered routine. Soon, however, with his own unique spin on parenthood, Roy begins to enjoy a relationship he never dreamed of having with his daughter. But while he develops paternal feelings for the 14-year-old, she's developing a fascination with Daddy's questionable career.",Matchstick Men,2003
"Intrepid British archaeologist Lara Croft has made perhaps the most important archaeological discovery in history: an orb that leads to the mythical Pandora's Box. Unfortunately, the orb falls into the hands of Jonathan Reiss, an evil scientist who deals in killer viruses and hopes to sell the secrets of the box as the ultimate weapon. Recruited by British Intelligence to get the orb back from Reiss, Lara recruits Terry Sheridan, a British marine turned mercenary (and her former love interest) to help. The two embark on an adventure that spans continents in an attempt to regain the orb...",Lara Croft Tomb Raider: The Cradle of Life,2003
