Plot,Title,Year
"A blind girl gets a cornea transplant so that she would be able to see again. However, she got more than what she bargained for when she realised she could even see ghosts. And some of these ghosts are down right unfriendly. So she embarks on a journey to find the origins of her cornea and to reveal the history of the previous dead owner ...",The Eye,2002
"Driving through the backwoods of Texas, five youths pick up a traumatized hitchhiker, who shoots herself in their van. Shaken by the suicide, the group seeks help from the locals, but their situation becomes even more surreal when they knock on the door of a remote homestead. It's quickly apparent the residents are a family of inbred psychopaths, and the unlucky youths suddenly find themselves running for their lives. In hot pursuit is a disfigured, chainsaw-wielding cannibal known as Leatherface.",The Texas Chainsaw Massacre,2003
"Sarah Morton is a famous British mystery author. Tired of London and seeking inspiration for her new novel, she accepts an offer from her publisher John Bosload to stay at his home in Luberon, in the South of France. It is the off-season, and Sarah finds that the beautiful country locale and unhurried pace is just the tonic for her--until late one night, when John's indolent and insouciant French daughter Julie unexpectedly arrives. Sarah's prim and steely English reserve is jarred by Julie's reckless, sexually charged lifestyle. Their interactions set off an increasingly unsettling series of events, as Sarah's creative process and a possible real-life murder begin to blend dangerously together.",Swimming Pool,2003
N/A,Stone Reader,2002
"This film tells the true story of fraudulent Washington, D.C. journalist Stephen Glass (Christensen), who rose to meteoric heights as a young writer in his 20s, becoming a staff writer at ""The New Republic"" for three years (1995-1998), where 27 of his 41 published stories were either partially or completely made up. Looking for a short cut to fame, Glass concocted sources, quotes and even entire stories, but his deception did not go unnoticed forever, and eventually, his world came crumbling down...",Shattered Glass,2003
"The successful and handsome wolf executive of the cosmetic industry Thomas Fuentes has three sexy Latin girlfriends: in Miami, the waitress Cici; in Chicago, the intellectual lawyer Lorena; and in New York, the ""daddy's girl"" Patricia. When the three women decide to visit him in Los Angeles, Thomas is in a big trouble.",Chasing Papi,2003
"Johnny Knoxville and his crazy friends appear on the big screen for the very first time in Jackass: The Movie. They wander around Japan in panda outfits, wreak havoc on a once civilized golf court, they even do stunts involving LIVE alligators, and so on. While Johnny Knoxvile and his pals put their life at risk, they are entertaining people at the same time. Get ready for Jackass: The Movie!!",Jackass: The Movie,2002
"In a near-empty Northfork orphanage, Father Harlan gently tends to Irwin, an eight-year-old who lies between a dream state and death. As orphanage caretaker Harlan reads aloud about Northfork's years-ago forced evacuation to make way for a hydro-electric dam, Irwin's imagination takes flight. While a team of six men evacuate the last remaining citizens of the town, Irwin, too, invents a cast of characters to prepare himself for his own evacuation. (the above states the caretaker - who is actually the priest - is reading about a years-ago evacuation. In the movie, the evacuation is taking place as the boy lays dying!)",Northfork,2003
"The wide generation gap between Tess Coleman and her teenage daughter Anna is more than evident. They simply cannot understand each other's preferences. On a Thursday night they have a big argument in a Chinese restaurant. Both receive a fortune cookie each from the restaurant owner's mother which causes them to switch bodies next day. As they adjust with their new personalities, they begin to understand each other more and eventually it's the mutual self-respect that sorts the things out.",Freaky Friday,2003
EX LAPD cop Brian O'Conner (Paul Walker) teams up with his ex-con friend Roman Pearce (Tyrese Gibson) and works with undercover U.S. Customs Service agent Monica Fuentes (Eva Mendes) to bring Miami-based drug lord Carter Verone (Cole Hauser) down.,2 Fast 2 Furious,2003
"A war has been raging between the Vampires and Lycan for centuries, Selene (Beckinsale) is a death dealer, assigned to hunt down and eradicate the last of the Lycan. When she comes across Michael Corvin (Speedman) who holds the key to end the war she must decide where her allegiances will lie.",Underworld,2003
"A thoroughly mind-provoking film about 3 young women who, under tragic circumstances, see themselves cast away to a Magdalene Asylum for young women in 1964. One of many like institutions, the asylums are run like prisons and young girls are forced to do workhouse laundry and hard labor. The asylum, one of many that existed in theocratic Catholic Ireland, is for supposedly 'fallen' women. Here, young girls are imprisoned indefinitely and endure agonizing punishments and a long, harsh working system which leaves them physically drained and mentally damaged. As the girls bond together, it soon becomes clear that the only way out of the Magdalene convent is to escape, but with twisted Sister Bridget running the wing, any chances seem limited...",The Magdalene Sisters,2002
"A romantic comedy: Alex is an author whose writer's block and gambling debts have landed him in a jam. In order get loan sharks off his back, he must finish his novel in 30 days or wind up dead. To help him complete his manuscript he hires stenographer Emma. As Alex begins to dictate his tale of a romantic love triangle to the charming yet somewhat opinionated stenographer, Emma challenges his ideas at every turn. Her unsolicited yet intriguing input begins to inadvertently influence Alex and his story and soon real life begins to imitate art.",Alex & Emma,2003
"How do we learn to live with others and their wishes? Director Nicolas Philibert poses this question in a village schoolhouse in Auvergne, where Georges Lopez teaches 13 children, ages ranging from about four to 12. Against a landscape of mountains and farmland, from driving snow to rain to sun, the children gather in Lopez's warm and colorful classroom, to read, write dictation, cook, and sort things out. At home, the older ones do homework with parents after their chores. At year's end, they look ahead to the next, visiting the middle school and meeting the little ones coming in the fall. As they learn sums and adjectives, with Lopez's help, they also learn to live side by side.",To Be and to Have,2002
"An unseen man regains consciousness, not knowing who or where he is. No one seems to be able to see him, except the mysterious man dressed in black. He eventually learns through their discussions that this man is a 19th century French aristocrat, who he coins the ""European"". This turn of events is unusual as the unseen man has a knowledge of the present day. The two quickly learn that they are in the Winter Palace of the Hermitage in St. Petersburg, the European who has a comprehensive knowledge of Russian history to his time. As the two travel through the palace and its grounds, they interact with people from various eras of Russian history, either through events that have happened at the palace or through the viewing of artifacts housed in the museum. Ultimately, the unseen man's desired journey is to move forward, with or without his European companion.",Russian Ark,2002
"Led by John Bridger (Donald Sutherland) and Charlie Croker (Mark Wahlberg) a team is assembled for one last heist to steal $35 million in gold bars from a heavily guarded safe in Venice, Italy. After successfully pulling off the heist, a team member, Steve (Edward Norton), driven by greed and jealousy, arranges to take the gold for himself and eliminate the remaining members of the group. Thinking the team dead, he returns to L.A. with the gold. Charlie and the survivors of this betrayal follow Steve L.A. to exact revenge against the traitor. Charlie enlists the help of John Bridger's daughter, Stella (Charlize Theron) - a professional safe cracker, to get revenge. With Stella and the hacking skills of Lyle (Seth Green), the explosives skills of ""Left Ear"" (Yasiin Bey), and the driving skills of ""Handsome"" Rob (Jason Statham) this new team plans and executes a daring heist that weaves through the freeways and subways of L.A.",The Italian Job,2003
"This film is a prequel to all of the The House of the Dead video games. Set on an island off the coast, a techno rave party attracts a diverse group of college coeds and a Coast Guard officer. Soon, they discover that their X-laced escapades are to be interrupted by zombies and monsters that attack them on the ground, from the air, and in the sea, ruled by an evil entity in the House of the Dead...",House of the Dead,2003
"In the comedy Daddy Day Care, two fathers lose their jobs in product development at a large food company and are forced to take their sons out of the exclusive Chapman Academy and become stay-at-home fathers. With no job possibilities on the horizon, the two dads open their own day care facility, ""Daddy Day Care"", and employ some fairly unconventional and sidesplitting methods of caring for children. As ""Daddy Day Care"" starts to catch on, it launches them into a highly comedic rivalry with Chapman Academy's tough-as-nails director... who has driven all previous competitors out of business.",Daddy Day Care,2003
"Brazil, 1960s, City of God. The Tender Trio robs motels and gas trucks. Younger kids watch and learn well...too well. 1970s: Li'l Zé has prospered very well and owns the city. He causes violence and fear as he wipes out rival gangs without mercy. His best friend Bené is the only one to keep him on the good side of sanity. Rocket has watched these two gain power for years, and he wants no part of it. Yet he keeps getting swept up in the madness. All he wants to do is take pictures. 1980s: Things are out of control between the last two remaining gangs...will it ever end? Welcome to the City of God.",City of God,2002
"Football coach Harold Jones befriends Radio, a mentally-challenged man who becomes a student at T.L. Hanna High School in Anderson, South Carolina. Their friendship extends over several decades, where Radio transforms from a shy, tormented man into an inspiration to his community.",Radio,2003
"Boss Spearman, Charley Waite, Mose Harrison and Button freegraze their cattle across the vast prairies of the West, sharing a friendship forged by a steadfast code of honor and living a life unencumbered by civilization. When their wayward herd forces them near the small town of Harmonville, the cowboys encounter a corrupt sheriff and kingpin rancher who govern the territory through fear, tyranny and violence. Boss and Charley find themselves inextricably drawn towards an inevitable showdown, as they are forced to defend the freedom and values of a lifestyle that is all too quickly vanishing. Amidst the turmoil, life suddenly takes an unexpected turn for the loner Charley when he meets the beautiful and warm spirited Sue Barlow, a woman who embraces both his heart and his soul.",Open Range,2003
"Victor is growing up on the Lower East Side and is at the age where he is driven by desire and unchained by maturity. His image as a ladies man is shattered when he is found in Fat Donna's bedroom. Soon, as a result of his sister's big mouth, the whole Dominican community knows. Full of confidence, Victor sets out to reclaim his image by winning Judy. Judy proves to be elusive and difficult. Victor persists, and with a surprising tenderness, ultimately wins Judy's heart.",Raising Victor Vargas,2002
"This is the story of three well-meaning but flawed people: Paul Rivers, an ailing mathematician lovelessly married to an English émigré; Christina Peck, an upper-middle-class suburban housewife, happily married homemaker with two young daughters, with hiding a secret past; and Jack Jordan, an ex-convict who has found in his Christian faith the strength to live a law-abiding life and raise a family. They will be brought together by a terrible accident that will change their lives. By the final frame, none of them will be the same as they will have learnt harsh truths about love, faith, courage, desire and guilt, and how chance can change our worlds irretrievably, forever.",21 Grams,2003
"Bruce Nolan, a television reporter in Buffalo, N.Y., is discontented with almost everything in life despite his popularity and the love of his girlfriend Grace . At the end of the worst day of his life, Bruce angrily ridicules and rages against God and God responds. God appears in human form and, endowing Bruce with divine powers, challenges Bruce to take on the big job to see if he can do it any better.",Bruce Almighty,2003
"In 1959, Berry Gordy Jr. gathered the best musicians from Detroit's thriving jazz and blues scene to begin cutting songs for his new record company. Over a fourteen year period they were the heartbeat on every hit from Motown's Detroit era. By the end of their phenomenal run, this unheralded group of musicians had played on more number ones hits than the Beach Boys, the Rolling Stones, Elvis and the Beatles combined - which makes them the greatest hit machine in the history of popular music. They called themselves the Funk Brothers. Forty-one years after they played their first note on a Motown record and three decades since they were all together, the Funk Brothers reunited back in Detroit to play their music and tell their unforgettable story, with the help of archival footage, still photos, narration, interviews, re-creation scenes, 20 Motown master tracks, and twelve new live performances of Motown classics with the Brothers backing up contemporary performers.",Standing in the Shadows of Motown,2002
"""While hospitalized with an extreme case of psoriasis, novelist Dan Dark reworks his first book in his head. Feverish, paranoid and prone to musical outbreaks, he confuses himself with his protagonist, a detective investigating the murder of a prostitute in 1950s Los Angeles.""",The Singing Detective,2003
The movie centers on a dentist who has a strange dream that blurs the boundaries between fantasy and reality.,The Secret Lives of Dentists,2002
"Ann, 23 years old, lives a modest life with her two kids and her husband in a trailer in her mother's garden. Her life takes a dramatic turn, when her doctor tells her that she has uterine cancer and only two months to live. She compiles a list of things to do before she dies.",My Life Without Me,2003
"Navy SEAL Lieutenant A.K. Waters and his elite squadron of tactical specialists are forced to choose between their duty and their humanity, between following orders by ignoring the conflict that surrounds them, or finding the courage to follow their conscience and protect a group of innocent refugees. When the democratic government of Nigeria collapses and the country is taken over by a ruthless military dictator, Waters, a fiercely loyal and hardened veteran is dispatched on a routine mission to retrieve a Doctors Without Borders physician, Dr. Lena Kendricks. Dr. Kendricks, an American citizen by marriage, is tending to the victims of the ongoing civil war at a Catholic mission in a remote village. When Waters arrives, however, Dr. Kendricks refuses to leave unless he promises to help deliver the villagers to political asylum at the nearby border. If they are left behind, they will be at the mercy of the enormous rebel army. Waters is under strict orders from his commanding officer Captain Bill Rhodes to remain disengaged from the conflict. But as he and his men witness the brutality of the rebels first-hand, they are won over to Dr. Kendricks' cause and place their lives at risk by agreeing to escort the villagers on a perilous trek through the dense jungle. As they move through the countryside on foot, Waters' team, experts at evasion and concealment, are inexplicably and ferociously pursued by an army of rebels. They are confounded until they discover that, among the refugees, is the sole survivor of the country's previous ruling family, whom the rebels have been ordered to eliminate at all costs. Waters and his small band of soldiers must weigh the life of one man against their own and the refugees they feel obliged to protect.",Tears of the Sun,2003
"Against the backdrop of aged has-been rock star Billy Mack's Christmas themed comeback cover of ""Love Is All Around"" which he knows is crap and makes no bones about it much to his manager Joe's chagrin as he promotes the record, several interrelated stories about romantic love and the obstacles to happiness through love for Londoners are presented in the five weeks preceding Christmas. Daniel's wife has just passed away, leaving him to take care of his adolescent stepson Sam by himself. Daniel is uncertain how to deal with Sam and his problems without his wife present, especially in light of a potential budding romance within their household. Juliet and Peter have just gotten married. They believe that Peter's best friend and best man Mark hates Juliet but won't say so to his or her face. Others looking at the situation from the outside believe Mark is jealous of Juliet as he is in love with Peter himself. Jamie, a writer, is taking a writing retreat by himself in rural France following catching his latest girlfriend in an indiscretion. Jamie ends up spending much time in France with Aurélia, the Portuguese woman hired as the housekeeper. The question becomes not only if they can communicate their day-to-day needs with each other as she speaks no English, he speaks no Portuguese, and neither speaks French well, but communicate what seems to be their increasing mutual attraction to each other. Sarah has been in love with her co-worker Karl for the two years they have worked together, this attraction which everyone in their workplace knows about. Sarah has to decide if she can be forward enough to express this love directly to Karl, especially in light of what has been her personal priority of dealing with a family issue. Harry and Karen have been in a stable long term marriage. His new assistant Mia drops hints to him that she would like them to be romantically involved. Harry has to decide whether to fall to the temptation, especially considering being married to a perceptive wife. Single and relatively young David is the newly elected Prime Minister. At 10 Downing Street, he is attracted to one of the new household servants, slightly overweight Natalie, but isn't sure what to do about it seeing as to their respective positions, the probable public scrutiny, and an incident involving the visiting U.S. President. Socially unaware Colin believes that the lack of romantic love in his life is all the fault of standoffish British women. As such, he decides to take decisive albeit somewhat unusual geographic action. And John and Judy are movie body doubles. They can communicate with each other straightforwardly while they are simulating sex filming a movie, but they may not be able to translate the feelings behind that simulation in real life to each other.",Love Actually,2003
"When a powerful developer named Mr. Scheck wants to knock down all the stores and houses in Arnold's neighborhood to build a huge ""mall-plex"", it looks likes the neighborhood is doomed to disappear. But with the help of a superhero and a mysterious deep-voiced stranger, Arnold and Gerald will need to recover a crucial document in order to save their beloved neighborhood.",Hey Arnold! The Movie,2002
"A government agent trains a typical teenager Cody Banks who loves to skateboard, hates math, and feels like a complete idiot around girls, in the ways of covert operations that require younger participants. But Cody's got a secret--he's actually part of a secret teen CIA program. Cody's living every boy's dream life--he can drive like a stunt man, has an incredible arsenal of cool gadgets, and his agency mentor, Ronica Miles, is totally hot. But Cody's training is put to the test when he's sent to pose as a prep school student and befriend fellow teen Natalie Connors in order to gain access to her father--a scientist unknowingly developing a fleet of deadly pair of twisted villains called the nanobots for the evil organization ERIS, which can destroy any carbon or silicon-based substance-to destroy the world's defense systems so he can threaten anyone who opposes him. From runaway cars and high-speed snowboard chases to a spectacular final mountaintop showdown, Cody has to use everything he's learned to prove himself as an agent and stop ERIS from completing their mission before their mission fails.",Agent Cody Banks,2003
"Harvard educated lawyer Lucy Kelson, following in the footsteps of her lawyer parents, uses her career for social activism. She hides any sense of femininity behind her work. George Wade is the suave public face of the Manhattan-based Wade Corporation, a development firm that Lucy routinely opposes and whose true head is George's profit-oriented brother, Howard Wade. George, who has a reputation as a lady's man, has had as his legal counsel a series of beautiful female lawyers with questionable credentials, they who have more primarily acted as his casual sex partners. Needing a real lawyer, he offers Lucy the job of his legal counsel on a chance meeting. Despite warnings from her parents in working for the ""enemy"", Lucy, who has no intention of being the latest in his bed partners, accepts the job as she feels she can do more good from the inside, and as George, as part of the job offer, promises not to demolish a community center in a heritage building as part of a development project near her childhood Coney Island home where her parents still live. Although Lucy is able to effect the type of change she wanted from this position, she finds she cannot deal with George's expectations of her, namely being his primary confidante and advisor at all hours of the day and night, mostly about issues she considers frivolous. As such, she gives him two weeks notice, although she promises to help George find her replacement. As Lucy begins to review resumes, George himself unilaterally decides to hire June Carver, a fellow Harvardite, but who seems to have her sights set on George as both a boss and personal partner. As June begins to replace Lucy in seemingly all aspects of George's life, Lucy begins to realize that she herself has fallen for George. However, Lucy's feelings for George and her attempts to re-ingratiate herself into George's life are placed into jeopardy when she learns of a Wade Corporation decision against her basic sensibilities.",Two Weeks Notice,2002
"Liam is a young, restless teen struggling to realize his dream in the gritty and dismal streets of Greenock, where unemployment is rampant and little hope is available to the city's youth. He is waiting for the release of his mother, Jean, from prison where she is completing a prison term for a crime that her boyfriend actually committed. Her boyfriend, Stan, is a crude and obnoxious drug pusher is partnered by Liam's equally rough and foul-mouthed, mean-spirited grandfather. Liam is determined to rescue his mother from both of them, which means creating a safe haven beyond their reach. But first he's got to raise the cash--no small feat for a young man. It's not long before Liam and his pals' crazy schemes lead them into all sorts of trouble. Finding himself dangerously out of his depth, Liam knows he should walk away. Only this time, he just can't let go.",Sweet Sixteen,2002
"Wendell Rohr is a torts lawyer taking on the gun lobby. Rankin Fitch is the jury consultant for the Defendants and between them the battle is for the hearts and minds of the jury. But there is someone on the inside. Nicholas Easter is a juror with a girlfriend, Marlee, on the outside. they have a past ..... and their own agenda.",Runaway Jury,2003
N/A,#DUPE#,2001
"Matt Whitlock, the police chief of the small town of Banyan Key, Florida, is separated from his wife, Alex, a police homicide detective in MIami. Matt's been having an affair with Ann Merai Harrison, a woman who's separated from her abusive husband, Chris, and who says that she has cancer. When her doctor tells her of a new expensive treatment, Matt decides to give her the nearly half a million dollars in an evidence lock up that he seized from a local drug bust. When Ann and her husband turn up dead only days after naming Chief Whitlock as beneficiary on a million dollar Life insurance policy, things start heating up for Whitlock as the evidence his wife Alex is gathering stacks up against him. And as if things couldn't get worse, the D.E.A. now want the drug money a.s.a.p. Anxiety runs high for Whitlock as he scrambles to figure out who has set him up and also recover half a million dollars all while trying not to break a sweat or draw any suspicions. He's a man who is way out of his depth, nearly out of luck, and desperately close to being out of time.",Out of Time,2003
