Title,Year,Genre,Rated,Plot
Matchstick Men,2003,"Comedy, Crime, Drama",PG-13,"Meet Roy and Frank, a couple of professional small-time con artists. What Roy, a veteran of the grift, and Frank, his ambitious protégé, are swindling these days are ""water filtration systems,"" bargain-basement water filters bought by unsuspecting people who pay ten times their value in order to win bogus prizes like cars, jewelry and overseas vacations--which they never collect. These scams net the flim-flam men a few hundred here, another thousand there, which eventually adds up to a lucrative partnership. Roy's private life, however, is not so successful. An obsessive-compulsive agoraphobe with no personal relationships to call his own, Roy is barely hanging on to his wits, and when his idiosyncrasies begin to threaten his criminal productivity he's forced to seek the help of a psychoanalyst just to keep him in working order. While Roy is looking for a quick fix, his therapy begets more than he bargained for: the revelation that he has a teenage daughter--a child whose existence he suspected but never dared confirm. What's more troubling, 14-year-old Angela wants to meet the father she never knew. At first, Angela's appearance disrupts her neurotic father's carefully ordered routine. Soon, however, with his own unique spin on parenthood, Roy begins to enjoy a relationship he never dreamed of having with his daughter. But while he develops paternal feelings for the 14-year-old, she's developing a fascination with Daddy's questionable career."
Lara Croft Tomb Raider: The Cradle of Life,2003,"Action, Adventure, Fantasy",PG-13,"Intrepid British archaeologist Lara Croft has made perhaps the most important archaeological discovery in history: an orb that leads to the mythical Pandora's Box. Unfortunately, the orb falls into the hands of Jonathan Reiss, an evil scientist who deals in killer viruses and hopes to sell the secrets of the box as the ultimate weapon. Recruited by British Intelligence to get the orb back from Reiss, Lara recruits Terry Sheridan, a British marine turned mercenary (and her former love interest) to help. The two embark on an adventure that spans continents in an attempt to regain the orb..."
The Eye,2002,"Drama, Horror, Thriller",R,"A blind girl gets a cornea transplant so that she would be able to see again. However, she got more than what she bargained for when she realised she could even see ghosts. And some of these ghosts are down right unfriendly. So she embarks on a journey to find the origins of her cornea and to reveal the history of the previous dead owner ..."
Head of State,2003,Comedy,PG-13,"One candidate for the presidency dies in an accident a couple of weeks before the election. Meanwhile the alderman Mays Gilliam becomes a hero when he rescues a woman and her cat from an old house that would blow up. However his fiancee Kim does not pay his bills and dumps him, and Gilliam loses everything including his fancy car. When Senator Bill Arnot sees the news on television, he plots a scheme with the party advisors Martin Geller and Debra Lassiter to invite Mays to be the party nominee and lose the election for the other candidate, Vice-President Brian Lewis. Four years later, he would be the candidate and would have the chance of winning the election. Mays has a terrible beginning of campaign but when his older brother Mitch Gilliam meets him in Chicago, he advises Mays to be himself. Will he have the chance to be the first African American President of the USA?"
Sylvia,2003,"Biography, Drama, Romance",R,"In 1956, aspiring American poet Sylvia Plath meets fellow poet Edward Ted Hughes at Cambridge, where she is studying. Enthralled with the genius of his writing, Sylvia falls in love with him even before meeting him, and he quickly falls in love with her. They eventually marry. Sylvia quickly learns that others are also enthralled with her husband, for a combination of his good looks, charisma, fame and success. Sylvia lives in her husband's professional shadow as she tries to eke out her own writing career, which doesn't come as naturally to her as it does to Ted. She also suspects him of chronic infidelity. Both issues affect Sylvia's already fragile emotional state, she who once tried to commit suicide earlier in her life. Through her pain and her anger, she does gain minor success as a writer, with a completed semi-autobiographical novel and a few well received collection of poems. Following, she tries to regain some happiness in her life with Ted, but has an alternate plan if that does not work out as she wants."
The Texas Chainsaw Massacre,2003,Horror,R,"Driving through the backwoods of Texas, five youths pick up a traumatized hitchhiker, who shoots herself in their van. Shaken by the suicide, the group seeks help from the locals, but their situation becomes even more surreal when they knock on the door of a remote homestead. It's quickly apparent the residents are a family of inbred psychopaths, and the unlucky youths suddenly find themselves running for their lives. In hot pursuit is a disfigured, chainsaw-wielding cannibal known as Leatherface."
Swimming Pool,2003,"Crime, Drama, Mystery",R,"Sarah Morton is a famous British mystery author. Tired of London and seeking inspiration for her new novel, she accepts an offer from her publisher John Bosload to stay at his home in Luberon, in the South of France. It is the off-season, and Sarah finds that the beautiful country locale and unhurried pace is just the tonic for her--until late one night, when John's indolent and insouciant French daughter Julie unexpectedly arrives. Sarah's prim and steely English reserve is jarred by Julie's reckless, sexually charged lifestyle. Their interactions set off an increasingly unsettling series of events, as Sarah's creative process and a possible real-life murder begin to blend dangerously together."
Stone Reader,2002,"Documentary, Drama",PG-13,N/A
Shattered Glass,2003,"Drama, History",PG-13,"This film tells the true story of fraudulent Washington, D.C. journalist Stephen Glass (Christensen), who rose to meteoric heights as a young writer in his 20s, becoming a staff writer at ""The New Republic"" for three years (1995-1998), where 27 of his 41 published stories were either partially or completely made up. Looking for a short cut to fame, Glass concocted sources, quotes and even entire stories, but his deception did not go unnoticed forever, and eventually, his world came crumbling down..."
Chasing Papi,2003,"Comedy, Romance",PG,"The successful and handsome wolf executive of the cosmetic industry Thomas Fuentes has three sexy Latin girlfriends: in Miami, the waitress Cici; in Chicago, the intellectual lawyer Lorena; and in New York, the ""daddy's girl"" Patricia. When the three women decide to visit him in Los Angeles, Thomas is in a big trouble."
Jackass: The Movie,2002,"Documentary, Action, Comedy",R,"Johnny Knoxville and his crazy friends appear on the big screen for the very first time in Jackass: The Movie. They wander around Japan in panda outfits, wreak havoc on a once civilized golf court, they even do stunts involving LIVE alligators, and so on. While Johnny Knoxvile and his pals put their life at risk, they are entertaining people at the same time. Get ready for Jackass: The Movie!!"
Northfork,2003,"Drama, Fantasy",PG-13,"In a near-empty Northfork orphanage, Father Harlan gently tends to Irwin, an eight-year-old who lies between a dream state and death. As orphanage caretaker Harlan reads aloud about Northfork's years-ago forced evacuation to make way for a hydro-electric dam, Irwin's imagination takes flight. While a team of six men evacuate the last remaining citizens of the town, Irwin, too, invents a cast of characters to prepare himself for his own evacuation. (the above states the caretaker - who is actually the priest - is reading about a years-ago evacuation. In the movie, the evacuation is taking place as the boy lays dying!)"
Freaky Friday,2003,"Comedy, Family, Fantasy",PG,"The wide generation gap between Tess Coleman and her teenage daughter Anna is more than evident. They simply cannot understand each other's preferences. On a Thursday night they have a big argument in a Chinese restaurant. Both receive a fortune cookie each from the restaurant owner's mother which causes them to switch bodies next day. As they adjust with their new personalities, they begin to understand each other more and eventually it's the mutual self-respect that sorts the things out."
2 Fast 2 Furious,2003,"Action, Crime, Thriller",PG-13,EX LAPD cop Brian O'Conner (Paul Walker) teams up with his ex-con friend Roman Pearce (Tyrese Gibson) and works with undercover U.S. Customs Service agent Monica Fuentes (Eva Mendes) to bring Miami-based drug lord Carter Verone (Cole Hauser) down.
Underworld,2003,"Action, Fantasy, Thriller",R,"A war has been raging between the Vampires and Lycan for centuries, Selene (Beckinsale) is a death dealer, assigned to hunt down and eradicate the last of the Lycan. When she comes across Michael Corvin (Speedman) who holds the key to end the war she must decide where her allegiances will lie."
Mondays in the Sun,2002,"Comedy, Drama",R,"2001: men without jobs, in the port city of Vigo. Six men worked in a shipyard, now shuttered. They pass the time at La Naval, a bar opened by one of them after the yard closed. They face their futures in makeshift ways: Rico has his bar and a sharp 15-year-old daughter, Reina has become a watchman and a moralizer, Lino fills out job applications, Amador drinks heavily and talks of his wife's return; José is married to Ana, who works at a cannery and tires of being the breadwinner amidst José's emasculated moodiness; Santa, the group's conscience and troublemaker, occasionally fantasizes about Australia. In truth, all are joined like Siamese twins, adrift."
Elf,2003,"Comedy, Family, Fantasy",PG,"Buddy was a baby in an orphanage who stowed away in Santa's sack and ended up at the North Pole. Later, as an adult human who happened to be raised by elves, Santa allows him to go to New York City to find his birth father, Walter Hobbs. Hobbs, on Santa's naughty list for being a heartless jerk, had no idea that Buddy was even born. Buddy, meanwhile, experiences the delights of New York City (and human culture) as only an elf can. When Walter's relationship with Buddy interferes with his job, he is forced to reevaluate his priorities."
The Magdalene Sisters,2002,Drama,R,"A thoroughly mind-provoking film about 3 young women who, under tragic circumstances, see themselves cast away to a Magdalene Asylum for young women in 1964. One of many like institutions, the asylums are run like prisons and young girls are forced to do workhouse laundry and hard labor. The asylum, one of many that existed in theocratic Catholic Ireland, is for supposedly 'fallen' women. Here, young girls are imprisoned indefinitely and endure agonizing punishments and a long, harsh working system which leaves them physically drained and mentally damaged. As the girls bond together, it soon becomes clear that the only way out of the Magdalene convent is to escape, but with twisted Sister Bridget running the wing, any chances seem limited..."
Alex & Emma,2003,"Comedy, Romance",PG-13,"A romantic comedy: Alex is an author whose writer's block and gambling debts have landed him in a jam. In order get loan sharks off his back, he must finish his novel in 30 days or wind up dead. To help him complete his manuscript he hires stenographer Emma. As Alex begins to dictate his tale of a romantic love triangle to the charming yet somewhat opinionated stenographer, Emma challenges his ideas at every turn. Her unsolicited yet intriguing input begins to inadvertently influence Alex and his story and soon real life begins to imitate art."
The Italian Job,2003,"Action, Crime, Thriller",PG-13,"Led by John Bridger (Donald Sutherland) and Charlie Croker (Mark Wahlberg) a team is assembled for one last heist to steal $35 million in gold bars from a heavily guarded safe in Venice, Italy. After successfully pulling off the heist, a team member, Steve (Edward Norton), driven by greed and jealousy, arranges to take the gold for himself and eliminate the remaining members of the group. Thinking the team dead, he returns to L.A. with the gold. Charlie and the survivors of this betrayal follow Steve L.A. to exact revenge against the traitor. Charlie enlists the help of John Bridger's daughter, Stella (Charlize Theron) - a professional safe cracker, to get revenge. With Stella and the hacking skills of Lyle (Seth Green), the explosives skills of ""Left Ear"" (Yasiin Bey), and the driving skills of ""Handsome"" Rob (Jason Statham) this new team plans and executes a daring heist that weaves through the freeways and subways of L.A."
House of the Dead,2003,"Action, Adventure, Horror",R,"This film is a prequel to all of the The House of the Dead video games. Set on an island off the coast, a techno rave party attracts a diverse group of college coeds and a Coast Guard officer. Soon, they discover that their X-laced escapades are to be interrupted by zombies and monsters that attack them on the ground, from the air, and in the sea, ruled by an evil entity in the House of the Dead..."
Daddy Day Care,2003,"Comedy, Family",PG,"In the comedy Daddy Day Care, two fathers lose their jobs in product development at a large food company and are forced to take their sons out of the exclusive Chapman Academy and become stay-at-home fathers. With no job possibilities on the horizon, the two dads open their own day care facility, ""Daddy Day Care"", and employ some fairly unconventional and sidesplitting methods of caring for children. As ""Daddy Day Care"" starts to catch on, it launches them into a highly comedic rivalry with Chapman Academy's tough-as-nails director... who has driven all previous competitors out of business."
City of God,2002,"Crime, Drama",R,"Brazil, 1960s, City of God. The Tender Trio robs motels and gas trucks. Younger kids watch and learn well...too well. 1970s: Li'l Zé has prospered very well and owns the city. He causes violence and fear as he wipes out rival gangs without mercy. His best friend Bené is the only one to keep him on the good side of sanity. Rocket has watched these two gain power for years, and he wants no part of it. Yet he keeps getting swept up in the madness. All he wants to do is take pictures. 1980s: Things are out of control between the last two remaining gangs...will it ever end? Welcome to the City of God."
Radio,2003,"Biography, Drama, Sport",PG,"Football coach Harold Jones befriends Radio, a mentally-challenged man who becomes a student at T.L. Hanna High School in Anderson, South Carolina. Their friendship extends over several decades, where Radio transforms from a shy, tormented man into an inspiration to his community."
Open Range,2003,"Action, Drama, Romance",R,"Boss Spearman, Charley Waite, Mose Harrison and Button freegraze their cattle across the vast prairies of the West, sharing a friendship forged by a steadfast code of honor and living a life unencumbered by civilization. When their wayward herd forces them near the small town of Harmonville, the cowboys encounter a corrupt sheriff and kingpin rancher who govern the territory through fear, tyranny and violence. Boss and Charley find themselves inextricably drawn towards an inevitable showdown, as they are forced to defend the freedom and values of a lifestyle that is all too quickly vanishing. Amidst the turmoil, life suddenly takes an unexpected turn for the loner Charley when he meets the beautiful and warm spirited Sue Barlow, a woman who embraces both his heart and his soul."
Raising Victor Vargas,2002,"Drama, Romance",R,"Victor is growing up on the Lower East Side and is at the age where he is driven by desire and unchained by maturity. His image as a ladies man is shattered when he is found in Fat Donna's bedroom. Soon, as a result of his sister's big mouth, the whole Dominican community knows. Full of confidence, Victor sets out to reclaim his image by winning Judy. Judy proves to be elusive and difficult. Victor persists, and with a surprising tenderness, ultimately wins Judy's heart."
21 Grams,2003,"Crime, Drama, Thriller",R,"This is the story of three well-meaning but flawed people: Paul Rivers, an ailing mathematician lovelessly married to an English émigré; Christina Peck, an upper-middle-class suburban housewife, happily married homemaker with two young daughters, with hiding a secret past; and Jack Jordan, an ex-convict who has found in his Christian faith the strength to live a law-abiding life and raise a family. They will be brought together by a terrible accident that will change their lives. By the final frame, none of them will be the same as they will have learnt harsh truths about love, faith, courage, desire and guilt, and how chance can change our worlds irretrievably, forever."
Bruce Almighty,2003,"Comedy, Drama, Fantasy",PG-13,"Bruce Nolan, a television reporter in Buffalo, N.Y., is discontented with almost everything in life despite his popularity and the love of his girlfriend Grace . At the end of the worst day of his life, Bruce angrily ridicules and rages against God and God responds. God appears in human form and, endowing Bruce with divine powers, challenges Bruce to take on the big job to see if he can do it any better."
Standing in the Shadows of Motown,2002,"Documentary, Music",PG,"In 1959, Berry Gordy Jr. gathered the best musicians from Detroit's thriving jazz and blues scene to begin cutting songs for his new record company. Over a fourteen year period they were the heartbeat on every hit from Motown's Detroit era. By the end of their phenomenal run, this unheralded group of musicians had played on more number ones hits than the Beach Boys, the Rolling Stones, Elvis and the Beatles combined - which makes them the greatest hit machine in the history of popular music. They called themselves the Funk Brothers. Forty-one years after they played their first note on a Motown record and three decades since they were all together, the Funk Brothers reunited back in Detroit to play their music and tell their unforgettable story, with the help of archival footage, still photos, narration, interviews, re-creation scenes, 20 Motown master tracks, and twelve new live performances of Motown classics with the Brothers backing up contemporary performers."
The Singing Detective,2003,"Comedy, Crime, Musical",R,"""While hospitalized with an extreme case of psoriasis, novelist Dan Dark reworks his first book in his head. Feverish, paranoid and prone to musical outbreaks, he confuses himself with his protagonist, a detective investigating the murder of a prostitute in 1950s Los Angeles."""
The Secret Lives of Dentists,2002,Drama,R,The movie centers on a dentist who has a strange dream that blurs the boundaries between fantasy and reality.
My Life Without Me,2003,"Drama, Romance",R,"Ann, 23 years old, lives a modest life with her two kids and her husband in a trailer in her mother's garden. Her life takes a dramatic turn, when her doctor tells her that she has uterine cancer and only two months to live. She compiles a list of things to do before she dies."
Tears of the Sun,2003,"Action, Drama, Thriller",R,"Navy SEAL Lieutenant A.K. Waters and his elite squadron of tactical specialists are forced to choose between their duty and their humanity, between following orders by ignoring the conflict that surrounds them, or finding the courage to follow their conscience and protect a group of innocent refugees. When the democratic government of Nigeria collapses and the country is taken over by a ruthless military dictator, Waters, a fiercely loyal and hardened veteran is dispatched on a routine mission to retrieve a Doctors Without Borders physician, Dr. Lena Kendricks. Dr. Kendricks, an American citizen by marriage, is tending to the victims of the ongoing civil war at a Catholic mission in a remote village. When Waters arrives, however, Dr. Kendricks refuses to leave unless he promises to help deliver the villagers to political asylum at the nearby border. If they are left behind, they will be at the mercy of the enormous rebel army. Waters is under strict orders from his commanding officer Captain Bill Rhodes to remain disengaged from the conflict. But as he and his men witness the brutality of the rebels first-hand, they are won over to Dr. Kendricks' cause and place their lives at risk by agreeing to escort the villagers on a perilous trek through the dense jungle. As they move through the countryside on foot, Waters' team, experts at evasion and concealment, are inexplicably and ferociously pursued by an army of rebels. They are confounded until they discover that, among the refugees, is the sole survivor of the country's previous ruling family, whom the rebels have been ordered to eliminate at all costs. Waters and his small band of soldiers must weigh the life of one man against their own and the refugees they feel obliged to protect."
Love Actually,2003,"Comedy, Drama, Romance",R,"Against the backdrop of aged has-been rock star Billy Mack's Christmas themed comeback cover of ""Love Is All Around"" which he knows is crap and makes no bones about it much to his manager Joe's chagrin as he promotes the record, several interrelated stories about romantic love and the obstacles to happiness through love for Londoners are presented in the five weeks preceding Christmas. Daniel's wife has just passed away, leaving him to take care of his adolescent stepson Sam by himself. Daniel is uncertain how to deal with Sam and his problems without his wife present, especially in light of a potential budding romance within their household. Juliet and Peter have just gotten married. They believe that Peter's best friend and best man Mark hates Juliet but won't say so to his or her face. Others looking at the situation from the outside believe Mark is jealous of Juliet as he is in love with Peter himself. Jamie, a writer, is taking a writing retreat by himself in rural France following catching his latest girlfriend in an indiscretion. Jamie ends up spending much time in France with Aurélia, the Portuguese woman hired as the housekeeper. The question becomes not only if they can communicate their day-to-day needs with each other as she speaks no English, he speaks no Portuguese, and neither speaks French well, but communicate what seems to be their increasing mutual attraction to each other. Sarah has been in love with her co-worker Karl for the two years they have worked together, this attraction which everyone in their workplace knows about. Sarah has to decide if she can be forward enough to express this love directly to Karl, especially in light of what has been her personal priority of dealing with a family issue. Harry and Karen have been in a stable long term marriage. His new assistant Mia drops hints to him that she would like them to be romantically involved. Harry has to decide whether to fall to the temptation, especially considering being married to a perceptive wife. Single and relatively young David is the newly elected Prime Minister. At 10 Downing Street, he is attracted to one of the new household servants, slightly overweight Natalie, but isn't sure what to do about it seeing as to their respective positions, the probable public scrutiny, and an incident involving the visiting U.S. President. Socially unaware Colin believes that the lack of romantic love in his life is all the fault of standoffish British women. As such, he decides to take decisive albeit somewhat unusual geographic action. And John and Judy are movie body doubles. They can communicate with each other straightforwardly while they are simulating sex filming a movie, but they may not be able to translate the feelings behind that simulation in real life to each other."
Hey Arnold! The Movie,2002,"Animation, Adventure, Comedy",PG,"When a powerful developer named Mr. Scheck wants to knock down all the stores and houses in Arnold's neighborhood to build a huge ""mall-plex"", it looks likes the neighborhood is doomed to disappear. But with the help of a superhero and a mysterious deep-voiced stranger, Arnold and Gerald will need to recover a crucial document in order to save their beloved neighborhood."
Agent Cody Banks,2003,"Action, Adventure, Comedy",PG,"A government agent trains a typical teenager Cody Banks who loves to skateboard, hates math, and feels like a complete idiot around girls, in the ways of covert operations that require younger participants. But Cody's got a secret--he's actually part of a secret teen CIA program. Cody's living every boy's dream life--he can drive like a stunt man, has an incredible arsenal of cool gadgets, and his agency mentor, Ronica Miles, is totally hot. But Cody's training is put to the test when he's sent to pose as a prep school student and befriend fellow teen Natalie Connors in order to gain access to her father--a scientist unknowingly developing a fleet of deadly pair of twisted villains called the nanobots for the evil organization ERIS, which can destroy any carbon or silicon-based substance-to destroy the world's defense systems so he can threaten anyone who opposes him. From runaway cars and high-speed snowboard chases to a spectacular final mountaintop showdown, Cody has to use everything he's learned to prove himself as an agent and stop ERIS from completing their mission before their mission fails."
