Plot,Title,Year
"Stranded on a lonely road, a schoolbus full of high school basketball players, their coaches, and cheerleaders must defend themselves from the Creeper - a flesh-eating ancient beast that resurfaces on the earth every 23 years to feed. Meanwhile, a farmer and his son set out on a personal mission to hunt the Creeper down.",Jeepers Creepers II,2003
"Eva Dandridge is a very uptight young woman who constantly meddles in the affairs of her sisters and their husbands. Her in-laws, who are tired of Eva interfering in their lives, decide to set her up with someone so she can leave them alone. They end up paying Ray, the local ""playboy,"" $5,000 to date her. The plan goes by smoothly, but troubles comes when Ray actually falls in love with Eva.",Deliver Us from Eva,2003
"In this case, a group of archaeologists and combat experts led by Paul Walker and Frances O'Connor use a ""3-D fax machine"" (so much for technobabble!) to time-travel back to France in 1357, in hopes of retrieving Walker's father and returning safely to the present. No such luck! Fending for themselves against marauding hordes of medieval French warriors at war with the invading British, these semi-intrepid travelers find their body count rising, and the deadline for their return home is rapidly approaching.",Timeline,2003
"While waiting for her mothers reply to take her to the USA, Lilya idles the time away smoking, drinking and having fun with her, too, outcast friend Volodya. In time, the chance of a new life becomes non-existent; her life is going nowhere. Meeting a young man, she then finds a plane ticket in her hand and a new life in Sweden: a job, an apartment and prospects. All is not what it seems. There shall be work, there shall be housing and there shall be no escape. This is the stark, frank and disturbing vision of the life of a young victim of the underground sex trade and in all its tone of realism of abject poverty, despicable actions and of wanting to show that dreaming of a better life is not a crime but that life can shatter the illusion of a happy ending.",Lilya 4-Ever,2002
"In ancient China, before the reign of the first emperor, warring factions throughout the Six Kingdoms plot to assassinate the most powerful ruler, Qin. When a minor official defeats Qin's three principal enemies, he is summoned to the palace to tell Qin the story of his surprising victory.",Hero,2002
"Gigli, a lowly and inept hitman, is assigned a job by the mob to kidnap an intellectually disabled brother of a California district attorney. Gigli abducts the brother from his mental hospital and holds him hostage in his apartment. Ricki, a ""lesbian assassin"", is sent to oversee Gigli's job and make sure he doesn't screw it up. Comedic high jinks ensue as the two go on the lam and start to fall in love.",Gigli,2003
"Set against the bright lights of Manhattan, a tale which takes a comic, urbane look at the modern male ego at war in the singles scene trenches. Roger Swanson is a hopelessly cynical advertising copywriter with a razor-sharp wit who believes he has mastered the art of manipulating women. But Roger's seemingly foolproof world of smooth talk and casual sex begins to unravel when he is paid a surprise visit by his teenager nephew, Nick. Hoping to settle, once and for all, the issue of his virginity, Nick begs Roger to school him in the art of seducing women. Welcoming the challenge, Roger guides Nick through the city's wild nightlife for an all-night crash course, only to realize that he--the adult--still has something to learn about what women, and men, really want.",Roger Dodger,2002
"1953. Desmond Doyle is devastated when his wife abandons their family on the day after Christmas. His unemployment and the fact that there is no woman in the house to care for the children, Evelyn, Dermot and Maurice, make it clear to the authorities that his is an untenable situation. The Irish courts put the Doyle children into Church-run orphanages. Although a sympathetic judge assures Desmond that he'll get his children back after he gets a job, he learns there's another barrier. During that time, Evelyn suffers abuse while Desmond goes to court to get his children back. A barmaid, her brother, her suitor, and a tippling footballer become Desmond's team.",Evelyn,2002
"The Earth's core has stopped spinning. Disasters are appearing all over the world: Birds acting crazy, powerful thunderstorms, 32 people die within seconds of each other when their pacemakers quit working. Dr. Josh Keyes and his crew of five (total members: 6) go down to the center of the Earth to set off a nuclear device to make the Earth's core start spinning again or Mankind will perish.",The Core,2003
"In San Francisco, Zoe is a shy and outcast in her working place that adores the love songs she listens to the radio. Zoe goes to a bar with her coworkers and she spends the night talking to a colleague that also like mushy songs. She drinks with him and when she goes to her car to take her cellular to call a taxi, a stalker forces her to drive away. A police officer sees the intruder in her car and asks her to stop the car. However, the guy forces Zoe to run over the policeman that is hit and dies. Zoe has a car accident and the aggressor escapes. Neither the police nor her defense lawyer believes on her words and Zoe is arrested for murdering the policeman. She is confined at home with an ankle bracelet under the surveillance of Daly, a lonely man that falls in love with Zoe. She tries to find a way to leave the spot to chase the criminal and prove her innocence.",Cherish,2002
"In 1965, Bob Crane, who had achieved some earlier success as a television supporting actor, was working as a successful morning radio DJ at KNX Los Angeles. Despite enjoying his work, photography (especially of the female form) and drumming, Crane wanted to be a movie star. So it was with some reluctance that he accepted the title starring role in a new television sitcom called Hogan's Heroes (1965), a WWII POW comedy. To his surprise, the show became a hit and catapulted him to television stardom. The fame resulting from the show led to excesses and a meeting with home video salesman and technician John Carpenter, with who he would form a friendship based on their mutual interests, namely excessive sex (for Crane, purely heterosexual sex) and capturing nude females on celluloid. His fame allowed Crane to have as much sex as he wanted, which was incongruent to his somewhat wholesome television friendly image, and the way he portrayed himself to almost everyone except Carpenter and his extramarital sex partners. His sex addiction was somewhat known but ignored by his high school sweetheart/first wife Anne Crane née Terzian, but well known by his second wife, Patti Olson, better known as Sigrid Valdis, his Hogan's Heroes co-star. Especially after the end of Hogan's Heroes in 1971, this incongruence and his friendship with Carpenter, with who he would have a continuing love/hate relationship, would contribute to both his professional and personal downfall.",Auto Focus,2002
"Newly graduated psychiatrist Sam and his fiancee Alex move to Los Angeles for Sam's residency and into Sam's mother's house in upscale Laurel Canyon. Only problem is, Sam's mother is still there, supposedly finishing up a record that she's producing for the band of her new boy toy, Ian. She seems more interested in smoking pot and drinking than actually working though. Alex doesn't mind but Sam is quite upset. Alex starts off focused on her work (finishing a dissertation on genomics), but is soon distracted by the rock-'n-roll lifestyle going on around her. Meanwhile, Sam is equally distracted by beautiful Israeli intern Sara.",Laurel Canyon,2002
"When the singing Veggies encounter some car trouble, they're stranded at old, rundown seafood joint where nothing is quite as it seems. As Bob the Tomato and the kids settle in to wait for a tow truck to help get their van back on the road, the ""Pirates Who Don't Do Anything"" share a little story about a guy named Jonah. Jonah was kind of like a mailman except his messages came straight from God. Jonah loves his job, until the day comes when he has to deliver a message to the people of Nineveh. Instead of carrying out his mission, Jonah turns and sets sail in the opposite direction onboard a pirate ship. Soon Jonah embarks on an adventure that leads him into the belly of a whale, and to the heart of Nineveh for a hilarious showdown.",Jonah: A VeggieTales Movie,2002
"On the east coast of New Zealand, the Whangara people believe their presence there dates back a thousand years or more to a single ancestor, Paikea, who escaped death when his canoe capsized by riding to shore on the back of a whale. From then on, Whangara chiefs, always the first-born, always male, have been considered Paikea's direct descendants. Pai, an 11-year-old girl in a patriarchal New Zealand tribe, believes she is destined to be the new chief. But her grandfather Koro is bound by tradition to pick a male leader. Pai loves Koro more than anyone in the world, but she must fight him and a thousand years of tradition to fulfill her destiny.",Whale Rider,2002
"This is the inspiring captivating story of the legendary rapper Eminem. The troubled young aspiring rapper from a ghetto in Michigan must exert his last chances to become successful while dealing with his life in ruins. All is seemingly lost. He is now single, has only a few friends, an insane/alcoholic mother, and is dealt with poverty and living in a violent city on 8 mile. His only way out of the ghetto and torturous life he's living in is with his talent in rapping. Will B-Rabbit prevail and seize the shot he's given or will he let it slip?",8 Mile,2002
"Rachel Keller is a journalist investigating a videotape that may have killed four teenagers (including her niece). There is an urban legend about this tape: the viewer will die seven days after watching it. If the legend is correct, Rachel will have to run against time to save her son's and her own life.",The Ring,2002
"Cathy is the perfect 50s housewife, living the perfect 50s life: healthy kids, successful husband, social prominence. Then one night she stumbles in on her husband Frank, kissing another man, and her tidy world starts spinning out of control. In her confusion and grief, she finds consolation in the friendship of their African-American gardener, Raymond - a socially taboo relationship that leads to the further disintegration of life as she knew it. Despite Cathy and Frank's struggle to keep their marriage afloat, the reality of his homosexuality and her feelings for Raymond open a painful, if more honest, chapter in their lives.",Far from Heaven,2002
"When the Switchblade, the most sophisticated prototype stealth fighter created yet, is stolen from the U.S. government, one of the United States' top spies, Alex Scott, is called to action. What he doesn't expect is to get teamed up with a cocky civilian, World Class Boxing Champion Kelly Robinson, on a dangerous top secret espionage mission. Their assignment: using equal parts skill and humor, catch Arnold Gundars, one of the world's most successful illegal arms dealers, and foil his treacherous plans for the plane.",I Spy,2002
A criminal mastermind has set in motion a plan to infiltrate a high tech prison in order to persuade a death row inmate to reveal the whereabouts of $200 million worth of gold. It's up to an undercover FBI agent to stop him before it's too late.,Half Past Dead,2002
"This is the story of Ana, a first generation Mexican-American teenager on the verge of becoming a woman. She lives in the predominately Latino community of East Los Angeles. Freshly graduated from high school, Ana receives a full scholarship to Columbia University. Her very traditional, old-world parents feel that now is the time for Ana to help provide for the family, not the time for college. Torn between her mainstream ambitions and her cultural heritage she agrees to work with her mother at her sister's downtown LA sewing factory. Over the summer she learns to admire the hardworking team of women who teach her solidarity and teamwork. Still at odds with what her mother expects of her, Ana realizes that leaving home to continue her education is essential to finding her place proudly in the world as an American and Chicana.",Real Women Have Curves,2002
"Xander ""XXX"" Cage is a thrill seeker who until now has been deemed untouchable by the law. NSA Agent Gibbons forces XXX to cooperate with the government to infiltrate an underground Russian crime ring, and avoid going to prison. Gibbons sends XXX to enter this world of crime undetected where others have failed, using his natural athletic prowess and a whole lot of attitude. Xander must combat an organization led by a clever, ruthless and nihilistic Yorgi whose first target is the city of Prague.",xXx,2002
"Chris Flynn is driving his car for a job interview in another city. However, an accident with a trunk transporting chemical products blocks the highway and Chris looks for an alternative route through the mountains of West Virginia to accomplish his schedule. Due to a lack of attention, he crashes another car parked in the middle of the road with flat tires. Chris meets a group of five friends, who intended to camp in the forest, and they decide to leave the couple Francine and Evan on the place, while Chris, Jessie, Carly and her fiancé Scott tries to find some help. They find a weird cabin in the middle of nowhere, where three violent cannibalistic mountain men with the appearance of monsters live. The two couples try to escape from the mountain men while chased by them.",Wrong Turn,2003
"A sweet-natured Italian waiter named Pistachio Disguisey at his father Fabbrizio's restaurant, who happens to be a member of a family with supernatural skills of disguise. But moments later the patriarch of the Disguisey family is kidnapped Fabbrizio's former arch-enemy, Devlin Bowman, a criminal mastermind in an attempt to steal the world's most precious treasures from around the world. And it's up to Pistachio to track down Bowman and save his family before Bowman kills them!",The Master of Disguise,2002
"Forced to spend his summer holidays with his muggle relations, Harry Potter gets a real shock when he gets a surprise visitor: Dobby the house-elf, who warns Harry Potter against returning to Hogwarts, for terrible things are going to happen. Harry decides to ignore Dobby's warning and continues with his pre-arranged schedule. But at Hogwarts, strange and terrible things are indeed happening: Harry is suddenly hearing mysterious voices from inside the walls, muggle-born students are being attacked, and a message scrawled on the wall in blood puts everyone on his/her guard - ""The Chamber Of Secrets Has Been Opened. Enemies Of The Heir, Beware"" .",Harry Potter and the Chamber of Secrets,2002
"When he wakes up the morning after his bachelor party in bed with a strange woman, a man presumes he must have cheated on his fiancée. Guilt leads him to try to cover it up in the week before the wedding, high jinks ensue.",A Guy Thing,2003
"Four bodies are found in New York City. Why, why, why? The coincidence? They all died 48 hours after logging on to a site named feardotcom.com. Tough detective Mike Reilly collaborates with Department of Health associate Terry Huston to research these mysterious deaths. The only way to find out though what really happened is to enter the site itself...",Feardotcom,2002
Craig and Day Day have finally moved out of their parents houses and into their own crib. The cousins work nights at a local mall as security guards. When their house is robbed on Christmas Eve they team up to track him down.,Friday After Next,2002
"Camden College. Sean Bateman is the younger brother of depraved Wall Street broker Patrick Bateman. He's also a drug dealer who owes a lot of money to ""fellow"" dealer Rupert Guest, as well as a well-known womanizer, for he sleeps with nearly half of the female population on campus. Lauren Hynde is, technically, a virgin. She's saving herself for her shallow boyfriend, Victor Johnson, who's left the States to backpack across Europe. Her slutty roommate, Lara, has the hots for Victor as well. Paul Denton, who used to date Lauren, is openly bisexual and attracted to Mitchell Allen, who's dating Candice to prove to Paul that he's not gay. Sean loves Lauren. Paul loves Sean. And Lauren may love Sean.",The Rules of Attraction,2002
"At age 42, Rafael Belvedere is having a crisis. He lives in the shadow of his father, he feels guilty about rarely visiting his aging mother, his ex-wife says he doesn't spend enough time with their daughter and he has yet to make a commitment to his girlfriend. At his lowest point, a minor heart attack reunites him with Juan Carlos, a childhood friend, who helps Rafael to reconstruct his past and look at the present in new ways.",Son of the Bride,2001
"In an era when the country's first line of defense, intelligence, is more important than ever, this story opens the CIA's infamous closed doors and gives an insider's view into the Agency: how trainees are recruited, how they are prepared for the spy game, and what they learn to survive. James Clayton might not have the attitude of a typical recruit, but he is one of the smartest graduating seniors in the country - and he's just the person that Walter Burke wants in the Agency. James regards the CIA's mission as an intriguing alternative to an ordinary life, but before he becomes an Ops Officer, James has to survive the Agency's secret training ground, where green recruits are molded into seasoned veterans. As Burke teaches him the ropes and the rules of the game, James quickly rises through the ranks and falls for Layla, one of his fellow recruits. But just when James starts to question his role and his cat-and-mouse relationship with his mentor, Burke taps him for a special assignment to root out a mole. As the suspense builds toward a gripping climax, it soon becomes clear that the CIA's old maxims are true: ""trust no one"" and ""nothing is what it seems.""",The Recruit,2003
"Angelique, a young student, is in love with a married doctor. We see her attempts to make him leave his pregnant wife, but he does not appear for meetings or finally the booked journey to Florence. Then the movie is turned back to the beginning, and the view changes: We are now following the view of the doctor instead of Angeliques. And things look quite different now...",He Loves Me... He Loves Me Not,2002
"Amber is 40, beautiful, rich, spoiled, and arrogant beyond measure. Nothing makes this woman happy, including her wealthy but passive husband (Tony), a pharmaceutical kingpin. When Tony takes her on a private cruise from Greece to Italy, Amber is unimpressed at this impromptu no-frills vacation, and takes out her anger on the ship's first mate, Giuseppe. When a storm leaves the two shipwrecked on a deserted island, however, the tables suddenly turn...",Swept Away,2002
"A movie studio is being torn down. TV interviewer Genya Tachibana has tracked down its most famous star, Chiyoko Fujiwara, who has been a recluse since she left acting some 30 years ago. Tachibana delivers a key to her, and it causes her to reflect on her career; as she's telling the story, Tachibana and his long-suffering cameraman are drawn in. The key was given to her as a teenager by a painter and revolutionary that she helped to escape the police. She becomes an actress because it will make it possible to track him down, and she spends the next several decades acting out that search in various genres and eras.",Millennium Actress,2001
"Olivier - meticulous, careful, even-handed - teaches carpentry at a vocational school in Liège. He's asked to take on Francis, 16, a new student. He declines the request then begins to watch, even spy on, the new lad. Olivier knows something. Later that day, he's visited by Magali, his ex-wife, who tells him that she's remarrying and is pregnant. Olivier seems to follow instinctive responses: ""why today?"" he demands of Magali; he continues to follow Francis; he changes his mind about enrolling the youth. What's the history between the two? After that becomes clear, what is it Olivier will do? Is this precise and measured carpenter in control of himself?",The Son,2002
"Events over the course of one traumatic night in Paris unfold in reverse-chronological order as the beautiful Alex is brutally raped and beaten by a stranger in the underpass. Her boyfriend and ex-lover take matters into their own hands by hiring two criminals to help them find the rapist so that they can exact revenge. A simultaneously beautiful and terrible examination of the destructive nature of cause and effect, and how time destroys everything.",Irreversible,2002
"Basics: 2 guys who are gay, one female who is lonely for someone to love. The woman approaches 1 of the guys and wants him to seed her would be child...",Hush!,2001
N/A,#DUPE#,2002
"Several months have passed since The X-Men defeated Magneto and imprisoned him in a seemingly impregnable plastic chamber. One day, a mutant by the name of Nightcrawler infiltrates the White House and attempts to assassinate the president, setting off a chain reaction of anti-mutant measures by the government. Meanwhile, Logan is trying to discover his past. As scientist named William Stryker discovers Professor X's secret school and Cerebro, Magneto's partner, Mystique, is planning to break her leader out of prison. But when Professor X's school is attacked by Stryker's forces, Logan, Rogue, Iceman and a few are lucky to escape. Those who remain meet in Boston, where they form an uneasy alliance with Magneto to stop Stryker and rescue Professor X.",X-Men 2,2003
"A father, who is a failed former television reporter tries to mount a documentary about violence and sex among youths. He proceeds to have sex with his daughter who is now a prostitute and films his son being humiliated and hit by classmates. ""Q"", a perfect stranger somehow gets involved and enter the bizzare family who's son beats his mom, who in turn is also a prostitute and a heroin addict...",Visitor Q,2001
"Munich, 1918. German-Jew Max Rothman has returned to much of his pre-war life which includes to his wife Nina and their two children, to his mistress Liselore von Peltz, and to his work as an art dealer. He has however not returned to being an aspiring painter as he lost his dominant right arm during the war. He is approached by an aspiring painter, a thirty-year old Austrian war veteran named Adolf Hitler, who wants him to show his works. Although he doesn't think the paintings are all that original and he doesn't really like Hitler as a person, Rothman takes Hitler under his wings if only because of their camaraderie of being war veterans, and knowing that Hitler had nothing and no one to come back to after the war unlike himself. Rothman believes that Hitler has promise if only he can find his original artistic point of view. In part out of need for money, Hitler, on the urging of Captain Karl Mayr, agrees to work for the army as a political spokesman in anti-Semitic propaganda. Slowly, Hitler's view becomes a holistic one of a new world, where he begins to meld his art and politics. Rothman becomes excited about Hitler's artistic viewpoint, despite its anti-Semitic bent. The question becomes if the sentiments behind the view will take over its artistic merit.",Max,2002
"Jimmy Tong is just a lowly chauffeur for millionaire Clark Devlin, until Devlin has an accident that puts him in the hospital. Tong is sent back to fetch some things for Devlin and unknowingly tries on Devlin's tuxedo and finds that it gives extraordinary powers to anyone that dons the suit. This discovery thrusts Tong into world of international intrigue and espionage and pairs him with an inexperienced partner.",The Tuxedo,2002
"When anti-death-penalty activist David Gale is convicted and condemned to death for the murder of a colleague, reporter Bitsey Bloom sets out to learn the story behind Gale's crime. What she finds challenges her belief in Gale's guilt and, finally, in the justice system.",The Life of David Gale,2003
"The mafia's Paul Vitti is back in prison and will need some serious counseling when he gets out. Naturally, he returns to his analyst Dr. Ben Sobel for help and finds that Sobel needs some serious help himself as he has inherited the family practice, as well as an excess stock of stress.",Analyze That,2002
"3 Years after retiring from the FBI because of a near-fatal encounter with Hannibal Lecter, who was helping him catch the ""Chesapeake Ripper"", only to reveal it was Hannibal himself, Will Graham is asked by his ex-partner Jack Crawford to come solve one last case - 2 slaughtered families every full moon. They have 3 weeks until the next full moon to find the madman, but an innocent blind woman has found him first... Will Graham must risk his family's security and his own safety to track down this one last murderer - the epitome of all evil - The Red Dragon.",Red Dragon,2002
