Title,Year,Genre,Rated,Plot
So Fine,1981,Comedy,R,"While trying to get his father out of a financial jam, a man comes up with an idea that turns into an unexpected overnight financial fashion success - the bottomless pants."
Sharky's Machine,1981,"Action, Crime, Drama",R,"Tom Sharky is a narcotics cop in Atlanta who's demoted to vice after a botched bust. In the depths of this lowly division, while investigating a high-dollar prostitution ring, Sharky stumbles across a mob murder with government ties, and responds by assembling his downtrodden fellow investigators (Sharky's ""machine"") to find the leaders and bring them to justice before they kill off all his partners and witnesses, including Sharky himself."
Road Games,1981,"Mystery, Thriller",PG,"Pat Quid is driving a semi across Australia. On the way he encounters various other travellers, and the occasional hitchhikers repeatedly as they're traveling the same road. A favorite pastime of Pat is to play games to pass the time on the journey. (Such as to make up backgrounds of the other people on the road.) Pamela is one hitchhiker he picks up. But when she disappears, he suspects that the driver of a van who has been acting a little strange, (Smith or Jones) maybe the serial killer mentioned on the radio. But his pursuit of the van driver brings him to the attention of the police, who begin to suspect him."
Ragtime,1981,Drama,PG,"The story runs in the 1910's New York. Coalhouse Walker Jr. is a black piano player. He has won fame and fortune playing with a jazz band. Some white men do not like this situation, and one day they assault him and spoil his brand new car. Walker tries by all means to get justice, without an answer..."
Raggedy Man,1981,Drama,R,"It's 1944 in the small town of Gregory, Texas. Divorcée Nita Longley has been brought into the town by the telephone company to work as its switchboard operator, a job which requires her to be at the switchboard day and night. She was originally told by her boss Mr. Rigby that this job would only be a stepping-stone to a more lucrative job with regular working hours, which Mr. Rigby seems to be reneging on since he has now told her that her position is frozen due to the war. As such, Nita feels trapped by this situation. Nita lives in the telephone switchboard office building with her two sons, adolescent Harry and infant Henry. Because of her marital status, many of the townsfolk, especially the men, view Nita either with contempt or as a loose woman. One evening, Teddy Roebuck, a sailor on a four day furlough who is hitchhiking back to his home in Ardmore, Oklahoma, stops by to make a telephone call. When he learns that the reason for his trip home no longer exists, Teddy decides to stay in Gregory instead. Teddy strikes up a friendship with Nita and her two boys, which blossoms into love. The appearance of this stranger does not sit well with locals Calvin and Arnold, who had plans of having their way with loose Nita, who earlier rebuked their advances. The town's unidentified disfigured man, who Nita fears, may ultimately provide her with the ability to move on with her life."
The Professional,1981,"Action, Crime, Drama",R,"French secret agent Joss Baumont is sent to one of the African countries to kill their president Njala. However, at the last moment the political situation changes and the French secret service turns him in to the African authorities, and he is sentenced to a long-term imprisonment. After the daring escape he returns to France and deliberately informs his former chiefs of his presence promising them to kill Njala who has just arrived to the country with the official visit."
Polyester,1981,Comedy,R,"Francine Fishpaw is an upper middle class suburban housewife in Baltimore. Unfortunately for this ""good Christian woman"", the money to support her lifestyle comes from her husband's porno theater, the neighbors are protesting, her son is the notorious ""Baltimore Stomper"", her daughter is knocked up by a local hoodlum, and her husband is having an affair with his secretary."
Piranha Part Two: The Spawning,1981,"Drama, Horror, Romance",R,"A sunken US supply ship off a Caribbean island resort is the focus for a series of mysterious piranha attacks. Investigating the death of one of her son's companions after a scuba-diving trip, Anne Kimbrough breaks into the morgue with holidaymaker Tyler Sherman, only to discover that the fish have wings and can fly. But the hotel manager refuses to call off the annual fish fry on the beach, with inevitable consequences..."
Pennies from Heaven,1981,"Drama, Musical, Romance",R,"In Chicago during the 1930s depression, sheet music salesman Arthur Parker is trying to sell his products, but it's not easy to convince unwilling music store owners to buy them. Although he's already married to the somewhat drab Joan, when he meets school teacher Eileen in a music store, he falls in love with her."
Neighbors,1981,Comedy,R,"One man's quiet suburban life takes a sickening lurch for the worse when a young couple move into the deserted house next door. From the word go it is obvious these are not the quiet professional types who *should* be living in such a nice street. As more and more unbelievable events unfold, our hero starts to question his own sanity... and those of his family."
My Dinner with Andre,1981,"Biography, Comedy, Drama",PG,"Wallace Shawn and Andre Gregory, apparently playing themselves, share their lives over the course of an evening meal at a restaurant. Gregory, a theater director from New York, is the more talkative of the pair. He relates to Shawn his tales of dropping out, traveling around the world, and experiencing the variety of ways people live, such as a monk who could balance his entire weight on his fingertips. Shawn listens avidly, but questions the value of Gregory's seeming abandonment of the pragmatic aspects of life."
Modern Problems,1981,"Comedy, Fantasy, Sci-Fi",PG,"Air traffic controller Max Fiedler is unhappy with his career and his second marriage. An exposure to toxic waste gives him the power of telekinesis. He comes to a crossroads at a beachhouse he shares with his wife, his ex, and a voodoo priestess."
"The Looney, Looney, Looney Bugs Bunny Movie",1981,"Animation, Comedy, Crime",G,"This is the second feature-length film containing classic Warner Brothers cartoons linked together by newly animated footage. It is divided into three parts, all of which are being shown in a theater as part of a film ceremony honoring the classic Looney Tunes characters. Part 1 involves Yosemite Sam's pact with the Devil to exchange his place in Hell with Bugs Bunny, provided that Sam can lure Bugs into sin and then kill him. Part 2 is a parody of TV crime-fighting dramas as Bugs is selected by law-enforcement to find and apprehend gangster Rocky, who has kidnaped Tweety Bird for a ransom. Part 3 is an Academy Awards-like contest in which various classic cartoon shorts are showcased."
The Hand,1981,"Drama, Horror, Thriller",R,"Jon Lansdale is a comic book artist who loses his right hand in a car accident. The hand was not found at the scene of the accident, but it soon returns by itself to follow Jon around, and murder those who anger him."
Gregory's Girl,1980,"Comedy, Drama, Romance",PG,"In his Scottish New Town home, gangling Gregory and his school-friends are starting to find out about girls. He fancies Dorothy, not least because she has got into the football team - and is a better player than him. He finally asks her out, but it is obviously the females in control of matters here, and that very much includes Gregory's younger sister."
Gallipoli,1981,"Adventure, Drama, History",PG,"The story of a group of young Australian men who leave their various backgrounds behind and sign up to join the ANZACs in World War I. They are sent to Gallipoli, where they encounter the resolute Turkish army."
Galaxy of Terror,1981,"Action, Adventure, Horror",R,"A spacecraft travels to a distant planet to rescue the crew of another spaceship that crashed, but their own craft, damaged in the landing, needs repair. Baelon commands the rescue team formed of his rival Cabren, Alluma, Dameia, Quuhod and the rookie Cos. While looking for but not finding survivors from the former expedition, Cos is murdered; however, they cannot leave the planet due to a projected electromagnetic field. Commander Ilvar joins the team to search for the cause of the interference, while Captain Trantor, technician Ranger and cook Kore stay in the craft. One by one, rescue team members are killed in weird situations materialized from their own fears by an ancient alien pyramid."
The Four Seasons,1981,"Comedy, Drama",PG,"Three middle-aged wealthy couples take vacations together in Spring, Summer, Autumn and Winter. Along the way we are treated to mid-life, marital, parental and other crises."
First Monday in October,1981,"Comedy, Drama",R,"Ruth Loomis becomes the first woman appointed to the United States Supreme Court. A staunch conservative, she immediately runs into conflict with Dan Snow, the high court's resident liberal. Although, they never agree on the issues before the Court, they develop a respect and affection for one another after several comedic encounters."
The Fan,1981,"Drama, Horror, Thriller",R,Douglas is a lonesome record salesman and a true fan of the actress Sally Ross. Every day he writes her gleaming letters of love. But the only response he gets are formal letters. So his love turns into hatred.
Continental Divide,1981,"Comedy, Romance",PG,"Ernie Souchak (John Belushi), a tough Chicago reporter, gets a little too close to the Mob, and is assaulted by two crooked police officers sent by a crooked councilman, and ends up in the hospital. To take the heat off of him, his editor sends him to Colorado to investigate an eagle researcher ('Blair Brown'). Sparring partners at first, the pair eventually fall in love, but Souchak must return to Chicago when one of his sources is mysteriously killed."
Clash of the Titans,1981,"Action, Adventure, Family",PG,"Perseus is the favored son of the god Zeus, but he has unwittingly ticked off the sea goddess Thetis. Just to make things worse, Perseus falls in love with the lovely Princess Andromeda, who used to be engaged to Thetis's son. Soon Perseus is off on one quest after another, with Zeus helping, Thetis hindering, and lots of innocent bystanders getting stabbed, drowned, and squished."
Caveman,1981,"Comedy, Romance",PG,"A simple caveman accidently becomes leader of a clan of cavemisfits and outcasts. But he ultimately wants to outsmart the bigger, stronger leader of his former clan and win the affection of a beautiful cavewoman."
Carbon Copy,1981,"Comedy, Drama",PG,"A white corporate executive is surprised to discover that he has a black teen-age son who can't wait to be adopted into the, almost-exclusively-white community of, San Marino, California."
The Burning,1981,Horror,R,"A janitor at a summer camp is accidently burned severely from a prank. Years later, he is released from an institute, and returns to the camp with a pair of hedge clippers to take revenge on the campers."
Blow Out,1981,"Mystery, Thriller",R,"This stylish Brian De Palma thriller plays off the theme of the unsuspecting witness who discovers a crime and is thereby put in grave danger, but with a novel twist. Jack Terry is a master sound recordist who works on grade-B horror movies. Late one evening, he is recording sounds for use in his movies when he hears something unexpected through his sound equipment and records it. Curiosity gets the better of him when the media become involved, and he begins to unravel the pieces of a nefarious conspiracy. As he struggles to survive against his shadowy enemies and expose the truth, he does not know whom he can trust."
Absence of Malice,1981,"Drama, Romance, Thriller",PG,"Mike Gallagher is a Miami liquor wholesaler whose deceased father was a local mobster. The FBI organized crime task force have no evidence that he's involved with the mob but decide to pressure him into perhaps revealing something - anything - about a murder they're sure was a mob hit. They let Megan Carter, a naive but well-meaning journalist, know he is being investigated and Gallagher's name is soon all over the newspaper. Gallagher has an iron-clad alibi for when the murder occurred but won't reveal it to protect his fragile friend Teresa. When Carter publishes her story, tragedy ensues. Needing to make amends, Carter tells Gallagher the source of the first story about him and he sets out to teach the FBI and the Federal Attorney a lesson."
Xanadu,1980,"Fantasy, Musical, Romance",PG,"The Greek muses incarnate themselves on Earth to inspire men to achieve. One of them, incarnated as a girl named Kira, encounters an artist named Sonny Malone. With the help of Danny McGuire, a man Kira had inspired forty years earlier, Sonny builds a huge disco roller rink."
Wholly Moses!,1980,"Comedy, Fantasy",PG,"Harvey and Zoey, two tourists travelling through Israel, discover an ancient scroll describing the life of Herschel, the man who was almost Moses. Herschel receives the command from God to free his people from Egyptian slavery, but Moses keeps blundering by and taking all the credit. Several other biblical stories, such as Lot and his wife, David and Goliath, and the miracles of Jesus, are also parodied in this story of the life of a man trying to follow the path to God, but somehow always seeming to lose his way."
Urban Cowboy,1980,"Drama, Romance, Western",PG,"Bud Davis is a country boy who moves to the city to visit his uncle and his family. He starts hanging out at Gilley's, the popular nightclub owned by Mickey Gilley himself. He takes a job at the oil refinery where his uncle works, hoping to save enough money to buy some land. He also meets a cowgirl named Sissy, they dance together, fall in love and suddenly get married. And then their marriage is shattered when Bud sees Sissy allegedly seeing con man Wes, who teaches her how to ride the mechanical bull... and plans to rob Gilley's. When a bull-riding contest at Gilley's is announced, Bud decides to sign up. Can he win the contest and save his marriage to Sissy?"
Stir Crazy,1980,"Comedy, Crime",R,Skip and Harry are framed for a bank robbery and end up in a western prison. The two eastern boys are having difficulty adjusting to the new life until the warden finds that Skip has a natural talent for riding broncos with the inter-prison rodeo coming up.
Smokey and the Bandit II,1980,"Action, Comedy",PG,"It's been a few years since Cletus and the Bandit made their famous 28-hour run to Texas for a few cases of Coors. Bandit is now a washed-up has-been living in the past, until Big Enos and Little Enos make him another offer: Transport a live Elephant across country in 3 days or less."
Shogun Assassin,1980,"Action, Adventure",R,"Long ago there was a great samurai warrior who served his Shogun honorably. The Shogun however grew paranoid as he became more and more senile. The Shogun sought to destroy all those who might stand to oppose his rule, and so he sent his ninja spies to the samurai's home. The ninjas failed to kill the samurai, but did kill his beloved wife. From then on, the samurai swore on his honor to seek out the Shogun and avenge the death of his love. The samurai roams the countryside with his toddler son taking on mercenary work for money until the final battle with the Shogun's three Masters of Death."
The Young Master,1980,"Action, Adventure, Comedy",PG-13,"After failing his fellow students in a Lion Dance competition, Dragon (Jackie Chan) is sent away from his school in disgrace, on the condition that he must find his errant brother. Much martial arts mayhem and mistaken-identity silliness ensue."
Serial,1980,Comedy,R,"It's the end of the '70s. Hippies are assimilating, women are raising their consciousness, and men are becoming confused and ineffectual. Don't expect to be able to keep track of all the names or who's sleeping with whom; the picture very skillfully conveys the hopeless muddle through which the many characters move as they try to Find Themselves."
Seems Like Old Times,1980,"Comedy, Romance",PG,"Writer Nick Gardenia is kidnapped from his California cliffhouse and forced to rob a bank. Now a fugitive, he seeks help from his ex, Glenda. She is a public defender remarried to a prosecutor, and we get a houseful of hijinks."
Scanners,1981,"Horror, Sci-Fi, Thriller",R,"Darryl Revok is the most powerful of all the scanners, and is the head of the underground scanner movement for world domination. Scanners have great psychic power, strong enough to control minds; they can inflict enormous pain/damage on their victims. Doctor Paul Ruth finds a scanner that Revok hasn't, and converts him to their cause - to destroy the underground movement."
Return of the Secaucus Seven,1979,Drama,R,"The Secaucus 7 of the film's title are seven friends who, during their college days, were arrested in New Jersey on their way to a protest in Washington. The film takes place ten years after all that, as the friends gather at the home of Mike and Katie, now schoolteachers in New Hampshire, bringing with them old problems and new: Maura has left Jeff and seeks consolation with his best friend, J.T.; J.T., arguably the least successful of the friends, finally gets the courage to move to Los Angeles to start a career as a songwriter; Irene brings her new boyfriend along, hoping he'll like and be liked by her friends and expecting them to challenge him for his more-conservative politics; and more. This is the film that inspired ""The Big Chill."""
The Wanderers,1979,Drama,R,"Set against the urban jungle of 1963 New York's gangland subculture, this coming of age teenage movie is set around the Italian gang the Wanderers. Slight comedy, slight High School angst and every bit entertaining with its classic 1950's Rock n' Roll soundtrack such as ""Walk Like a Man"", ""Big Girls Don't Cry"" by The Four Seasons and ""My Boyfriend's Back"" by The Angels. Focusing around a football game where the different gangs play with and against each other, then at its grand finale, come together in a mass of union to defend their honour and their turf. Nostalgic stuff and above all a Rock n' Roll retrospective on a grand musical era. Timeless."
Tom Horn,1980,"Crime, Drama, Romance",R,A renowned former army scout is hired by ranchers to hunt down rustlers but finds himself on trial for the murder of a boy when he carries out his job too well. Tom Horn finds that the simple skills he knows are of no help in dealing with the ambitions of ranchers and corrupt officials as progress marches over him and the old west.
Time After Time,1979,"Adventure, Drama, Sci-Fi",PG,"It's 1893 London. Futurist H.G. Wells believes that the future holds a Utopian society. He also believes in time travel. He has just built a time machine which he is displaying to a group of skeptical friends, including surgeon Dr. John Leslie Stevenson. Unbeknown to Wells or anyone else among that circle, Stevenson is better known to the public as Jack the Ripper. Just as the police are about to capture Stevenson, he uses the time machine to escape, with Wells being the only one who knows what happened to him. Not telling anyone except his trusting housekeeper, Wells follows Stevenson in order to capture and bring him back to face justice. Where Stevenson has gone is 1979 San Francisco. There, Wells is dismayed to find that the future is not Utopia as he had predicted. But Wells is also picked up by a young woman named Amy Robbins. As Wells and Amy search for Stevenson, Stevenson conversely is after Wells to obtain the master key to the time machine. As Stevenson continues his murderous ways, he will stop at nothing to achieve his desires, which places Amy in danger."
The Rose,1979,"Drama, Music, Romance",R,"Bette Midler plays The Rose, a female rock star strikingly similar to Janis Joplin. The film follows Rose's career during her last tour, as she's determined to return to her Florida hometown. Although a success, she's exhausted and lonely but continued working by her gruff and greedy manager. Though loud and brassy, Rose is an insecure alcoholic and former drug user who seems to crave approval in her life. She begins a romance with a limousine driver, who's actually an AWOL sergeant from the United States Army. Her rock and roll lifestyle of Drugs, Sex, and Rock and Roll and constant touring lead her to an inevitable breakdown."
Zombie Holocaust,1980,Horror,R,"The members of an expedition in search for the last faithful of Kito, the cannibal god, land on a small island in the Moluccas (East Indies) and are soon hunted by cannibals and zombies, these being created by a sinister Doctor O'Brien who is experimenting with corpses. Suzan, a sexy lady in the expedition team, eventually takes a hold on things, as she is accepted as queen of the cannibals, and direct them against the mad scientist and his army of zombies."
The Onion Field,1979,"Crime, Drama",R,"Greg Powell is a disturbed ex-con who recruits Jimmy Smith (aka Jimmy Youngblood), a petty thief, as his partner in crime. Powell panics one night when the two of them are pulled over by a pair of cops for broken brake-lights. Powell decides to kidnap the cops and Smith, as always, reluctantly goes along with Powell's crazy scheme. The group drives out to a deserted onion field in Bakersfield, California and one officer is shot while the other escapes. The remainder of the film explores the nature of the American justice system, as well as the devastating psychological effects of this event and the trial on the surviving officer."
Nosferatu the Vampyre,1979,Horror,PG,"Jonathan Harker is sent away to Count Dracula's castle to sell him a house in Wismar where Jonathan lives. But Count Dracula is a vampire, an undead ghoul living off of men's blood. Inspired by a photograph of Lucy Harker, Jonathan's wife, Dracula moves to Wismar, bringing with him death and plague... An unusually contemplative version of Dracula, in which the vampire bears the curse of not being able to get old and die."
The Main Event,1979,"Comedy, Romance, Sport",PG,"Hillary Kramer, successful Perfume magnate awakes one morning to find that her accountant has robbed her blind and left for South America. Going through all of her remaining assets she finds a boxer, purchased as a tax write off. She decides to take Kid Natural, (Eddie Scanlon) who is much more at home giving driving lessons, into the ring and use him as her key to riches. Eddie thinks this will only get him killed and resists."
A Little Romance,1979,"Adventure, Comedy, Romance",PG,"A French boy (Daniel) and an American girl (Lauren), who goes to school in Paris, meet and begin a little romance. They befriend Julius who enchants them with his storytelling. In an attempt to ensure the teens' love forever, the three journey to Venice."
The Great Train Robbery,1978,"Adventure, Crime, Drama",PG,"Sutherland and Connery wish to rob a moving train's safe in Victorian England. They need wax impressions of keys, coffins, dead cats, and a great deal of planning in order to pull it off."
The Electric Horseman,1979,"Comedy, Drama, Romance",PG,"Sonny Steele used to be a rodeo star, but his next appearance is to be on a Las Vegas stage, wearing a suit covered in lights, advertising a breakfast cereal. When he finds out they are going drug the horse in case its too frisky, he rides off into the desert..."
The Black Stallion,1979,"Adventure, Family, Sport",G,"While traveling with his father, young Alec becomes fascinated by a mysterious Arabian stallion who is brought on board and stabled in the ship he is sailing on. When it tragically sinks both he and the horse survive only to be stranded on a desert island. He befriends it, so when finally rescued, both return to his home where they soon meet Henry Dailey, a once-successful trainer. Together they begin training the stallion to race against the fastest horses in the world."
1941,1979,"Action, Comedy, War",PG,"Hysteria grips California in the wake of the bombing of Pearl Harbor. An assorted group of defenders attempt to make the coast defensible against an imagined Japanese invasion, in this big budget, big cast comedy. Members of a Japanese submarine crew scout out the madness, along with a Captain in Germany's Kreigsmarine (Navy)."
