Title,Year,Genre,Rated,Plot
Paper Moon,1973,"Comedy, Crime, Drama",PG,"Adapted from the novel, ""Addie Pray"" (1971) by Joe David Brown, PAPER MOON is the story of Moses Pray and Addie Loggins. With scenery reminiscent of ""The Grapes of Wrath,"" the film is set in the depression-era Midwestern region of the United States. As the movie opens, we see a small group of mourners clustered at a graveside. Among the mourners is Addie, the dead woman's small daughter. Moses Pray -- ostensibly of the ""Kansas Bible Company"" -- approaches the group, as the service concludes, and two of the elderly women remark that the child bears some resemblance to him and asks if he might be related. ""If ever a child needed kin, it's now,"" one lady says. With no knowledge of who her father is, Addie's only haven is her Aunt's home in St. Joseph, Missouri. Having identified himself as a ""traveling man spreading the Lord's gospel in these troubled times,"" ""Mose"" is prevailed upon to deliver the helpless child to her Aunt since he's going that way, anyway. Addie, wise beyond her years, soon discovers that Mose is little more than a scam artist traveling from town to town delivering unordered Bibles and charging exorbitant prices to recently widowed women whom he identifies through the obituary columns of local papers. Soon, Addie and Mose become a team, traveling from town to town, making money in every dishonest way imaginable, and looking for the ultimate score. The colorful characters they meet along the way make the film all the more interesting. Paramount among these is ""Miss Trixie Delight,"" an exotic dancer who Mose rescues from a traveling carnival and her minion, Imogene. The film is peppered with ""regional"" dialog. Perhaps one of the most memorable lines of the movie is uttered when Mose is forced to wrestle a backwoodsman in order to trade his new car for the hillbilly's battered old truck. ""Make him say calf-rope, Leroy!"" one of the observers calls out."
Day for Night,1973,"Comedy, Drama, Romance",PG,"The shooting of ""Je vous presente Pamela"" (may I introduce Pamela) begins. This is the story of en English married wife falling in love and running away with the father of her French husband. Will be simultaneously shown the shooting, the behavior of the people (including the technical team) on the set, and a part of their private life (a factor of complication)..."
Jesus Christ Superstar,1973,"Drama, History, Musical",G,"Based on a concept album project written by Andrew Lloyd Webber and Tim Rice, and the subsequent long-running Broadway performance, this film tells the story of the final 6 days in the life of Jesus Christ through the troubled eyes of Judas Iscariot. Too often mis-labeled a musical, this film is a ""rock opera."" There are no spoken lines, everything is sung."
The Crazies,1973,"Action, Horror, Sci-Fi",R,"A biological weapon gone awry is only the start of problems in the little town of Evan's City, Pennsylvania. Bouts of insanity in the populace are leading to murder and rioting, until the US Army turns up - and things really start going to hell."
"Play It Again, Sam",1972,"Comedy, Romance",PG,"A mild mannered film critic is dumped by his wife and his ego is crushed. His hero persona is the tough guy played by Humphrey Bogart in many of his movies and the apparition of Bogart begins showing up to give him advice. With the encouragement of his two married friends, he actually tries dating again, with less than satisfactory results, until he relaxes."
The Last House on the Left,1972,"Horror, Thriller",R,"On the eve of her seventeenth birthday, Mari Collingwood tells her parents that she is going to the concert of underground band Bloodlust in New York with her friend Phyllis Stone. She borrows the family's car and heads with her friend to a dangerous neighborhood in the city. Meanwhile, the sadistic and cruel escapees Krug Stillo and Fred 'Weasel' Podowski are hidden in a hideout with their partners Sadie (Jeramie Rain) and Krug's addicted son Junior Stillo (Marc Sheffler) after killing two guards and one shepherd in their runaway. The two girls seek marijuana near the theater and meet Junior that offers some Colombian grass to them. They go to his apartment and are subdued by the criminals that rape Phyllis. On the next morning, they hide the girls in the trunk of their convertible and head to Canada. However, they have a problem with the car's rod and they stop on the road close to Mari's house. When Phyllis tries to escape, the gang stabs her to death and shots Mari after humiliating and raping them. They seek shelter in Mari's home, but during the night, her mother overhears a conversation of the criminals telling that they have killed her daughter. She tells her husband and they plot a scheme to revenge the death of their princess."
Butterflies Are Free,1972,"Comedy, Drama, Music",PG,"All Don Baker wants is a place of his own away from his over-protective mother. Don's been blind since birth, but that doesn't stop him from setting up in a San Francisco apartment and making the acquaintance of his off-the-wall, liberated, actress neighbor Jill. Don learns the kind of things from Jill that his mother would never have taught him! And Jill learns from Don what growing up and being free is really all about."
Boxcar Bertha,1972,"Crime, Drama, Romance",R,"Based on ""Sister of the Road,"" the fictionalized autobiography of radical and transient Bertha Thompson as written by physician Dr. Ben L. Reitman, 'Boxcar' Bertha Thompson, a woman labor organizer in Arkansas during the violence-filled Depression of the early '30's meets up with rabble-rousing union man 'Big' Bill Shelly and they team up to fight the corrupt railroad establishment and she is eventually sucked into a life of crime with him."
Two-Lane Blacktop,1971,Drama,R,"The Driver and The Mechanic are two car freaks driving a 1955 Chevy throughout the southwestern U.S. looking for other cars to race. They are totally dedicated to The Car and converse with each other only when necessary. At a gas station, The Driver and The Mechanic, along with a girl who has ingratiated herself into their world, meet G.T.O., a middle-aged man who fabricates stories about his exploits. It is decided to have a race to Washington, D.C., where the winner will get the loser's car. Along the way, the race and the highway metaphorically depict the lives of these contestants as they struggle to their destination."
Straw Dogs,1971,"Crime, Drama, Thriller",R,"Upon moving to Britain to get away from American violence, astrophysicist David Sumner and his wife Amy are bullied and taken advantage of by the locals hired to do construction. When David finally takes a stand it escalates quickly into a bloody battle as the locals assault his house."
Death in Venice,1971,Drama,GP,"In this adaptation of the Thomas Mann novel, avant-garde composer Gustave Aschenbach (loosely based on Gustav Mahler) travels to a Venetian seaside resort in search of repose after a period of artistic and personal stress. But he finds no peace there, for he soon develops a troubling attraction to an adolescent boy, Tadzio, on vacation with his family. The boy embodies an ideal of beauty that Aschenbach has long sought and he becomes infatuated. However, the onset of a deadly pestilence threatens them both physically and represents the corruption that compromises and threatens all ideals."
Macbeth,1971,"Biography, Drama, History",R,Roman Polanski's version of Shakespeare's tragedy about a Scottish lord who murders the king and ascends the throne. His wife then begins hallucinating as a result of her guilt complex and the dead king's son conspires to attack Macbeth and expose him for the murderer he is.
The Hospital,1971,"Comedy, Drama, Mystery",PG-13,"Herbert Bock, the chief of medicine in a New York City teaching hospital, is contemplating suicide; he's impotent, his wife has left him, and his children aren't speaking to him. His hospital is also suffering from a recent spate of inexplicable deaths. In the midst of these setbacks, Bock is romantically drawn to the much younger Barbara, whose father is a patient. As Barbara restores Bock's will to live, it turns out that the hospital deaths are murders."
The Andromeda Strain,1971,"Sci-Fi, Thriller",G,"When virtually all of the residents of Piedmont, New Mexico, are found dead after the return to Earth of a space satellite, the head of the US Air Force's Project Scoop declares an emergency. Many years prior to this incident, a group of eminent scientists led by Dr. Jeremy Stone (Arthur Hill) advocated for the construction of a secure laboratory facility that would serve as a base in the event an alien biological life form was returned to Earth from a space mission. Stone and his team - Drs. Dutton, Leavitt and Hall (David Wayne, Kate Reid, and (James Olson, respectively)- go to the facility, known as Wildfire, and try to first isolate the life form while determining why two people from Piedmont (an old wino and a six-month-old baby) survived. The scientists methodically study the alien life form unaware that it has already mutated and presents a far greater danger in the lab, which is equipped with a nuclear self-destruct device should it manage to escape."
Women in Love,1969,"Drama, Romance",R,"The battle of the sexes and relationships among the elite of Britain's industrial Midlands in the 1920s. Gerald Crich and Rupert Berkin are best friends who fall in love with a pair of sisters Gudrun, a sculptress and Ursula Brangwen, a schoolteacher. Rupert marries Ursula, Gerald begins a love affair with Gudrun, and the foursome embarks upon a Swiss honeymoon. But the relationships take markedly different directions, as Russell explores the nature of commitment and love. Rupert and Ursula learn to give themselves to each other; the more withdrawn Gerald cannot, finally, connect with the demanding and challenging Gudrun."
THX 1138,1971,"Drama, Sci-Fi, Thriller",R,"It's sometime in the future in a state controlled society, where conformity and homogeneity are the rule. What is also the rule is that the populace follows the wants of the faceless state without question. How this is achieved is through a mandatory drug regimen, which also suppresses human desire, with sexual intercourse and human relationships banned. The law of the state is policed by a force of robocops. The physical environment is totally within a manufactured enclosure, what being outside of this unknown. THX 1138 is a loyal subject, he who goes about his business as a skilled factory working building robocops. And even when he begins to have strange feelings, he does what is obliged by going to the state run confessional, which further brainwashes through its reinforced mantra of happiness, loyalty and understanding. THX 1138 is given a glimpse into the other side through his computer matched and thus appointed female roommate, LUH 3417, and her surveillance colleague SEN 5241, LUH 3417's vision which may be something that THX 1138 may want to continue despite its illegality. If THX 1138 is able to keep his activities from the authorities and the robocops, he will have to figure out what options are available to him."
Start the Revolution Without Me,1970,"Comedy, History",M,"An account of the adventures of two sets of identical twins, badly scrambled at birth, on the eve of the French Revolution. One set is haughty and aristocratic, the other poor and somewhat dim. They find themselves involved in palace intrigues as history happens around them. Based, very loosely, on Dickens's _A Tale of Two Cities_, Dumas's _The Corsican Brothers_, etc."
The Railway Children,1970,"Family, Drama",G,"The film opens in a happy, comfortable upper middle-class home in Edwardian London. One night in 1905, the three children see their father usher two strangers into his study. After an argument he leaves with them and does not return. They and their mother fall on hard times and eventually move to a cottage in the country. Yet they keep their spirits up and find ways to help others. Fascinated by the nearby railway, they wave to the passengers faithfully every day, and their vigilance and courage prevent an accident. Their kindness makes friends of some important people who can help solve the mystery of their missing father."
Hercules in New York,1970,"Adventure, Family, Fantasy",G,"After many centuries, Hercules gets bored living in Olympus (the home of the great Greek gods) and decides to move to... New York. But obviously, it is not easy for a man who lived in ancient Greece to get used to modern life. So, things get a little tricky, especially when Zeus sends a few gods to bring his semi-god son back to mount Olympus."
Z,1969,"Crime, Drama, History",PG,"In a mid-sized metropolis (population 500,000) in a right-wing military led country, a pacifist organization, which supports the opposition party in the government, is planning on holding an anti-military, nuclear disarmament rally. The organization's charismatic leader - the deputy - is scheduled to arrive in the town from the capital the day of the rally. Beyond the problems arranging the rally due to the probable incitement of violence at such a rally, the organization learns of an unconfirmed report that there will be an attempt on the deputy's life. The rally does happen, after which a three-wheeled kamikaze runs over the deputy, who eventually passes away from his injuries. The official report is that the incident was a drunken accident. In reality, the deputy's death was murder orchestrated by the secret police, the general for who likens the pacifist organization to mildew killing off agricultural crops. A magistrate is assigned to the case. Although he does have political views, he is more interested in finding out the truth, and as such has to wade through the political rhetoric and politically motivated testimony he hears. Thrown into the mix is a photojournalist who too is looking for the truth, as it, he believes, will make a great front page story."
Where Eagles Dare,1968,"Action, Adventure, War",PG,"During WW2 a British aircraft is shot down and crashes in Nazi held territory. The Germans capture the only survivor, an American General, and take him to the nearest SS headquarters. Unknown to the Germans the General has full knowledge of the D-Day operation. The British decide that the General must not be allowed to divulge any details of the Normandy landing at all cost and order Major John Smith to lead a crack commando team to rescue him. Amongst the team is an American Ranger, Lieutenant Schaffer, who is puzzled by his inclusion in an all British operation. When one of the team dies after the parachute drop, Schaffer suspects that Smith's mission has a much more secret objective."
Two Mules for Sister Sara,1970,"Adventure, Romance, War",GP,"Set in Mexico, a nun called Sara is rescued from three cowboys by Hogan, who is on his way to do some reconnaissance, for a future mission to capture a French fort. The French are chasing Sara, but not for the reasons she tells Hogan, so he decides to help her in return for information about the fort defences. Inevitably the two become good friends but Sara has a secret.."
Sweet Charity,1969,"Comedy, Drama, Music",G,"Taxi dancer Charity continues to have Faith in the human race despite apparently endless disappointments at its hands, and Hope that she will finally meet the nice young man to romance her away from her sleazy life. Maybe, just maybe, handsome Oscar will be the one to do it."
The Italian Job,1969,"Action, Comedy, Crime",G,"Charlie's got a 'Job' to do. Having just left prison, he finds one of his friends has attempted a high risk job in Italy right under the nose of the Mafia. Charlie's friend doesn't get very far so Charlie takes over the 'Job'. Using three Mini Coopers, a couple of Jaguars and a bus, he hopes to bring Torino to a standstill, steal the Gold and escape."
"Hello, Dolly!",1969,"Adventure, Comedy, Musical",G,"A matchmaker named Dolly Levi takes a trip to Yonkers, New York to see the ""well-known unmarried half-a-millionaire,"" Horace Vandergelder. While there, she convinces him, his two stock clerks and his niece and her beau to go to New York City. In New York, she fixes Vandergelder's clerks up with the woman Vandergelder had been courting, and her shop assistant (Dolly has designs of her own on Mr. Vandergelder, you see)."
Cactus Flower,1969,"Comedy, Romance",M,"Toni Simmons believes that the only reason her married lover won't leave his wife is because of the children. In truth, her lover, dentist Julian Winston, doesn't have any children. In fact, Julian doesn't even have a wife - he just tells women he does to avoid getting involved. When Julian does decide to take the plunge with Toni she insists on meeting the first wife and Julian enlists the aid of his long-time nurse/receptionist Stephanie Dickinson to play the part."
Bullitt,1968,"Action, Crime, Mystery",M/PG,"High profile San Francisco Police Lieutenant Frank Bullitt is asked personally by ambitious Walter Chalmers, who is in town to hold a US Senate subcommittee hearing on organized crime, to guard Johnny Ross, a Chicago based mobster who is about to turn evidence against the organization at the hearing. Chalmers wants Ross' safety at all cost, or else Bullitt will pay the consequences. Bullitt and his team of Sergeant Delgetti and Detective Carl Stanton have Ross in protective custody for 48 hours over the weekend until Ross provides his testimony that upcoming Monday. Bullitt's immediate superior, Captain Samuel Bennet, gives Bullitt full authority to lead the case, no questions asked for any move Bullitt makes. When an incident occurs early during their watch, Bullitt is certain that Ross and/or Chalmers are not telling them the full story to protect Ross properly. Without telling Bennet or an incensed Chalmers, Bullitt clandestinely moves Ross while he tries to find out who is after Ross, and why Ross has seemingly made it so easy for ""them"" to find him. As Bullitt enlists the help of his live-in artist girlfriend Cathy over the weekend and as she sees for the first time with what he deals every day, she wonders if he is indeed the man with whom she should be."
Valley of the Dolls,1967,"Drama, Music, Romance",PG-13,"Anne Welles, a bright, brash young New England college grad leaves her Peyton Place-ish small town and heads for Broadway, where she hopes to find an exciting job and sophisticated men. During her misadventures in Manhattan and, later, Hollywood, she shares experiences with two other young hopefuls: Jennifer North, a statuesque, Monroe-ish actress who wants to be accepted as a human being, but is regarded as a sex object by all the men she meets, and Neely O'Hara, a talented young actress who's accused of using devious means by a great older star (Helen Lawson) to reach the top, pulling an ""All About Eve""-type deception in order to steal a good role away from her."
Thoroughly Modern Millie,1967,"Comedy, Musical, Romance",G,"In 1922 New York City, Millie Dillmount and Miss Dorothy Brown are just two of the girls living at the Priscilla Hotel for Single Young Ladies run by Mrs. Meers. Orphaned, Miss Dorothy, just recently arrived, is a naive, old-fashioned girl from a seemingly privileged background who has aspirations to be a stage actress. From more modest means, Millie, in New York for three months, used to be old fashioned, but now has a new modern sensibility and look to match, complete with bobbed hair and dresses with hemlines above the knee. Included in this new modern sensibility is Millie's goal of getting a job as a stenographer, with a quick promotion to being her wealthy boss' ""Mrs."". Love is not to factor into the equation. She believes she's found the right employer in the form of chisel-jawed Trevor Graydon of the Sincere Trust Insurance Company. Millie's pursuit of Mr. Graydon is despite the fact that Mr. Graydon sees her as one of the boys, he has old fashioned sensibilities, and Millie herself has a mutual attraction to another boy named Jimmy Smith. Although she likes Jimmy, Millie feels that Jimmy, as a paper clip salesman with an overwhelming happy-go-lucky attitude, is not driven enough to be husband material. That doesn't stop Jimmy's pursuit of Millie. In her association with Jimmy, Millie meets flamboyant wealthy Renaissance woman Muzzy Van Hossmere. Jimmy's father once worked as Muzzy's gardener. Originally from humble means much like Millie, Muzzy tries to convince Millie that true love will lead to happiness, as that is what happened when she met the now deceased Mr. Van Hossmere who she had no idea was rich. In other goings-on among this new circle of friends, Miss Dorothy leaves New York without a word to anyone except Mrs. Meers. Thinking this situation rather odd, Millie connects Miss Dorothy's leaving with that of other girls previously living at the Priscilla Hotel. With Mr. Graydon's help, Jimmy and Millie try to find out what happened to Miss Dorothy."
I Am Curious (Yellow),1967,Drama,X,"Lena, aged twenty, wants to know all she can about life and reality. She collects information on everyone and everything, storing her findings in an enormous archive. She experiments with relationships, political activism, and meditation. Meanwhile, the actors, director and crew are shown in a humorous parallel plot about the making of the film and their reactions to the story and each other. Nudity, explicit sex, and controversial politics kept this film from being shown in the US while its seizure by Customs was appealed."
In Cold Blood,1967,"Biography, Crime, Drama",R,"In meeting in Kansas, ex-cons Perry Smith and Dick Hickock are breaking several conditions of their respective paroles. The meeting, initiated by Dick, is to plan and eventually carry out a robbery based on information he had received from a fellow inmate about $10,000 cash being locked in a hidden safe in the home of the farming Clutter family of Holcomb, Kansas. After the robbery, they plan on going to Mexico permanently to elude capture by the police. Each brings a necessary personality to the partnership to carry out the plan, Dick who is the brash manipulator, Perry the outwardly more sensitive but unrealistic dreamer with a violent streak under the surface. Perry literally carries all his dreams in a large box he takes with him wherever he goes. The robbery does not go according to plan in any respect, the pair who ultimately hogtie and execute all four members of the Clutter family, only coming away from the home with $43 in cash. As Perry and Dick go on the run, a murder investigation ensues, led by Topeka based Detective Alvin Dewey. If Dewey and his team are able eventually to identify the pair as the murderers and capture them, they, if they understand the two, may get their much needed confessions in dividing and conquering. Perry and Dick's fates may also be regardless of who literally pulled the trigger."
