Title,Year,Genre,Rated,Plot
10,1979,"Comedy, Romance",R,"Forty-two year old famed composer/playwright George Webber is going through a midlife crisis. He is seriously dating thirty-eight year old actress/singer Samantha Taylor, who he loves, although he admits their connection is more intellectual than it is emotional. She, in turn, loves him, despite barely tolerating his often infantile behavior. This behavior includes spying on a neighbor's sexual encounters with a wide array of women, this spying about which the neighbor knows, as he does it himself. Driving one day, George spots a young woman who he believes is the most beautiful creature he's ever seen - an ""eleven"" on a scale of ten, tens which he didn't believe existed before her. Beyond the fact that she is probably half his age, a problem with George's infatuation is that she is just off to her own wedding. George and Sam's relationship takes a hit with an argument which is further exacerbated by a series of misunderstandings. As such, George decides to pursue the woman of his dreams with all his energy. He learns her name is Jenny Miles, now married Jenny Hanley, and he is able to follow her to a Mexican resort where she and her husband David Hanley are honeymooning. In his pursuit of Jenny, his encounter with a lonely woman named Mary Lewis who is vacationing at the resort, and his discussions with his gay lyricist Hugh concerning his relationship with his much younger trophy husband Larry, George may come to a clearer picture of what he is doing in Mexico, and how he truly feels about Sam."
The Wiz,1978,"Adventure, Family, Fantasy",G,"Dorothy, a twenty-four-year-old kindergarten teacher, born; raised; and still working in Harlem, is celebrating Thanksgiving with her extended family, but she doesn't seem to be thankful for much in life. She lives a self-imposed sheltered life; she is shy and unfulfilled. Things change for her when she is caught in a snowstorm while chasing after her dog, Toto. They are transported to the mysterious Land of Oz, where she is informed that the only possible way to find her way back home is through the assistance of the powerful wizard in Emerald City. As she goes searching for him, she befriends some creatures who are facing problems in life just as she is. In their quest to find and get help from the wizard, they also face Evillene, the equally evil sister of Evermean, the wicked witch, whom Dorothy inadvertently killed when she arrived in Oz, and who may be their biggest obstacle in achieving their goals."
Sgt. Pepper's Lonely Hearts Club Band,1978,"Adventure, Comedy, Fantasy",PG,"Ever since they were sent into WWI battle in 1918, Sgt. Pepper and his Lonely Hearts Club Band of Heartland, USA have been spreading the message of joy and love to the world, which has made them and Heartland famous. Upon Sgt. Pepper's death in 1958, the band's instruments have been housed on display at Heartland City Hall as symbols of that love and joy. Before his death, Sgt. Pepper asked his adolescent grandson Billy Shears to take on the reigns of forming his own band to continue to spread the message of joy and love. With Billy's brother Dougie Shears as their manager, Billy, now an adult, and his three best friends - brothers Mark, Dave and Bob Henderson - embark on their lives as a new Lonely Hearts Club Band. They quickly come to the attention of Hollywood music producer B.D. Hoffler Of B.D. (Big Deal) Records. With the boys off to Hollywood to spread the words of joy and love to the world, enter into Heartland the evil and demented Mr. Mustard, an ex-real estate agent who wants to take over Heartland by destroying what made it famous. To do so, he plans to steal the instruments in city hall, and promote the music of the F.V.B. (Future Villain Band) in place of the Lonely Hearts Club Band. With Billy's hometown girlfriend Strawberry Fields at their sides, the boys try to thwart Mustard's dastardly plan at their own peril while still trying to spread their own message of love and joy to the world."
"Same Time, Next Year",1978,"Comedy, Drama, Romance",PG,"A man and woman meet by chance at a romantic inn over dinner. Although both are married to others, they find themselves in the same bed the next morning questioning how this could have happened. They agree to meet on the same weekend each year. Originally a stage play, the two are seen changing, years apart, always in the same room in different scenes. Each of them always appears on schedule, but as time goes on each has some personal crisis that the other helps them through, often without both of them understanding what is going on."
The Last Waltz,1978,"Documentary, Music",PG,"Thanksgiving, 1976, San Francisco's Winterland: the Band performs its last concert after 16 years on the road. Some numbers they do alone, some songs include guest artists from Ronnie Hawkins (their first boss, when they were the Hawks) to Bob Dylan (their last, when as his backup and as a solo group, they came into their own). Scorsese's camera explores the interactions onstage in the making of music. Offstage, he interviews the Band's five members, focusing on the nature of life on the road. The friendships, the harmonies, the hijinks, and the wear and tear add up to a last waltz."
The Hills Have Eyes,1977,"Horror, Thriller",R,"A family going to California accidentally goes through an Air Testing range closed to the public. They crash and are stranded in a desert. They are being stalked by a group of people, which have not emerged into modern times."
Every Which Way But Loose,1978,"Action, Comedy",PG,"Philo Beddoe is an easy-going trucker and a great fist-fighter. With two friends - Orville, who promotes prize-fights for him, and Clyde, the orangutan he won on a bet - he roams the San Fernando Valley in search of cold beer, country music and the occasional punch-up. But he is floored himself by a dainty little country and western singer, who gives him the slip when she realizes he's getting too serious. Phil, Clyde and Orville set off in pursuit, pestered by bikers."
Convoy,1978,"Action, Drama",PG,"While driving through the Arizona desert, Albuquerque based independent trucker Martin Penwald - who goes by the handle ""Rubber Duck"" - along with his fellow truckers ""Pig Pen"" and ""Spider Mike"", are entrapped by unscrupulous Sheriff Lyle ""Cottonmouth"" Wallace using a key tool of the trucker's trade, the citizens' band (CB) radio. Rubber Duck and Cottonmouth have a long, antagonistic history. When this encounter later escalates into a more physical one as Cottonmouth threatens Spider Mike, a man who just wants to get home to his pregnant wife, Rubber Duck and other the truckers involved, including Spider Mike, Pig Pen and ""Widow Woman"", go on the run, figuring the best thing to do being to head to New Mexico to avoid prosecution. Along for the ride is Melissa, a beautiful photographer who just wanted a ride to the airport. As news of what happened spreads over the CB airwaves, other truckers join their convoy as a show of support. Cottonmouth rallies other law enforcement officers throughout the southwest, they who soon learn that stopping Rubber Duck, the face of the now highly public standoff, is not as easy as shooting him and the truck due to his highly explosive cargo. As the standoff escalates, New Mexico Governor Jerry Haskins joins the fray, he who sees the strong public support for the truckers being something on which he can capitalize politically."
The Big Sleep,1978,"Crime, Drama, Mystery",R,"Philip Marlowe is asked by the elderly (and near death) General Sternwood to investigate an attempt at blackmail on one of his daughters. He soon finds that the attempt is halfhearted at best and seems to be more connected with the disappearance of the other daughter's husband, Rusty Regan. Rusty's wife, seems unconcerned with his disappearance, further complicating the mystery. Only General Sternwood seems concerned as mobsters and hired killers continue to appear in the path of the investigation."
Smokey and the Bandit,1977,"Action, Comedy",PG,"Bandit and Cledus are two truck-driving southerners who accept a dare from big-shots Big and Little Enos to pick up a truckload of beer from Texas and return it to them within a specified amount of time. Picking it up is simple enough, but as they are leaving Texas, Bandit unwittingly picks up Carrie, a hitchhiking bride-to-be who just left her groom, Junior, at the altar. Junior, however, is the son of Sheriff Buford T. Justice. And when Buford and Junior discover what has happened, they go on a ""high-speed pursuit"" across the Southeast to catch the bandit."
Slap Shot,1977,"Comedy, Drama, Sport",R,"Located in the US Rust Belt, Charlestown is home of the hapless Chiefs, a losing Federal League hockey team whose games are poorly attended. To make money, the team's unknown owner makes its manager, Joe McGrath, do cheesy publicity much to the players' chagrin. Rumors abound among the players that if the local mill closes, the team will fold. Just before the official announcement is made, the team's aging player/coach, Reggie Dunlop, does get wind that the mill is indeed closing and that this season will be the team's last. Beyond efforts to reconcile with his wife Francine, who loves Reggie but doesn't love his career, Reggie begins to focus on how to renew interest in the team for a possible sale as he knows if the team folds, his hockey career is over. Without telling anyone of his plan, he begins a rumor that the owner is negotiating a sale with a city in Florida. He also decides that ""goon"" hockey - most especially using the untapped talents of the recently acquired childlike but quietly menacing Hanson brothers - is the way to renew local interest. It works as the team begins to attract new fans, sell out games, sell out away games attended largely by their groupies, and win, which does fuel the rumor of a sale. The one team member who doesn't like this new style is Ned Braden, a college graduate who plays the game solely because he loves it. His hockey career is against the wishes of his tomboyish wife, Lily, who hates everything about Charlestown and being a hockey wife. Reggie's goal of winning the league championship and having the team sold takes a turn when he finally meets the team's owner and discovers the owner's motivations. Ned, with his own views of what is right and wrong in hockey, may come up with an unexpected way to achieve all their goals."
Saturday Night Fever,1977,"Drama, Music",R,"Nineteen-year-old Brooklyn native Tony Manero lives for Saturday nights at the local disco, where he's king of the club, thanks to his stylish moves on the dance floor. But outside of the club, things don't look so rosy. At home, Tony fights constantly with his father and has to compete with his family's starry-eyed view of his older brother, a priest. Nor can he find satisfaction at his dead-end job at a small paint store. However, things begin to change when he spies Stephanie Mangano in the disco and starts training with her for the club's dance competition. Stephanie dreams of the world beyond Brooklyn, and her plans to move to Manhattan just over the bridge soon change Tony's life forever."
Rabid,1977,"Horror, Sci-Fi",R,"In Camelford, while swinging his van across a narrow road to make a u-turn, a driver stalls the vehicle that does not restart. Hart Read is driving his motorcycle with his girlfriend Rose and he drives off the road to avoid the collision. Hart suffers minor injuries while Rosie is injured and burned by the flames when the motorcycle explodes. The ambulance from the nearby Keloid Clinic for Plastic Surgery brings the couple and Rose, who is in coma, is submitted to an emergency surgery and to an experimental plastic-surgery technique by Dr. Dan Keloid to retrieve her skin in the chest and abdomen. Hart is discharged but Rose stays in coma in the intensive care unit (ICU) to recover. Out of the blue, Rose awakens from her coma one month later and screams. A nurse helps her but is wounded by her and then he cannot remember what has happened. He is sent to a hospital in Montreal while Rose realizes that she needs to feed with blood. However her victims become zombie-like creatures. Rose flees from the clinic to Montreal to meet her friend Mindy Kent spreading her infection in the big city. Meanwhile Hart is seeking for her."
"Oh, God!",1977,"Comedy, Fantasy",PG,"Married to Bobbie Landers with two preteen children, Adam and Becky Lambert, they living in Tarzana, California, mild manned Jerry Lambert is a hard working assistant manager at a Food World supermarket outlet, he who is always trying to do his best at his job. What is his generally uneventful life takes a turn when he receives a hand delivered note in the mail to attend an interview with God. Believing it a gag from his friend Artie Coogan, Jerry decides to go to the interview based on circumstances which compel him to do so. Based on further circumstances of the interview, Jerry, despite not being a religious person, ultimately does believe that who he meets with - initially only a voice - is indeed God, who eventually does show himself in a physical form to Jerry. God wants Jerry to be his messenger - much like a present day Moses - to pass along to the human race that ""he"" has provided all the necessary components of a successful existence, and it is up to the human race to do with those components as they believe fit to reach that success. God came at this time because of his disappointment with the current state of the world. He also chose Jerry as his messenger because of Jerry being a decent person. Jerry tries to convey the message as best as he can, but runs into one roadblock after another. Once Jerry does gain a wider audience, he is treated as a crazy person and/or a fanatic, those opinions which affect his and his family's life. Jerry believes he has no other option but to continue to do this job for God despite these negative effects. It may take him getting a meeting with so called experts - theologians - before he is taken seriously, or not, as some of those, such as Reverend Willie Williams, God knows is using religion for their own as opposed to societal benefit."
Looking for Mr. Goodbar,1977,"Drama, Romance",R,Theresa is a successful teacher of deaf children during the day but after a short unhappy affair starts to spend her nights cruising bars. Her craving first for sex but later also for drugs leads into increasingly demeaning and dangerous situations completely at odds with her daytime commitment to her children.
Equus,1977,"Drama, Mystery",R,"A psychiatrist, Martin Dysart, investigates the savage blinding of six horses with a metal spike in a stable in Hampshire, England. The atrocity was committed by an unassuming seventeen-year-old stable boy named Alan Strang, the only son of an opinionated but inwardly-timid father and a genteel, religious mother. As Dysart exposes the truths behind the boy's demons, he finds himself face-to-face with his own."
The Duellists,1977,"Drama, War",PG,"Set during the grand, sweeping Napoleonic age, an officer in the French army insults another officer and sets off a life-long enmity. The two officers, D'Hubert and Feraud, cross swords time and time again in an attempt to achieve justice and preserve their honor."
The Pink Panther Strikes Again,1976,"Comedy, Crime",PG,"Charles Dreyfus escapes from the mental asylum and tries to kill Chief Inspector Jacques Clouseau. He doesn't succeed at first, so he takes on another strategy, namely to build a Doomsday machine and demand that someone else kills Jacques Clouseau, or Dreyfus will use the machine to wipe out whole cities and even whole countries... With about 22 assassins from all over the globe on his tail, Clouseau decides to find Dreyfus alone and put him back in the mental asylum."
The Man Who Fell to Earth,1976,"Sci-Fi, Drama",R,"Thomas Jerome Newton is a humanoid alien who comes to Earth to get water for his dying planet. He starts a high technology company to get the billions of dollars he needs to build a return spacecraft, and meets Mary-Lou, a girl who falls in love with him. He does not count on the greed and ruthlessness of business here on Earth, however."
The Tenant,1976,"Drama, Thriller",R,"In Paris, the shy bureaucrat Trelkovsky rents an old apartment without bathroom where the previous tenant, the Egyptologist Simone Choule, committed suicide. The unfriendly concierge (Shelley Winters) and the tough landlord Mr. Zy establish stringent rules of behavior and Trelkovsky feels ridden by his neighbors. Meanwhile he visits Simone in the hospital and befriends her girlfriend Stella. After the death of Simone, Trelkovsky feels obsessed for her and believes his landlord and neighbors are plotting a scheme to force him to also commit suicide."
Bugsy Malone,1976,"Comedy, Crime, Family",G,"A gangster movie where all the gangsters are played by children. Instead of real bullets they use ""splurge guns"" that cover the victim in cream. The story tells of the rise of ""Bugsy Malone"" and the battle for power between ""Fat Sam"" and ""Dandy Dan""."
The Big Bus,1976,"Comedy, Action",PG,"The ultimate disaster film parody. A nuclear powered bus is going Non-stop from New York to Denver and is plagued by disasters due to the machinations of a mysterious group allied with the Oil lobby. When the driver is injured a washed up, down on his luck, but used to be great type, who as it happens, used to be engaged to the inventor's daughter is brought in to drive the giant bus which includes a one lane swimming pool and a one lane bowling alley."
All the President's Men,1976,"Biography, Drama, History",PG,"In the run-up to the 1972 elections, Washington Post reporter Bob Woodward covers what seems to be a minor break-in at the Democratic Party National headquarters. He is surprised to find top lawyers already on the defense case, and the discovery of names and addresses of Republican fund organizers on the accused further arouses his suspicions. The editor of the Post is prepared to run with the story and assigns Woodward and Carl Bernstein to it. They find the trail leading higher and higher in the Republican Party, and eventually into the White House itself."
Rollerball,1975,"Action, Sci-Fi, Sport",R,"In a futuristic society where corporations have replaced countries, the violent game of Rollerball is used to control the populace by demonstrating the futility of individuality. However, one player, Jonathan E., rises to the top, fights for his personal freedom, and threatens the corporate control."
The Story of O,1975,Drama,NC-17,"The beautiful O is taken by her boyfriend, Rene, to a bizarre retreat, where she is trained in bondage and sexual perversion. Rene discharges a personal debt by transferring possession of O to his step-brother, Sir Stephen..."
The Giant Spider Invasion,1975,"Horror, Sci-Fi",PG,"A black hole hits North Wisconsin and opens a door to other dimensions. Giant 15 meter spiders emerge from it, who have an appetite for human flesh! Dr. Jenny Langer and Dr. Vance from the NASA try to save the world."
Breakout,1975,"Action, Adventure, Drama",PG,"Jay Wagner is framed by the mob and sent to prison in Mexico. His wife, Ann tries to get him out. She then turns to bush pilot Nick Colton for help. And Colton is all to eager to do it. But the men who framed Jay will do what they have to make sure he doesn't escape."
Bite the Bullet,1975,"Action, Adventure, Western",PG,"At the beginning of the 20th century, a newspaper organizes an endurance horse race: 700 miles to run in a few days. 9 adventurers are competing, among them a woman, Miss Jones, a Mexican, an Englishman, a young cowboy, an old one and two friends, Sam Clayton and Luke Matthews. All those individualists will learn to respect each other."
A Woman Under the Influence,1974,"Drama, Romance",R,"Peter Falk is a blue collar man trying to deal with his wife's mental instability. He fights to keep a semblance of normality in the face of her bizarre behavior, but when her actions affect their children, he has her committed."
Lenny,1974,"Biography, Drama",R,Interview-style biography of controversial and pioneering stand-up comedian Lenny Bruce. The film traces Bruce from his beginnings as a Catskills comic to his later underground popularity based on his anti-establishment politics and his scatological humor.
The Gambler,1974,"Crime, Drama",R,"Axel Freed, a College Professor and very successful at his job, is a gambling junkie who wins big but loses it all at the same time. He borrowed from his girlfriend, his wealthy mother, and last but not least a Loan Shark from the Mob. It just gets worse for him because he loses all his cash each time and acts like it doesn't matter. But when his Girlfriend decides to leave him, his Mom decides to disown him, and the Mob wants to kill him, Axel decides to make a big score to win big and pay off everyone to stay alive and keep his dignity and come out ahead."
The Front Page,1974,"Comedy, Drama, Romance",PG,"When Hildy Johnson, the top reporter of a Chicago newspaper announces that he is quitting to get married, his editor, Walter Burns desperately tries to change his mind. When denial, cursing, and luring don't work, Walter resorts to tricks. It's the day before a supposed communist is to be hanged, and all Chicago waits with baited breath. Meanwhile, each of the papers has a man on the story trying to get a scoop or angle for themselves. With a train to catch at midnight to join his fiancé, Hildy is at first not interested, but events and his own habits work against him as the day unfolds, and he can't help but get roped in, especially when the man to be executed escapes and then almost literally falls into his lap."
Black Christmas,1974,"Horror, Mystery, Thriller",R,"It's time for Christmas break, and the sorority sisters make plans for the holiday, but the strange anonymous phone calls are beginning to put them on edge. When Clare disappears, they contact the police, who don't express much concern. Meanwhile Jess is planning to get an abortion, but boyfriend Peter is very much against it. The police finally begin to get concerned when a 13-year-old girl is found dead in the park. They set up a wiretap to the sorority house, but will they be in time to prevent a sorority girl attrition problem?"
Beautiful People,1974,"Comedy, Documentary",G,Hilarious documentary on the wildlife of the Namib Desert.
Amarcord,1973,"Comedy, Drama",R,"One year in a small northern Italian coastal town in the late 1930s is presented. The slightly off-kilter cast of characters are affected by time and location, the social mores dictated largely by Catholicism and the national fervor surrounding Il Duce aka Benito Mussolini and Fascism. The stories loosely center on a mid-teen named Titta and his household including his adolescent brother, his ever supportive mother who is always defending him against his father, his freeloading maternal Uncle Lallo, and his paternal grandfather who slyly has eyes and hands for the household maid. Other townsfolk include: Gradisca, the town beauty, who can probably have any man she wants, but generally has no one as most think she out of their league; Volpina, the prostitute; Giudizio, the historian; a blind accordionist; and an extremely buxom tobacconist. The several vignettes presented include: the town bonfire in celebration of spring; life at Titta's school with his classmates and teachers; Aurelio, Titta's father, at his beachfront construction worksite and his and his workmates' encounter with Volpina; Titta's confessions to the priest about his burgeoning sexuality; Aurelio being questioned by authorities about his anti-Fascist leanings; a fantasy sequence at the luxurious Grand Hotel; a family outing with Aurelio's institutionalized brother, Teo; many townsfolk embarking on a sail to witness a marine event passing by their town; an annual car race; Titta's fantasy encounter with the tobacconist after closing hours come true; events surrounding the big snowfall that year, including a family tragedy; and an event centering on Gradisca and her future."
White Lightning,1973,"Action, Drama, Crime",PG,An ex con teams up with federal agents to help them with breaking up a moonshine ring.
Last Tango in Paris,1972,"Drama, Romance",NC-17,"While looking for an apartment, Jeanne, a beautiful young Parisienne, encounters Paul, a mysterious American expatriate mourning his wife's recent suicide. Instantly drawn to each other, they have a stormy, passionate affair, in which they do not reveal their names to each other. Their relationship deeply affects their lives, as Paul struggles with his wife's death and Jeanne prepares to marry her fiance, Tom, a film director making a cinema-verite documentary about her."
