Title,Year,Rated,Genre(s),Plot
The Amazing Spider-Man 2,2014,PG-13,"Action, Adventure, Sci-Fi","We've always known that Spider-Man's most important conflict has been within himself: the struggle between the ordinary obligations of Peter Parker and the extraordinary responsibilities of Spider-Man. But in The Amazing Spider-Man 2, Peter Parker finds that his greatest battle is about to begin. It's great to be Spider-Man. For Peter Parker, there's no feeling quite like swinging between skyscrapers, embracing being the hero, and spending time with Gwen. But being Spider-Man comes at a price: only Spider-Man can protect his fellow New Yorkers from the formidable villains that threaten the city. With the emergence of Electro, Peter must confront a foe far more powerful than he. And as his old friend, Harry Osborn, returns, Peter comes to realize that all of his enemies have one thing in common: Oscorp."
The Sessions,2012,R,"Biography, Comedy, Drama","At the age of 38, Mark O'Brien, a man who uses an iron lung, decides he no longer wishes to be a virgin. With the help of his therapist and his priest, he contacts Cheryl Cohen-Greene, a professional sex surrogate and a typical soccer mom with a house, a mortgage and a husband. Inspired by a true story, The Sessions, follows the fascinating relationship which evolves between Cheryl and Mark as she takes him on his journey to manhood."
Song of the Sea,2014,PG,"Animation, Adventure, Drama","Saoirse is a child who is the last of the selkies, women in Irish and Scottish legends who transform from seals into people. She escapes from her grandmother's home to journey to the sea and free fairy creatures trapped in the modern world."
Safety Not Guaranteed,2012,R,"Comedy, Drama, Romance","Darius is a young intern at a Seattle-based magazine and jumps at the chance to investigate the author of a classified ad seeking someone to travel back in time with. Along with Jeff, the staff writer, and Arnau, a fellow intern, the three go on a road trip to a coastal town. While Jeff just wants to chase after his high school crush and Arnau wants some kind of life experience, Darius spends her time with Kenneth, a man who believes that he has built a time machine. The closer they become and the more they understand about each other, the less clear it becomes if Kenneth is just crazy or if he actually is going to successfully travel back in time."
Undefeated,2011,PG-13,"Documentary, Sport","A documentary that follows the Manassas Tigers football team, a severely underfunded and underprivileged football team -- who were even hired out as a practice team for more successful schools -- as they reverse their fortunes, thanks to coach Bill Courtney."
Turbo,2013,PG,"Animation, Adventure, Comedy","After a freak accident infuses him with the power of super-speed, Turbo kicks into overdrive and embarks on an extraordinary journey to achieve the seemingly impossible: competing in the world's fastest race, the Indianapolis 500. With the help of his tricked-out streetwise snail crew, this ultimate underdog puts his heart and shell on the line to prove that no dream is too big, and no dreamer too small."
To Rome with Love,2012,R,"Comedy, Romance","In Rome, the America tourist Hayley meets the local lawyer Michelangelo on the street and soon they fall in love with each other. Hayley's parents, the psychiatrist Phyllis and the retired music producer Jerry, travel to Rome to meet Michelangelo and his parents. When Jerry listens to Michelangelo's father Giancarlo singing opera in the shower, he is convinced that he is a talented opera singer. But there is a problem: Giancarlo can only sing in the shower. The couple Antonio and Milly travel to Rome to meet Antonio's relatives that belong to the high society. Milly goes to the hairdresser while Antonio waits for her in the room. Milly gets lost in Rome and the prostitute Anna mistakenly goes to Antonio's room. Out of the blue, his relatives arrive in the room and they believe Anna is Antonio's wife. Meanwhile the shy Milly meets her favorite actor Luca Salta (Antonio Albanese) and goes to his hotel room ""to discuss about movies"". One day, the middle-class clerk Leopoldo becomes a celebrity and is hunted by the paparazzo. A couple of days later, he is forgotten by the media. The American architect John travels to Rome with his wife and feels nostalgic since he lived in the city thirty years ago when he was a student. He meets the student of architecture Jack, who lives on the same street that John had lived, and he invited to drink a coffee at his house. Jack lives with his girlfriend Sally (Greta Gerwig) that invites her best friend Monica to stay with them in their house. But soon Jack has a crush on Monica."
Resident Evil: Retribution,2012,R,"Action, Horror, Sci-Fi","Alice awakes at home with her daughter Becky and her husband. But soon she realizes that she is actually in an Umbrella Corporation's underground facility. Out of the blue, the computer security system shuts-down and Alice flees to the central control room of the facility. She meets Ada Wong, who works with Albert Wesker, and she learns that a five-man team has been sent by Wesker to rescue them. However, the Red Queen sends Jill Valentine and Rain to hunt them down."
End of Watch,2012,R,"Action, Crime, Drama","In South Central Los Angeles, street cops Brian and Mike are partners - balls-out cowboys patrolling the streets as Latino gangs are in a power struggle with Blacks. Brian and Mike get lucky a couple of times, making big drug and human-trafficking busts, so a Mexican cartel orders their deaths. We meet Mike's pregnant wife (whom he married out of high school) and watch Brian's search for a soul mate. There are internal squabbles within the ranks of the LAPD and lots of squad-car conversation. Can the lads escape the cartel's murderous reach?"
Percy Jackson: Sea of Monsters,2013,PG,"Adventure, Family, Fantasy","In this retelling of Rick Riordans book, ""The Sea of Monsters"", Percy Jackson, accompanied by his friends Annabeth Chase, Clarisse La Rue and Tyson, his half brother, goes on a journey to the Sea of Monsters to retrieve the Golden Fleece and save Camp Half-Blood."
Snow White,2012,PG-13,"Drama, Fantasy","A band of bullfighting dwarfs save the life of a young woman with amnesia. They end up taking her under their wing when they find out that she has seemingly natural skills as a bullfighter, upon which they can capitalize not only for their act but for her own personal gain. As she does not know her name or background, the dwarfs coin her Blancanieves, after the famed fairy tale. What they are all unaware of is that she is really Carmen, the daughter of the once great matador, Antonio Villalta. On the day Carmen was born, her father suffered a career ending accident, and her mother died in childbirth. Her father quickly remarried his nurse, the evil Encarna. Although raised by her grandmother during her early years, Carmen, following the death of her grandmother, went to live with Encarna while an adolescent, Encarna who treated her as a slave. Carmen eventually found her disabled father, who was hidden away and treated poorly by Encarna. In the meantime, Encarna was cavorting with the household chauffeur while living off her husband's riches. Antonio did pass along to Carmen the art of bullfighting. As Blancanieves teeters on the brink of fame as a matador, her life may be placed in jeopardy if Encarna learns who she is, as Encarna believed Carmen was dead since she was the one who ordered her murder at the hands of the chauffeur."
You're Next,2011,R,"Horror, Thriller","When a gang of masked, ax-wielding murderers descend upon the Davison family reunion, the hapless victims seem trapped... until an unlikely guest of the family proves to be the most talented killer of all."
Django Unchained,2012,R,"Drama, Western","A German dentist buys the freedom of a slave and trains him with the intent to make him his deputy bounty hunter. Instead, he is led to the site of the slave's wife who belongs to a ruthless plantation owner."
Why Stop Now?,2012,R,"Comedy, Drama","The story of Eli Smith (Jesse Eisenberg), a piano prodigy, dealing with his troubled mother, Penny (Melissa Leo), and enlisting help from a hapless drug dealer, Sprinkles (Tracy Morgan), on the day he has an audition for a prestigious music program. Events spiral comically out of control as this gang of misfits faces the mistakes of the past, the challenges of the future, and the possibilities of love."
The Loft,2014,R,"Mystery, Romance, Thriller","The architect Vincent Stevens; the psychiatrist Chris Vanowen; the real estate agents Luke Seacord and Marty Landry; and Chris' half-brother Philip Trauner are married and best friends. Vincent has designed a brand new building and proposes that he and his friends share one of the wonderful penthouse lofts. This would allow them to hook up with other women without worrying about hotel charges showing up on their credit cards. When they discover the body of a beautiful woman cuffed on the bed in the loft, they argue over whom is responsible and secrets are disclosed affecting their friendship."
Game Change,2012,TV-MA,"Biography, Drama, History","Summer, 2008: John McCain secures the nomination, but polls behind Barack Obama. Strategist Steve Schmidt suggests a game changer: picking a conservative female with media savvy, unknown Alaska governor Sarah Palin, as vice president. She's an immediate hit and a quick study - the gap closes. Then, Tina Fey's impersonation, a raft of criticism, and missing her family send Palin into a near-catatonic state: she doesn't prepare for her Katie Couric interview and bombs. Schmidt searches for an answer: don't expect her to learn the issues, but give her a script. Palin does well in the debate with Biden; she finds her voice, goes off script, and goes rogue. A mistake?"
Bad Karma,2012,R,Thriller,Reformed criminal gets blackmailed into doing one last job when former partner crawls out of the woodwork.
Ai Weiwei: Never Sorry,2012,R,Documentary,"AI WEIWEI: NEVER SORRY is the first feature-length film about the internationally renowned Chinese artist and activist, Ai Weiwei. In recent years, Ai has garnered international attention as much for his ambitious artwork as his political provocations. AI WEIWEI: NEVER SORRY examines this complex intersection of artistic practice and social activism as seen through the life and art of China's preeminent contemporary artist. From 2008 to 2010, Beijing-based journalist and filmmaker Alison Klayman gained unprecedented access to Ai Weiwei. Klayman documented Ai's artistic process in preparation for major museum exhibitions, his intimate exchanges with family members and his increasingly public clashes with the Chinese government. Klayman's detailed portrait of the artist provides a nuanced exploration of contemporary China and one of its most compelling public figures."
Inescapable,2012,R,"Action, Drama, Mystery","One afternoon, on a typical day at work, Adib is confronted with devastating news: His eldest daughter, Muna, has gone missing in Damascus. Now Adib, who has not been back in over 20 years, must return to Syria and deal with his secret past in order to find her. Inescapable is a thriller about a father's desperate search for his daughter and the chaos of the Middle East he left behind."
Captain America: The Winter Soldier,2014,PG-13,"Action, Adventure, Sci-Fi","For Steve Rogers, awakening after decades of suspended animation involves more than catching up on pop culture; it also means that this old school idealist must face a world of subtler threats and difficult moral complexities. That becomes clear when Director Nick Fury is killed by the mysterious assassin, the Winter Soldier, but not before warning Rogers that SHIELD has been subverted by its enemies. When Rogers acts on Fury's warning to trust no one there, he is branded as a traitor by the organization. Now a fugitive, Captain America must get to the bottom of this deadly mystery with the help of the Black Widow and his new friend, The Falcon. However, the battle will be costly for the Sentinel of Liberty, with Rogers finding enemies where he least expects them while learning that the Winter Soldier looks disturbingly familiar."
Divergent,2014,PG-13,"Adventure, Mystery, Sci-Fi","Set in a futuristic dystopia where society is divided into five factions that each represent a different virtue, teenagers have to decide if they want to stay in their faction or switch to another - for the rest of their lives. Tris Prior makes a choice that surprises everyone. Then Tris and her fellow faction-members have to live through a highly competitive initiation process to live out the choice they have made. They must undergo extreme physical and intense psychological tests, that transform them all. But Tris has a secret that she is Divergent, which means she doesn't fit into any one group. If anyone knew, it would mean a certain death. As she discovers a growing conflict that threatens to unravel her seemingly peaceful society, this secret might help her save the people she loves... or it might destroy her."
Ruby Sparks,2012,R,"Comedy, Drama, Fantasy","Calvin is a genius novelist who begins to type a new novel on his manual typewriter about Ruby, his dream girl. He can't believe his eyes, because the next day, Ruby becomes a real person, and they begin to have a beautiful relationship together. If the relationship isn't perfect, all Calvin has to do is simply type the words on the page and Ruby's actions change to what he needs."
Gone,2012,PG-13,"Drama, Mystery, Thriller","When her sister disappears, Jill is convinced the serial killer who kidnapped her two years ago has returned, and she sets out to once again face her abductor."
Winter's Tale,2014,PG-13,"Drama, Fantasy, Mystery","New York City is subsumed in arctic winds, dark nights, and white lights, its life unfolds, for it is an extraordinary hive of the imagination, the greatest house ever built, and nothing exists that can check its vitality. One night in winter, Peter Lake (Colin Farrell), orphan and master-mechanic, attempts to rob a fortress-like mansion on the Upper West Side. Though he thinks the house is empty, the daughter of the house is home. Thus begins the love between Peter, an Irish burglar in his early 20's, and Beverly Penn (Jessica Brown Findlay), a young girl, who is dying."
Passion,2012,R,"Drama, Horror, Mystery",The rivalry between the manipulative boss of an advertising agency and her talented protégée escalates from stealing credit to public humiliation to murder.
Évocateur: The Morton Downey Jr. Movie,2012,R,Documentary,"Long before O'Reilly and Beck, Morton Downey, Jr., was tearing up the talk-show format with his divisive populism. Between the fistfights, rabid audience, and Mort's cigarette smoke always ""in your face,"" The Morton Downey Jr. Show was billed as ""3-D television,"" ""rock and roll without the music."" Évocateur meditates on the hysteria that ended the '80s and ultimately its most notorious agitator."
RED 2,2013,PG-13,"Action, Comedy, Crime","Retired CIA agent Frank Moses is in love with Sarah Ross and enjoying their normal life. Out of the blue, Marvin Boggs meets Frank in the supermarket and tells that Wikileaks has released the information that they had participated and know the whereabouts of the Nightshade, a portable nuclear weapon that was smuggled in pieces and hidden in Russia. Now the top agents in the world are under contract to seek them out to discover where Nightshade is. The trio travels to Paris and teams-up with the Russian Katja to track down the former Russian Agent 'The Frog' to get more information about the operation. They learn that the brilliant inventor Dr. Edward Bailey might know where the weapon is. They discover that Bailey has been interned in an asylum in London by the MI-6 for thirty-two years and the British Victoria joins the team. They rescue Bailey and find that the nuclear device is hidden in the Kremlin. Soon the dangerous South Korean Han joins the group expecting to retrieve the weapon. But dangerous killer Jack Horton is hunting Frank down and will not stop until he recovers the nuclear bomb."
Nebraska,2013,R,"Adventure, Comedy, Drama","""NEBRASKA"" is a father and son road trip, from Billings, Montana to Lincoln, Nebraska that gets waylaid at a small town in central Nebraska, where the father grew up and has scores to settle. Told with deadpan humor and a unique visual style, it's ultimately the story of a son trying to get through to a father he doesn't understand."
The Place Beyond the Pines,2012,R,"Crime, Drama, Thriller","A mysterious and mythical motorcycle racer, Luke, (Ryan Gosling) drives out of a traveling carnival globe of death and whizzes through the backstreets of Schenectady, New York, desperately trying to connect with a former lover, Romina, (Eva Mendes) who recently and secretly gave birth to the stunt rider's son. In an attempt to provide for his new family, Luke quits the carnival life and commits a series of bank robberies aided by his superior riding ability. The stakes rise as Luke is put on a collision course with an ambitious police officer, Avery Cross, (Bradley Cooper) looking to quickly move up the ranks in a police department riddled with corruption. The sweeping drama unfolds over fifteen years as the sins of the past haunt the present days lives of two high school boys wrestling with the legacy they've inherited. The only refuge is found in the place beyond the pines."
After Earth,2013,PG-13,"Action, Adventure, Sci-Fi","One thousand years after cataclysmic events forced humanity's escape from Earth, Nova Prime has become mankind's new home. Legendary General Cypher Raige returns from an extended tour of duty to his estranged family, ready to be a father to his 13-year-old son, Kitai. When an asteroid storm damages Cypher and Kitai's craft, they crash-land on a now unfamiliar and dangerous Earth. As his father lies dying in the cockpit, Kitai must trek across the hostile terrain to recover their rescue beacon. His whole life, Kitai has wanted nothing more than to be a soldier like his father. Today, he gets his chance."
Admission,2013,PG-13,"Comedy, Drama, Romance","Straitlaced Princeton University admissions officer Portia Nathan (Tina Fey) is caught off-guard when she makes a recruiting visit to an alternative high school overseen by her former college classmate, the freewheeling John Pressman (Paul Rudd). Pressman has surmised that Jeremiah (Nat Wolff), his gifted yet very unconventional student, might well be the son that Portia secretly gave up for adoption many years ago. Soon, Portia finds herself bending the rules for Jeremiah, putting at risk the life she thought she always wanted -- but in the process finding her way to a surprising and exhilarating life and romance she never dreamed of having."
Unbroken,2014,PG-13,"Biography, Drama, Sport","The life of Louis Zamperini, an Olympic athlete who joined the armed forces during the second world war. Only to be captured by the Japanese navy after a plane crash in the Pacific. During his capture, Louie must continue his fight by surviving through the war."
That Awkward Moment,2014,R,"Comedy, Romance","Jason has just been dumped, but he didn't even realize they were going out. Meanwhile, Mikey's wife has just asked him for a divorce, and perpetually single Daniel is still single. The three best friends are determined to stay single together and just have fun. But then Jason meets Ellie who just might be perfect for him, Daniel starts to realize that his gal pal Chelsea might be perfect for him, and Mikey has always thought that his wife was perfect for him. The boys are going to have to juggle their single life with their romantic entanglements and it's going to get awkward."
American Hustle,2013,R,"Crime, Drama","A fictional film set in the alluring world of one of the most stunning scandals to rock our nation, American Hustle tells the story of brilliant con man Irving Rosenfeld (Christian Bale), who along with his equally cunning and seductive British partner Sydney Prosser (Amy Adams) is forced to work for a wild FBI agent Richie DiMaso (Bradley Cooper). DiMaso pushes them into a world of Jersey powerbrokers and mafia that's as dangerous as it is enchanting. Jeremy Renner is Carmine Polito, the passionate, volatile, New Jersey political operator caught between the con-artists and Feds. Irving's unpredictable wife Rosalyn (Jennifer Lawrence) could be the one to pull the thread that brings the entire world crashing down."
From Up on Poppy Hill,2011,PG,"Animation, Drama, Family",A group of Yokohama teens look to save their school's clubhouse from the wrecking ball in preparations for the 1964 Tokyo Olympics.
While We're Young,2014,R,"Comedy, Drama, Mystery","Josh Srebnick is 44. He is married to Cornelia, 43, the daughter of Leslie Breitbart, a respected documentary filmmaker. The couple lives comfortably in New York Village and gives the image of happiness. But things are not so rosy as they look: on a personal level, their relationships have been cooling down while they suffer from not having children. On a professional plane, things have deteriorated as well. Josh, who is also a documentary filmmaker like his father-in-law, has lost inspiration: he has been grappling with his last movie for eight years now without being able to complete it. To be true, Josh goes nowhere and his marriage is on the rocks. Things start changing when Josh and Cornelia meet another married pair: Jamie and Darby, a generation younger, express their admiration for Josh (Jamie wishing to become a documentary filmmaker himself). Plus, they are much cooler, smarter and more uninhibited than the two forty-odds. Could they help Josh and Cornelia to revive their couple? Could they give Josh an extra boost of energy to make a fresh start in his art?"
Inherent Vice,2014,R,"Comedy, Crime, Drama","During the psychedelic 60s and 70s Larry ""Doc"" Sportello is surprised by his former girlfriend and her plot for her billionaire boyfriend, his wife, and her boyfriend. A plan for kidnapping gets shaken up by the oddball characters entangled in this groovy kidnapping romp based upon the novel by Thomas Pynchon."
The Maze Runner,2014,PG-13,"Action, Mystery, Sci-Fi","Awakening in an elevator, remembering nothing of his past, Thomas emerges into a world of about thirty teenage boys, all without past memories, who have learned to survive under their own set of rules in a completely enclosed environment, subsisting on their own agriculture and supplies. With a new boy arriving every thirty days, the group has been in ""The Glade"" for three years, trying to find a way to escape through the Maze that surrounds their living space (patrolled by cyborg monsters named 'Grievers'). They have begun to give up hope when a comatose girl arrives with a strange note, and their world begins to change with the boys dividing into two factions: those willing to risk their lives to escape and those wanting to hang onto what they've got and survive."
John Dies at the End,2012,R,"Comedy, Horror, Sci-Fi","It's a drug that promises an out-of-body experience with each hit. On the street they call it Soy Sauce, and users drift across time and dimensions. But some who come back are no longer human. Suddenly a silent otherworldly invasion is underway, and mankind needs a hero. What it gets instead is John and David, a pair of college dropouts who can barely hold down jobs. Can these two stop the oncoming horror in time to save humanity? No. No, they can't."
Anna Karenina,2012,R,"Drama, Romance","In 1874, in the Imperial Russia, the aristocratic Anna Karenina travels from Saint Petersburg to Moscow to save the marriage of her brother Prince Oblonsky, who had had a love affair with his housemaid. Anna Karenina has a cold marriage with her husband, Count Alexei Karenin, and they have a son. Anna meets the cavalry officer Count Vronsky at the train station and they feel attracted by each other. Soon she learns that Vronsky will propose to Kitty, who is the younger sister of her sister-in-law Dolly. Anna satisfactorily resolves the infidelity case of her brother and Kitty invites her to stay for the ball. However, Anna Karenina and Vronsky dance in the ball, calling the attention of the conservative society. Soon they have a love affair that will lead Anna Karenina to a tragic fate."
Jiro Dreams of Sushi,2011,PG,Documentary,"In the basement of a Tokyo office building, 85 year old sushi master Jiro Ono works tirelessly in his world renowned restaurant, Sukiyabashi Jiro. As his son Yoshikazu faces the pressures of stepping into his father's shoes and taking over the legendary restaurant, Jiro relentlessly pursues his lifelong quest to create the perfect piece of sushi."
Wreck-It Ralph,2012,PG,"Animation, Adventure, Comedy","Wreck-It Ralph longs to be as beloved as his game's perfect Good Guy, Fix-It Felix. Problem is, nobody loves a Bad Guy. But they do love heroes... so when a modern, first-person shooter game arrives featuring tough-as-nails Sergeant Calhoun, Ralph sees it as his ticket to heroism and happiness. He sneaks into the game with a simple plan -- win a medal -- but soon wrecks everything, and accidentally unleashes a deadly enemy that threatens every game in the arcade. Ralph's only hope? Vanellope von Schweetz, a young troublemaking ""glitch"" from a candy-coated cart racing game who might just be the one to teach Ralph what it means to be a Good Guy. But will he realize he is good enough to become a hero before it's ""Game Over"" for the entire arcade?"
